Session:,Best Practices in Educational Technology II,Contributed,Title:,Does Electronic Homework Impact Students' Performance in College Physics?,Meeting:,"2013 Summer Meeting: Portland, Oregon",Location:,N/A,Date:,,<b> Time: </b>,3:10PM,<b> Author: </b>,"Emily S. Roth, Bradley University",<b> Co-Author(s): </b>,"Kevin R. Kimberlin, Jose Lozano","The purpose of this study is to get a better understanding of the impact that online homework versus hard-copy homework assignments have on performance in introductory algebra-based physics at Bradley University. An initial step in this study was to examine online homework effectiveness by analyzing factors such as homework completion time, homework scores, individual exam scores, average test scores, and initial Force Concepts Inventory (FCI) scores (N=29, Fall 2012), taught in the traditional format. In the spring of 2013 two sections of the course were conducted in a similar format; however one section used handwritten assignments, while the second used online assignments from Mastering Physics with the same problems (N~27). The results are presented in this work.",sponsored by Kevin Kimberlin
Session:,Affective Issues and How They Impact Equity in the Classroom,Contributed,Title:,Inductive Reasoning: Equalizing Opportunities for Linguistically Diverse Students,Meeting:,"2013 Summer Meeting: Portland, Oregon",Location:,N/A,Date:,,<b> Time: </b>,1:40PM,<b> Author: </b>,"Shelly N. Belleau, University of Colorado, Boulder",<b> Co-Author(s): </b>,None,"Students learning English as a second language tend to underperform their English-speaking peers on traditional assessments, contributing to the issue of underrepresentation in STEM fields. This research investigates the extent to which curricula designed around evidence-based inductive reasoning, such as Physics and Everyday Thinking, can equalize opportunities for linguistically diverse students. Specifically, we evaluate how linguistically diverse learners and native English speakers perform in four categories: (i) asking questions and defining problems; (ii) developing and using models; (iii) constructing explanations and designing solutions; and (iv) engaging in evidence-based argumentation. Preliminary results indicate that students from linguistically diverse and English-speaking backgrounds demonstrated comparable growth in these scientific practices within the inductive reasoning environment. Links between this growth and the particularities of this learning environment are considered. These include maintaining space for making sense of natural phenomena by integrating everyday language with the technical language and practices of the discipline.",None
Session:,Teachers in Residence and Master Teachers in Teacher Preparation,Contributed,Title:,"The Eclectic, Dynamic PhysTec Program at Towson University",Meeting:,"2013 Summer Meeting: Portland, Oregon",Location:,N/A,Date:,,<b> Time: </b>,9:00AM,<b> Author: </b>,"Lisa S. Rainey, Towson University",<b> Co-Author(s): </b>,None,"There are many dimensions to the PhysTec Teacher in Residence (TIR) position. The range of goals and activities, over the course of the year, was eclectic. The five areas highlighted include: outreach to the high school physics community to recruit for secondary education; mentoring faculty members and Learning Assistants (LA's) to ensure active learning approaches are valued and implemented; community college articulation; support for physics student interns/student teachers; organizing activities/training for LA's which included inquiry based learning, and questioning and problem-solving techniques.",None
Session:,Introductory Courses,Contributed,Title:,Case Studies and Community-based Inquiry in Introductory Physics,Meeting:,"2013 Summer Meeting: Portland, Oregon",Location:,N/A,Date:,,<b> Time: </b>,10:40AM,<b> Author: </b>,"Bruce Palmquist, Central Washington University",<b> Co-Author(s): </b>,Andrew A. Piacsek,"Students often complain that the physics in their textbook is not relevant in the real world. In addition, national stakeholders are concerned with the inability of college students to think critically. The authors set out to address both issues in their introductory physics course covering energy, waves, and simple harmonic motion. Using the interrupted case study approach, students were guided through papers from sports science and biology that utilized physics principles from the course. Students iteratively inferred and analyzed different aspects of each paper, reporting their ideas at each step. Using a community-based inquiry project, students analyzed sound level data from local wind turbines and shared their results with the community. The instructors developed a Google Docs template to facilitate the inquiry process. Case studies, templates, and rubrics will be displayed at this presentation. Student pre- and post-test scores on a critical thinking exam will also be shared.",None
Session:,Physics Majors: High School to Doctorate,Contributed,Title:,Supporting Students in their Transition from High School to University,Meeting:,"2013 Summer Meeting: Portland, Oregon",Location:,N/A,Date:,,<b> Time: </b>,4:00PM,<b> Author: </b>,"Dimitri R. Dounas-Frazer, Compass Project at UC Berkeley",<b> Co-Author(s): </b>,"Jacob Lynn, Nathaniel Roth, Anna M Zaniewski","Given the size of the UC Berkeley Physics Department, integrating with the community and developing a physics network can be a daunting task for incoming freshmen. To fold students into the Physics Department and promote retention of students from all backgrounds, the Compass Project offers a wide range of services, including a residential summer program for incoming freshmen. The Compass Summer Program incorporates aspects of Modeling Instruction, Complex Instruction, and philosophies which have developed organically within our organization. We describe our pedagogical approach in the context of the 2011 program on non-Newtonian fluids, and we show that the Compass Summer Program is having a positive impact on retention, diversity, and community in the Berkeley Physics Department.",None
Session:,PER: Problem Solving,Contributed,Title:,Influence of Visual Cueing and Feedback on Physics Problem Solving,Meeting:,"2013 Summer Meeting: Portland, Oregon",Location:,N/A,Date:,,<b> Time: </b>,2:40PM,<b> Author: </b>,"Amy Rouinfar, Kansas State University",<b> Co-Author(s): </b>,"Jeffrey Murray, Adam M. Larson, Lester C. Loschky, N. Sanjay Rebello","Research has demonstrated that using visual cues to focus students' attention on relevant areas in diagrams and animations can increase comprehension and facilitate problem solving. In this study we investigate the effectiveness of visual cues and correctness feedback in conceptual physics problems containing a diagram with respect to comprehension and transfer of physics concepts. Students enrolled in an introductory physics course were individually interviewed. During each interview students worked through sets of problems containing a diagram. Each problem set contained an initial problem, six isomorphic training problems, and a transfer problem. Answers and explanations were given verbally. Students in the cued conditions saw visual cues on the training problems, and those in the feedback conditions were told if their responses were correct or incorrect. We discuss the influence of both cueing and feedback on students' answers and attention.",This work is supported by the National Science Foundation under grant 1138697 as well as the KSU NSF GK-12 Program under grant NSF DGE-0841414.
Session:,Physics Education Research II,Poster,Title:,A Framework of Attentional Cueing in Physics Problem Solving,Meeting:,"2013 Summer Meeting: Portland, Oregon",Location:,N/A,Date:,,<b> Time: </b>,8:30AM,<b> Author: </b>,"Amy Rouinfar, Kansas State University",<b> Co-Author(s): </b>,"Jeffrey Murray, Adam M. Larson, Lester C. Loschky, N. Sanjay Rebello","Attentional cues overlaid on diagrams and animations can help students attend to the relevant areas and facilitate problem solving. We propose a framework of attentional cueing for solving physics problems. Our framework amalgamates concepts from Representational Change Theory (Ohlsson, 1992) and Theory of Multimedia Learning (Mayer, 2001) along with the framework for visual cueing (de Koning, et. al., 2009). To validate our framework we conducted 24 individual interviews with students enrolled in a conceptual physics course. Students worked through a series of introductory physics problems containing a diagram. Students provided a verbal answer and explanation to each problem and received correctness feedback. If incorrect, they were provided with a series of visual cues on the training problems which became increasingly explicit. We map data from the interviews onto our proposed framework and find evidence supporting the framework.",This work is supported by the National Science Foundation under grant 1138697 as well as the KSU NSF GK-12 Program under grant NSF DGE-0841414.
Session:,Introductory Physics for Life Science Majors,Contributed,Title:,Negative Energy: Why Interdisciplinary Physics Requires Blended Ontologies,Meeting:,"2013 Summer Meeting: Portland, Oregon",Location:,N/A,Date:,,<b> Time: </b>,9:00AM,<b> Author: </b>,Benjamin W. Dreyfus,<b> Co-Author(s): </b>,"Benjamin D. Geller, Vashti Sawtelle, Chandra Turpen, Edward F. Redish","Much recent work in physics education research has focused on ontological metaphors for energy (metaphors for what type of thing energy ""is""), particularly the substance ontology and its pedagogical affordances. The concept of negative energy problematizes the substance ontology for energy (because there cannot be a negative amount of a substance), but in many instructional settings, the specific difficulties around negative energy are outweighed by the general advantages of the substance ontology. However, we claim that our interdisciplinary setting (an undergraduate physics class that builds deep connections to biology and chemistry) leads to a different set of considerations and conclusions. In a course designed to draw interdisciplinary connections, the centrality of chemical bond energy in biology necessitates foregrounding negative energy from the beginning. We argue that the emphasis on negative energy requires a blend of substance and location ontologies. The location ontology enables energies both ""above"" and ""below"" zero.",None
Session:,Physics Education Research II,Poster,Title:,Negative Energy: Why Interdisciplinary Physics Requires Blended Ontologies,Meeting:,"2013 Summer Meeting: Portland, Oregon",Location:,N/A,Date:,,<b> Time: </b>,8:30AM,<b> Author: </b>,Benjamin W. Dreyfus,<b> Co-Author(s): </b>,"Benjamin D. Geller, Vashti Sawtelle, Chandra Turpen, Edward F. Redish","Much recent work in physics education research has focused on ontological metaphors for energy (metaphors for what type of thing energy ""is""), particularly the substance ontology and its pedagogical affordances. The concept of negative energy problematizes the substance ontology for energy (because there cannot be a negative amount of a substance), but in many instructional settings, the specific difficulties around negative energy are outweighed by the general advantages of the substance ontology. However, we claim that our interdisciplinary setting (an undergraduate physics class that builds deep connections to biology and chemistry) leads to a different set of considerations and conclusions. In a course designed to draw interdisciplinary connections, the centrality of chemical bond energy in biology necessitates foregrounding negative energy from the beginning. We argue that the emphasis on negative energy requires a blend of substance and location ontologies. The location ontology enables energies both ""above"" and ""below"" zero.",None
Session:,Evolving Practices of Teacher Preparation to Meet the Next Generation Science Standards,Invited,Title:,Scientific Practices in NGSS and Physics Courses for K-12 Teachers,Meeting:,"2013 Summer Meeting: Portland, Oregon",Location:,N/A,Date:,,<b> Time: </b>,4:00PM,<b> Author: </b>,"Paul Hutchison, Grinnell College",<b> Co-Author(s): </b>,Tiffany Sikorski,"With the arrival of the Next Generation Science Standards (NGSS) it is important to consider how physics content courses for K-12 teachers can support NGSS-envisioned science instruction. The NGSS is the first significant science education reform document to place the learning of scientific practices on equal footing with the development of conceptual understanding. While teachers are skilled in assessing students' conceptual understanding, we expect many current and future science teachers ""even those with undergraduate degrees in science"" are ill-prepared to assess the quality of student engagement in scientific practices. That is an ability teachers will need if implementation of NGSS is to be successful. Physics content courses provide an ideal venue for developing that ability, but only if we shift our assessment in them away from conceptual correctness and toward the authentic use of scientific practices. We provide examples from courses we and others have taught.",None
Session:,"Student Attitudes, Confidence, Self-Efficacy, and Motivation",Contributed,Title:,Assessing Student Learning by Gain in their Confidence,Meeting:,"2013 Summer Meeting: Portland, Oregon",Location:,N/A,Date:,,<b> Time: </b>,7:30AM,<b> Author: </b>,"Niklas Hellgren, Messiah College",<b> Co-Author(s): </b>,Abaz Kryemadhi,"A concern with multiple-choice concept tests is whether a correct answer reflects true knowledge or just a lucky guess. We report on a study where for each question of a standard concept test we also asked the students on a 1-to-5 scale how confident they were in their answer. As expected, in most cases we observed a correlation between gain in correct answers and gain in confidence. However, we give examples where learning is demonstrated by an increase in confidence only, even when there is no actual gain in number of correct answers. In addition, using this approach, student misconceptions can easily be identified by a high confidence level associated with an incorrect answer.",None
Session:,Introductory Course Laboratories and Hands-on Activities for Life Science Majors,Invited,Title:,Reinventing the Introductory Physics Laboratories for Future Biologists,Meeting:,"2013 Summer Meeting: Portland, Oregon",Location:,N/A,Date:,,<b> Time: </b>,10:30AM,<b> Author: </b>,"Wolfgang Losert, University of Maryland",<b> Co-Author(s): </b>,"Kim Moore, John Giannini","We have developed a set of laboratories and hands-on activities to accompany a new interdisciplinary physics course that has been successfully developed and tested in a small class of students at the University of Maryland (UMD). With input from a large group of biologists, physicists, chemists, and education researchers at UMD, we have designed a course to be taken in the student's second year, with calculus, biology, and chemistry as prerequisites. This permits the laboratories to include significant content on physics at cellular scales, from chemical interactions to random motion and charge screening. We developed a lab that introduces the students to modern equipment such as microfluidics and microscopy and physics analysis tools in contexts relevant to biology, while keeping it simple enough to maintain the pedagogically valuable open-ended laboratory structure.",The laboratory development is part of the HHMI supported NEXUS project
Session:,Quantum & Condensed Matter Labs Beyond the First Year,Contributed,Title:,The Rich Physics of the Semiconductor Diode I-V Characteristics,Meeting:,"2013 Summer Meeting: Portland, Oregon",Location:,N/A,Date:,,<b> Time: </b>,4:00PM,<b> Author: </b>,"Herbert Jaeger, Miami University",<b> Co-Author(s): </b>,None,"Recording the I-V characteristics of a semiconductor diode sounds like a simple enough task, yet it is rich in physics and provides a multitude of learning opportunities for students at every level. At the basic level, the measurement can be performed at room temperature with a battery and a multimeter. A more sophisticated approach could involve an electronic current-to-voltage converter with variable gain and automated data acquisition. Data analysis ranges from simple observation of the turn-on voltage to a complex non-linear fitting procedure. This talk will present variations on the theme and show how this simple experiment can be used at the introductory level as well as make appearances at the more advanced level.",None
Session:,Posters on Apparatus,Poster,Title:,Electronics Laboratory Projects with Arduino Microcontrollers,Meeting:,"2013 Summer Meeting: Portland, Oregon",Location:,N/A,Date:,,<b> Time: </b>,4:00PM,<b> Author: </b>,"Herbert Jaeger, Miami University",<b> Co-Author(s): </b>,None,Arduino is a popular microcontroller that is easily programmed to perform data acquisition and control functions. We have recently begun to design electronics lab exercises to be used in our sophomore Electronic Instrumentation Laboratory. We will present a number of these experiments to illustrate the Arduino platform's utility and versatility.,None
Session:,The AIP Career Pathways Project,Invited,Title:,AIP Career Pathways Project: An Overview,Meeting:,"2013 Summer Meeting: Portland, Oregon",Location:,N/A,Date:,,<b> Time: </b>,12:30PM,<b> Author: </b>,"Roman Czujko, American Institute of Physics",<b> Co-Author(s): </b>,None,"This talk describes the Career Pathways Project (CPP) which was supported by the National Science Foundation beginning in October of 2010. The number of physics bachelor's degrees awarded to the class of 2011 set an all-time high in the U.S. at around 6300. If departments want to continue to grow the number of bachelor's, they will need to prepare students to successfully enter the STEM workforce. The CPP team identified a set of physics departments that have a strong record of placing their bachelor's recipients into the STEM workforce and we have completed nine site visits to such departments in various size universities and in different parts of the country. This talk describes the set of features that all these departments share and the features that may reflect the characteristics of the universities, strengths of the departments or the opportunities in the local economy.",Gerald Feldman
Session:,PER: Problem Solving,Contributed,Title:,A Meta-analysis of Brain-behavior Correlations in Problem Solving,Meeting:,"2013 Summer Meeting: Portland, Oregon",Location:,N/A,Date:,,<b> Time: </b>,3:00PM,<b> Author: </b>,"Jessica E. Bartley, Florida International University",<b> Co-Author(s): </b>,None,"Human brain mapping methods offer the opportunity to provide biological evidence of student engagement in physics conceptual reasoning and problem solving tasks. We identified brain networks associated with physics problem solving via a quantitative meta-analysis of component cognitive processes such as deductive reasoning, spatial skills, and mathematical calculations. This study assembled functional magnetic resonance imaging (fMRI) data from the BrainMap database [1] and used computational data mining techniques to identify the neural correlates associated with these cognitive processes. The present results were designed to provide groundwork for larger fMRI work in the domain of PER. Ultimately, we aim to use this work as the first phase of a study seeking to identify biological evidence to operationalize engagement, embodied experience, and conceptual metaphor in physics problem solving.","[1] Laird AR, Lancaster Jl, Fox PT: BrainMap: The social evolution of a human brain mapping database. Neuroinformatics 2005, 3:65-78"
Session:,Introductory Course Laboratories and Hands-on Activities for Life Science Majors,Poster,Title:,Teaching Fluids to IPLS Students from a Microscopic Viewpoint,Meeting:,"2013 Summer Meeting: Portland, Oregon",Location:,N/A,Date:,,<b> Time: </b>,11:00AM,<b> Author: </b>,"Daniel E. Young, University of New Hampshire",<b> Co-Author(s): </b>,Dawn C. Meredith,"For introductory life science students, fluid dynamics is a topic that is important, relevant to biology, and yet difficult to understand conceptually. Our study focuses on probing understanding of pressure differentials and friction which underpin ideas of viscosity and fluid flow. Data were collected from think-aloud/demonstration interviews and were analyzed using the resource framework to look for productive student reasoning such as a microscopic viewpoint and gradient driven flow. We investigated if a multiple-scale view of matter is useful for students when constructing a model of viscosity and we will present both our model and feedback from students who have worked through it.",None
Session:,PIRA Session: Managing Instructional Resources in an Era of Increasing Enrollments,Contributed,Title:,Labs Outside the Lab: Addressing Enrollment Increase with Portable Labs,Meeting:,"2013 Summer Meeting: Portland, Oregon",Location:,N/A,Date:,,<b> Time: </b>,8:30AM,<b> Author: </b>,"William R. Sams, North Carolina State University",<b> Co-Author(s): </b>,M A. Paesler,"eTALK, Enhanced Teaching Assistance to aid Learning with Kitlabs, is a teaching laboratory reform under development at NC State University. It offers an alternative to traditional laboratory courses that use proprietary loggers and probes. eTALK instead utilizes students' personal electronic devices, portable kits, and online teaching assistant contact. An eTALK lab thus allows students to focus on the experiment rather than on the mastery of a learning curve associated with unfamiliar probes and equipment. Furthermore, a portable eTALK lab does not sacrifice the important real-time TA interactions that characterize traditional lab courses and are often missing in endeavors to develop distance learning labs. The eTALK project is currently deployed in first-semester calculus-based general physics labs at NC State. Results from the project, including a comparison with traditional labs, will be presented.",eTALK is supported by the NC State Large Course Redesign Program and the National Science Foundation.
Session:,Facilitating Faculty Change Through Research,Invited,Title:,Moving Beyond Telling Individual Faculty About Educational Innovations,Meeting:,"2013 Summer Meeting: Portland, Oregon",Location:,N/A,Date:,,<b> Time: </b>,3:40PM,<b> Author: </b>,"Chandra A. Turpen, University of Maryland, College Park",<b> Co-Author(s): </b>,"Charles Henderson, Melissa Dancy","Educational researchers who are trying to change the way other people teach usually do so through the following strategy: They develop new ways to teach and share their innovations through journal articles and talks. Using these one-way communication mechanisms, they focus on telling other educators why lectures don't work, explaining their new methods, giving data on effectiveness of their new method, and sharing materials that others can use. Four findings from interviews with 35 faculty members from across the country suggest needed changes to this strategy: 1) Innovations often spread through informal interactions, 2) Adopters and educational researchers don't share a common understanding about innovations, 3) Faculty adopting innovations sometimes modify them without understanding the underlying motivation and structure, and 4) Depending on where faculty are in either adopting or adapting a new way of teaching, educators may see aspects of the innovation as either a barrier or a motivator.",None
Session:,Physics Education Research,Poster,Title:,Development of an Estimation Skills Diagnostic,Meeting:,"2013 Summer Meeting: Portland, Oregon",Location:,N/A,Date:,,<b> Time: </b>,9:15PM,<b> Author: </b>,Andrew J. Macdonald,<b> Co-Author(s): </b>,"Sarah A.. Burke, Cynthia E. Heiner","The ability to accurately estimate physical quantities is an invaluable skill for scientists and engineers. The development of estimation skills has become an explicit learning goal in the first-year physics course for engineering students at UBC. In order to establish a baseline and look for possible gains in skill level, we have developed a 10-question multiple-choice assessment designed to probe student ability and confidence in estimating physical quantities such as mass, size, and time. Student interviews were used to establish question validity and open-ended written versions were used to seed multiple-choice responses. The diagnostic was administered as a pretest and post-test and given to a set of experts to establish its discriminatory power. The results showed a statistically significant difference between students and experts, but no overall student gains. This poster will give an analysis of the results and share some observations based on student interviews.",Sponsored by Dr. Cynthia Heiner
