Session:,Best Practices in Educational Technology II,Contributed,Title:,Instructors Take Note: Course Structure Impacts Student Use of Etexts,Meeting:,"2013 Summer Meeting: Portland, Oregon",Location:,N/A,Date:,,<b> Time: </b>,4:20PM,<b> Author: </b>,"Daniel T. Seaton, MIT",<b> Co-Author(s): </b>,"Yoav Bergner, Saif Rayyan, Gerd Kortemeyer, David E Pritchard","The overall amount, and the manner, in which students use e-texts depends strongly on course structure, but weakly on class size or on whether the online environment is blended, distance learning, or open. Analyzing tracking logs from the LON-CAPA and edX platforms, we determine the use of etexts in more than 16 introductory physics courses at Michigan State University and MIT, plus four non-physics courses from MITx. A two -parameter model of usage distributions reveals that traditional course structure (few exams, other learning resources besides the e-text) generally correlates with the average student viewing less that 20% of the text, whereas reformed structure (frequent exams, embedded assessment in the assigned e-text) correlates with students viewing over 70%. Our data-mining techniques also analyze the temporal pattern of e-text use, distinguishing weekly reading from review immediately before (or during open book) exams.",None
Session:,Post-Deadline Papers,Contributed,Title:,Team-based Assessment in a Flipped Introductory Physics Class,Meeting:,"2013 Summer Meeting: Portland, Oregon",Location:,N/A,Date:,,<b> Time: </b>,3:50PM,<b> Author: </b>,"Junehee Yoo, Seoul National University",<b> Co-Author(s): </b>,"Eric Mazur, Carolann Koleci, Brian Lukoff","In a flipped introductory physics class, teamwork is regarded as a core competency and even reflected to assessment method. Reading Assurance Assessments, the high stakes component of the course are performed by team based rather than individually isolated. Three research questions; is the team-based assessment methods fair, especially for the high achievers, can team-based assessments measure teamwork as it intended and how can improve a teamwork are approached by analyzing 34 students' individual and team scores longitudinally during one semester. As a result, team-based assessments seemed to measure teamwork as it intended and to be fair when we accept that teamwork is important as well as conceptual mastery, even though the portions are not the same. Team composition for effective teamwork will be discussed.",None
Session:,The AIP Career Pathways Project,Invited,Title:,Physics Career Pathways Illustrated in the Liberal Arts,Meeting:,"2013 Summer Meeting: Portland, Oregon",Location:,N/A,Date:,,<b> Time: </b>,1:30PM,<b> Author: </b>,"Timothy N. Good, Gettysburg College",<b> Co-Author(s): </b>,None,"A recent analysis of data collected by the AIP SRC reveals that Gettysburg College has both a strong record of granting physics bachelor's degrees compared to other liberal arts institutions and is among the national leaders in terms of the percent of their recent physics bachelor's recipients who entered the STEM workforce within one year of earning the bachelor's degree. The college collaborated with the AIP Career Pathways team in a study to learn, and then disseminate, effective practices. Herein we report our findings; the significant factors are curriculum, climate, and community. We will describe a flexible curriculum rich in one-to-one instruction and advising, an energetic physics faculty devoted to ""hands-on"" laboratory instruction across the major, the availability of independent research opportunities, and a departmental climate that nurtures community, fostering a strong, positive relationship among physics majors at all levels and with alumni participating in a vibrant colloquium series.",None
Session:,"If They Make it, They Will Learn",Contributed,Title:,Paper Straw Pan Pipes and Oboes and their Standing Waves,Meeting:,"2013 Summer Meeting: Portland, Oregon",Location:,N/A,Date:,,<b> Time: </b>,8:00AM,<b> Author: </b>,"Daniel MacIsaac, Buffalo State College",<b> Co-Author(s): </b>,None,Make beautiful music in your class with these simple to make instruments. We will make both straw pan pipes and paper straw oboes. We will look at the physics of sound illustrated by these cheap and easy instruments. This activity has been done with Grade 3 students to in-service teachers.,None
Session:,"If They Make it, They Will Learn",Contributed,Title:,Lever It Up,Meeting:,"2013 Summer Meeting: Portland, Oregon",Location:,N/A,Date:,,<b> Time: </b>,8:00AM,<b> Author: </b>,"Kathleen Falconer, Buffalo State College",<b> Co-Author(s): </b>,None,"Last year at the 2012 OATP Conference, I went to a session with Marilyn Orszulik entitled Creativity and Hands-On Learning in Elementary Science, Design and Technology Programs. It was a wonderful session and using very simple hand tools I made a lever. Then my students made levers. We all had a wonderful time and I was surprised how empowering making a simple machine, like the lever, was for my students. So we are going to make levers. Also we will look at how this activity ties into the NGSS framework. Come join us and have a good time.",None
Session:,Implementations of Modeling Instruction for Different Audiences,Contributed,Title:,"Whole Class ""Board"" Meetings in Modeling-based Introductory University Physics",Meeting:,"2013 Summer Meeting: Portland, Oregon",Location:,N/A,Date:,,<b> Time: </b>,5:20PM,<b> Author: </b>,"Brant Hinrichs, Drury University",<b> Co-Author(s): </b>,None,"This talk describes whole-class whiteboard meetings and gives examples of how they are used in a calculus-based introductory physics course taught using modeling instruction. Students in one section of the course are divided into six groups of four to five students each. Each group creates a solution to the same problem on a small whiteboard. The groups then form a large circle in the center of the classroom with their whiteboards on the ground, resting against their knees, facing out to the rest of the group. The instructor is outside the circle and interjects only rarely, if at all. The goal of the discussion is to come to a consensus on the ""best"" answer to the given problem. Examples are given of some of the amazing conversations students can have in such a format. Students are learning the epistemology of science by actively engaging in it every class.",None
Session:,Physics Education Research,Poster,Title:,Making Sense of Friction as an Interaction Using System Schema,Meeting:,"2013 Summer Meeting: Portland, Oregon",Location:,N/A,Date:,,<b> Time: </b>,8:30PM,<b> Author: </b>,"Brant Hinrichs, Drury University",<b> Co-Author(s): </b>,None,"After learning Newton's second law, students in a university modeling-based introductory physics class are asked to imagine a box sliding across a floor and slowing to a stop. Although they've had extensive experience with friction in the context of energy, this is their first exposure to friction within the context of forces. They are asked to make different representations for this scenario, including a system schema, and force diagram. During their small-group work, students quickly run into a difficulty: there are only two interactions with the box (contact, gravitational), so there should only be two forces, yet the box is slowing, which means it must have unbalanced forces in the direction of acceleration. In this poster, I present evidence from the student-led whole class discussion showing how the class uses the System Schema to help reason about this problem in a productive manner and come to a useful consensus.",None
Session:,Post-Deadlne Poster,Poster,Title:,Energizing Physics: Results from a 2-year Pilot Project,Meeting:,"2013 Summer Meeting: Portland, Oregon",Location:,N/A,Date:,,<b> Time: </b>,8:30AM,<b> Author: </b>,Stephen Scannell,<b> Co-Author(s): </b>,None,"Energizing Physics is an introductory physics course for the high school level designed to incorporate several approaches shown to improve student understanding of physics. These include a modeling approach to develop conceptual and quantitative understanding, a focus on depth vs. breadth, the use of learning targets and formative assessment strategies, and project-based learning, including hands-on projects that utilize the engineering design process, and smaller research projects that develop students' understanding of today's energy issues. Preliminary results and thoughts from a two-year pilot project (concluding in August 2013) will be shared.",None
Session:,Physics Education Research II,Poster,Title:,Examining Identity Development with Cultural Historical Activity Theory,Meeting:,"2013 Summer Meeting: Portland, Oregon",Location:,N/A,Date:,,<b> Time: </b>,8:30AM,<b> Author: </b>,"Sissi L. Li, California State University Fullerton",<b> Co-Author(s): </b>,Michael E. Loverude,"Becoming a physics major involves learning to be part of physics communities. In this process, students socially interact with these communities, grapple with changing expectations over time as students become more physicist-like, and make use of tools in ways that are unique to the field. A theoretical framework is needed to incorporate elements beyond the social ones. Cultural Historical Activity Theory (CHAT) examines human actions through activity systems characterized by a motivation for action; components within the system include social, structural, and temporal artifacts that are often in conflict and drive an individual or group to action. For example, students joining a research group experience conflict between what counted as good lab work in classes and new expectations in the research lab. Using CHAT, we examine the physics major identity development through the interactions within an activity system and between activity systems that shape the trajectory of becoming a physicist.",None
Session:,Post-Deadlne Poster,Poster,Title:,"Simulated Sinusitis, Phantoms and Near Infrared Radiation (NIR) Transillumination Imaging",Meeting:,"2013 Summer Meeting: Portland, Oregon",Location:,N/A,Date:,,<b> Time: </b>,9:15AM,<b> Author: </b>,"Kevin C. Yang, Mission Viejo High School",<b> Co-Author(s): </b>,None,"Sinusitis affects 31 million people nationwide annually. A potential imaging tool for the diagnosis of maxillary sinusitis is NIR transillumination through the hard palate of the mouth. To study optimal techniques for detecting maxillary sinusitis with NIR, phantoms simulating the sinuses and hard palate of a human skull were constructed and tested with NIR systems. MatLab analysis of NIR images of the phantom indicated that the light intensity emitted from completely fluid-filled cavities was up to 50% less than that emitted from healthy, air-filled cavities. NIR transillumination was also able to detect partially fluid-filled cavities that mimic the disease condition of a large number of patients. NIR light intensity demonstrated a significant (p<0.05) negative correlation with volume of fluid inside the cavities. Hence, NIR transillumination can distinguish between aerated (healthy) and fluid-filled (diseased) cavities in this phantom, indicating that the phantoms provide a static model that closely mimics maxillary sinusitis.",None
Session:,"Student Attitudes, Confidence, Self-Efficacy, and Motivation",Contributed,Title:,Attitudinal Assessment of Curriculum on the Physics of Medical Instruments,Meeting:,"2013 Summer Meeting: Portland, Oregon",Location:,N/A,Date:,,<b> Time: </b>,8:30AM,<b> Author: </b>,"James K. Johnson, Portland State University",<b> Co-Author(s): </b>,"Warren Christensen, Ralf Widenhorn, Grace Van Ness, Elizabeth Anderson","Over the past several years, a curriculum targeting pre-health students and focused on the physics behind biomedical instruments has been in development at Portland State University. Recently, an effort to assess the curriculum's impact on students has begun. Given the hands-on focus of the course and positive feedback from students, we hypothesized that it would positively impact their attitudes toward physics and physics learning. We administered the Colorado Learning Attitudes about small, non-significant shift in student attitudes. This is a promising result, when contrasted with the significant negative shift that is the norm among introductory courses and occurred in our introductory algebra-based physics course. Science Survey (CLASS) in order to cast light on students' attitudes. The survey was administered to the summer course and to introductory algebra-based physics courses at the same university. The summer course ""Physics in Biomedicine"" produced a small, non-significant shift in student attitudes. This is a promising result, when contrasted with the significant negative shift that is the norm among introductory courses and occurred in our introductory algebra-based physics course.",Sponsored by: Ralf Widenhorn
Session:,Introductory Course Laboratories and Hands-on Activities for Life Science Majors,Poster,Title:,Attitudinal Assessment of Curriculum on the Physics of Medical Instruments,Meeting:,"2013 Summer Meeting: Portland, Oregon",Location:,N/A,Date:,,<b> Time: </b>,11:00AM,<b> Author: </b>,"James K. Johnson, Portland State University",<b> Co-Author(s): </b>,"Warren Christensen, Ralf Widenhorn, Grace Van Ness, Elizabeth Anderson","Over the past several years, a curriculum targeting pre-health students and focused on the physics behind biomedical instruments has been in development at Portland State University. Recently, an effort to assess the curriculum's impact on students has begun. Given the hands-on focus of the course and positive feedback from students, we hypothesized that it would positively impact their attitudes toward physics and physics learning. We administered the Colorado Learning Attitudes about Science Survey (CLASS) in order to cast light on students attitudes. The survey was administered to the summer course and to introductory algebra-based physics courses at the same university. The summer course ""Physics in Biomedicine"" produced a small, non-significant shift in student attitudes. This is a promising result, when contrasted with the significant negative shift that is the norm among introductory courses and occurred in our introductory algebra-based physics course.",Sponsor: Ralf Widenhorn
Session:,SPS Undergraduate Research and Outreach Poster Session,Poster,Title:,Energy Efficiency vs. Tire Pressure and Rolling Weight in Bicycles,Meeting:,"2013 Summer Meeting: Portland, Oregon",Location:,N/A,Date:,,<b> Time: </b>,8:00PM,<b> Author: </b>,Brody Boeger,<b> Co-Author(s): </b>,Erik Bodegom,"Cycling is one of the fastest growing modes of transportation in large cities. As a result, bicycles and their function are of increasing interest to an environmentally minded society. When utilized for transportation, maintenance and efficiency become important aspects of cycling, but are often overlooked by everyday riders. Using a standard bicycle, digital force plates, and a power-metering hub it is possible to quantify the individual and combined effects of tire pressure and weight on the bicycle in terms of energy expended by the rider. Similar to studies on fuel efficiency in automobiles, assessing an energy-efficiency value for bicycles provides additional motivation for adopting sustainable transportation.","Sponsored by Dr. Erik Bodegom, Portland State University."
Session:,Post-Deadline Papers,Contributed,Title:,Growing a Major from Scratch: The CSUSM Experience*,Meeting:,"2013 Summer Meeting: Portland, Oregon",Location:,N/A,Date:,,<b> Time: </b>,3:00PM,<b> Author: </b>,Charles J. De Leone,<b> Co-Author(s): </b>,Edward Price,"Six years ago the Physics Major at California State University, San Marcos was nothing but a plan. Today the program has more than 80 majors and has already graduated 10 students, bucking the trend of low enrollments in physics majors at small and mid-sized institutions. This talk will attempt to analyze the successful and less successful elements of this program, including curriculum choices, student-faculty interactions, and student recruitment, via data from student interviews and survey responses. The talk will also report on how elements of the major align with successful strategies identified in the Strategic Programs for Innovations in Undergraduate Physics (SPIN-UP) report. Lastly, we will report on current and future challenges to the program in an age of budgetary constraint.",Supported in part by NSF Grant DUE-1068477
Session:,SPS Undergraduate Research and Outreach Poster Session,Poster,Title:,Integrated Physics Laboratory Assessment,Meeting:,"2013 Summer Meeting: Portland, Oregon",Location:,N/A,Date:,,<b> Time: </b>,8:00PM,<b> Author: </b>,"Amanda Skuriat, Ramapo College of NJ",<b> Co-Author(s): </b>,"Dr.Daniela Buna, Dr.Caroline Brisson","The Engineering Physics program at Ramapo College of New Jersey has conducted a comprehensive assessment of the department's laboratory curriculum in order to determine how to improve our student learning outcomes. The data collected highlight the significant progress made through the introduction of innovative laboratory equipment and teaching methods. However, evaluative feedback provided by the students on their work was overly optimistic in comparison with feedback of their professors. The findings also showed that there was a minimal increase in interest of pursuing independent research among students. Therefore, it is imperative to further analyze what aspects can be improved upon in the curriculum as well as how to improve students' evaluative skills and propagate increased interest in the field. Several suggested tactics and future plans of action are included with the best interests of our students in mind.",None
Session:,Teaching Controversial Topics,Panel,Title:,Teaching Controversial Topics in Physics Courses,Meeting:,"2013 Summer Meeting: Portland, Oregon",Location:,N/A,Date:,,<b> Time: </b>,4:00PM,<b> Author: </b>,"Art Hobson, University of Arkansas",<b> Co-Author(s): </b>,None,"The conceptual physics course I developed in 1975 at the University of Arkansas is now taught to nearly 1000 introductory non-science students per year. It is based on my textbook, ""Physics: Concepts & Connections"" (Pearson/Addison-Wesley, 5th edition 2010), a general introductory conceptual physics textbook emphasizing physics-related social topics and modern physics. Students say they especially enjoy the social topics. The scientific process, according to which we learn via evidence and reason, is the frequently-recurring theme. Other social topics, in order of appearance, are pseudoscience, transportation and energy, electric power plants, exponential growth, ozone depletion, global warming, radioactive dating, the geological ages, biological effects of radiation, technological risk, nuclear weapons, nuclear terrorism, the energy future, nuclear power, fossil fuels, renewable energy, and energy efficiency. Many of these bear on controversial religious and political issues. I will discuss how I deal with such controversies.",None
Session:,Post-Deadlne Poster,Poster,Title:,Incorporating the MITx into an Upper Division Lab Course,Meeting:,"2013 Summer Meeting: Portland, Oregon",Location:,N/A,Date:,,<b> Time: </b>,8:30AM,<b> Author: </b>,"Charles I. Bosse, MIT",<b> Co-Author(s): </b>,"Christopher J. Sarabalis, Gunther M. Roland","MIT has recently pioneered the MOOC platform MITx. While the application for distributing education outside of the university is obvious, part of the goal of this platform was to provide addition options for students at MIT. Our 8.13 staff and instructors embarked on an effort to use the MITx platform to provide better content delivery, further ""flip"" classroom time currently used for lecture/tutorials, and to provide students more prompt and relevant feedback on questions asked to ensure conceptual preparedness for lab time.",None
Session:,Engineering in the Physics Classroom,Invited,Title:,Teaching Green Engineering and Physics with Project Lead the Way,Meeting:,"2013 Summer Meeting: Portland, Oregon",Location:,N/A,Date:,,<b> Time: </b>,4:30PM,<b> Author: </b>,"Michael J. Waltz, Livermore High School",<b> Co-Author(s): </b>,None,"Project Lead the Way (PLTW) is primarily known as a source of Pre-Engineering curriculum which helps students in grades 7-12 prepare for college through hands-on, project-based learning. Many of the engineering topics in this curriculum overlap with the high school physics curriculum. Additionally, the PLTW curriculum contains many projects that already have ""Green"" components or that can be modified to teach renewable energy, energy efficiency, and recycling. The Green Engineering Academy at Livermore High School has combined PLTW, Physics, and Green Engineering topics in an innovative new course.",Sponsor: Susan Johnston
Session:,Massively Open Online Courses,Panel,Title:,MIT Open Online Physics Courses Are Research Goldmines,Meeting:,"2013 Summer Meeting: Portland, Oregon",Location:,N/A,Date:,,<b> Time: </b>,4:00PM,<b> Author: </b>,"David E. Pritchard, MIT",<b> Co-Author(s): </b>,"Daniel Seaton, Yoav Bergner, Colin Fredericks, Gerd Kortemeyer","MOOCs offer research opportunities based on data mining from their time-stamped log of everything students do in a complete learning environment. We report on student distribution of time on various tasks, fraction of each resource used, and particularly on e-text usage. e-text usage depends dramatically on course structure, but is similar for OOCs, distance courses at MSU, and blended courses at MSU and MIT. Data will be drawn from ~14 MSU physics courses on LONCAPA.org, ~8 MIT courses on edX, and the 2 RELATE administrations of Mechanics ReView (http://relate.mit.edu/physicscourse/), an open enrollment course that uses the MAPS Pedagogy [2] to develop both more expert-like organization of core mechanics knowledge and more systematic problem solving skills. ReView includes hundreds of assessment questions, many based on results from physics education research, most of them available on LON-CAPA. The previous and current summer versions of ReView are aimed at practicing teachers and offer CEUs.","[1] We acknowledge support from NSF and MIT, and important help on the course from Andrew Pawl, Saif Rayyan, and Raluca Teodorescu [2] AIP Conf. Proc. 1179, pp. 51-54 (2009)"
Session:,Post-Deadline Papers,Contributed,Title:,Experiences in Teaching Sport Science,Meeting:,"2013 Summer Meeting: Portland, Oregon",Location:,N/A,Date:,,<b> Time: </b>,2:50PM,<b> Author: </b>,"Blane Baker, William Jewell College",<b> Co-Author(s): </b>,None,"My experiences in teaching a course based on the science of sport over the past decade are presented. A general overview of the topics covered, along with examples of how athletic performance can be analyzed by physics and other scientific disciplines, are discussed. In addition, classroom assignments, laboratory work, and readings are summarized to show what is expected of students. Finally, writing goals and rubrics for grading are described.",None
Session:,Frontiers in Astronomy and Space Science,Invited,Title:,Searching for Earth's Twin: NASA's Kepler Mission,Meeting:,"2013 Summer Meeting: Portland, Oregon",Location:,N/A,Date:,,<b> Time: </b>,8:30AM,<b> Author: </b>,"Edna DeVore, SETI Institute",<b> Co-Author(s): </b>,None,"Is Earth unique in the universe? Are Earth-size planets rare? Learn about NASA's Kepler Mission, which seeks to answer these questions by searching for exoplanets orbiting in the habitable zone of Sun-size stars. Launched in 2009, the Kepler spacecraft is a specialized telescope that acts like a very precise light meter, a photometer, that precisely measures changes in stars' brightnesses as planets transit. To date, Kepler has identified more than 2,700 candidate planets, with many small, Earth-size planets included. Kepler will continue to observe through 2016, and is closing in on Earth's twin.","Talk will be presented by Gary Nakagiri, SETI/Kepler EPO Specialist"
Session:,Research in Undergraduate Mathematics Education,Invited,Title:,Three Interpretations of the Matrix Equation Ax=b,Meeting:,"2013 Summer Meeting: Portland, Oregon",Location:,N/A,Date:,,<b> Time: </b>,8:30AM,<b> Author: </b>,"Michelle Zandieh, Arizona State University",<b> Co-Author(s): </b>,Christine Larson,"Over the past years we have come to reflect on the nature of the cognitive demands that a sophomore or junior level linear algebra course places on students. Many of the central ideas in introductory linear algebra can be interpreted through the lens of the matrix equation Ax=b where A is an mxn matrix, x is a vector, and b is a vector. We describe a framework that highlights the challenges involved in interpreting Ax=b both symbolically and graphically as (1) a system of equations, (2) a vector equation and (3) as a linear transformation. In particular we note how differently the vector x must be viewed in each of these interpretations. We present vignettes of student thinking that illustrate how the framework may be used to make sense of the ways in which students blend ideas as they begin learning linear algebra.",None
