Session:,Learning Assistant Programs as Vehicles for Course Transformation and Recruitment of Future Physics Teachers,Contributed,Title:,Implementing a Peer Instructor (Learning Assistant) Course at Louisiana State University,Meeting:,"2013 Winter Meeting: New Orleans, Louisiana",Location:,N/A,Date:,,<b> Time: </b>,2:10PM,<b> Author: </b>,"Michael L. Cherry, Louisiana State University",<b> Co-Author(s): </b>,None,"The introductory first year non-calculus-based physics course at Louisiana State University currently has approximately 750 students in three large lecture sections. In order to supplement the large lectures, small (20-25 students) recitation sections have been added. Following the Learning Assistant model at Colorado, these recitation sections emphasize concepts and are managed by undergraduate Peer Instructors. The experience and lessons learned during the initial two semesters of the program are described.",None
Session:,Other,Poster,Title:,Recruiting and Retaining Women in Physics in Central Arkansas,Meeting:,"2013 Winter Meeting: New Orleans, Louisiana",Location:,N/A,Date:,,<b> Time: </b>,10:15AM,<b> Author: </b>,"Stephen R Addison, University of Central Arkansas",<b> Co-Author(s): </b>,None,"Over the last ten years the Department of Physics and Astronomy at the University of Central Arkansas has experienced considerable growth. The number of women physics graduates had been notable, and has often represented half of each graduating class. Strategies developed to recruit and retain these students will be presented with a particular emphasis on strategies that were successfully deployed to increase the number of women physics graduates.",None
Session:,PER: Student Reasoning,Contributed,Title:,Student Understanding of Foundational Ideas in Quantum Mechanics,Meeting:,"2013 Winter Meeting: New Orleans, Louisiana",Location:,N/A,Date:,,<b> Time: </b>,2:40PM,<b> Author: </b>,"Paul J Emigh, University of Washington",<b> Co-Author(s): </b>,"Peter Shaffer, Gina Passante","Quantum mechanics requires a conceptual framework substantially different from the classical picture students develop in introductory physics courses. We are examining student thinking on several foundational topics in quantum mechanics, including black-body radiation, wave-particle duality, and the Stern-Gerlach effect. Excerpts from interviews, pre-tests, and post-tests will be used to illustrate some of the conceptual and reasoning difficulties we have identified among both introductory and upper-division students.",None
Session:,PER: Investigating Classroom Strategies,Contributed,Title:,Testing Problem Solving through Multiple Choice,Meeting:,"2013 Winter Meeting: New Orleans, Louisiana",Location:,N/A,Date:,,<b> Time: </b>,9:30AM,<b> Author: </b>,Jessica Graber,<b> Co-Author(s): </b>,None,"Large lecture courses and grading time constraints force many instructors to use multiple-choice exams, and many students will encounter multiple-choice exams determining entrance into post-secondary education or career paths. However, research shows that student test preparation does not occur at a deep knowledge level for multiple-choice tests compared to hand-graded exams using worked out problems. Most instructors prefer worked out problems on exams for pedagogical reasons even if it is practically not possible. To increase the efficacy of multiple-choice problems in assessing actual problem-solving skills, I compare the two types of questions on the same test to determine what features of the problem solving skill set best predict overall problem solving capabilities.",None
Session:,Careers in Physics: Alternatives to Academia,Invited,Title:,Careers and Curriculum: Lessons Learned from AIP's Career Pathways Project,Meeting:,"2013 Winter Meeting: New Orleans, Louisiana",Location:,N/A,Date:,,<b> Time: </b>,4:00PM,<b> Author: </b>,"Kendra Redmond, American Institute of Physics",<b> Co-Author(s): </b>,"Thomas Olsen, Roman Czujko","Physics is often perceived as an academic major with no direct path to a job outside of academia, despite its high job placement rate and direct application to energy, medicine, computers, and many other high-tech areas. Since many physics bachelor's degree recipients look for jobs in their geographic region, departments that foster connections to the local STEM workforce and help students develop skills valued by that workforce may well increase their number of majors. The American Institute of Physics is in the midst of an NSF-funded research effort to visit departments that produce significant numbers of physics bachelor's degree recipients who successfully enter STEM employment within one year of graduation, in order to compile and disseminate effective practices for preparing physics students to enter the STEM workforce. This talk will present preliminary results from these site visits.",None
Session:,Physics Education Research,Poster,Title:,Computer Coaches for Problem Solving: Application to High School Physics,Meeting:,"2013 Winter Meeting: New Orleans, Louisiana",Location:,N/A,Date:,,<b> Time: </b>,8:30PM,<b> Author: </b>,"Andrew J. Mason, University of Central Arkansas",<b> Co-Author(s): </b>,"Mishal Benson, Qing Xu, Leon Hsu, Kenneth Heller","Computer modules are currently being developed in conjunction with the University of Minnesota(1) to train students in a calculus-based introductory physics course in an expert-like physics problem-solving framework. One of our research goals is to be able to implement the modules in different class settings. To this end, we discuss an ongoing study in which Arkansas teachers are interviewed as they use a subset of the Minnesota modules adapted for an algebra-based physics course. Discussion revolves around the feasibility and adaptability of the coaches as described by the teachers in the case study. Future plans include using this information to adapt the coaches as necessary for trial among volunteers in local high school physics courses.","1. L. Hsu and K. Heller, Proceedings of the 82nd NARST Annual International Conference, Garden Grove, CA, 2009; Q. Xu et al., AAPT 2012 Summer Meeting, Philadelphia, PA."
Session:,Models of Lab Instruction/Curricula from Around the World,Invited,Title:,Low-Cost Hands-on Research in the Developing World,Meeting:,"2013 Winter Meeting: New Orleans, Louisiana",Location:,N/A,Date:,,<b> Time: </b>,9:00AM,<b> Author: </b>,"Mark D Shattuck, The City College of New York",<b> Co-Author(s): </b>,None,"The Hands-On Research in Complex Systems Schools[1] are designed to introduce graduate students and young faculty from developing countries to table-top scientific research on problems at the frontiers of science. Experiments on physical, chemical, and biological systems are conducted with modern yet inexpensive digital instrumentation, and the laboratory work is complemented by mathematical modeling and data analysis using Matlab. The two-week-long schools provide an interactive experience with hands-on research involving experiments with real-time computer data acquisition and associated computational modeling. Lectures and hands-on experiences focus on complex systems in the physical and life sciences. This research is inherently interdisciplinary, and topics range from biological networks to spatial patterns in fluids to laser chaos.","[1] Sponsored by The Abdus Salam International Centre for Theoretical Physics (ICTP, Trieste, Italy) and the National Science Foundation."
Session:,Physics Education Research,Poster,Title:,Introducing Research Experiences in a Community College,Meeting:,"2013 Winter Meeting: New Orleans, Louisiana",Location:,N/A,Date:,,<b> Time: </b>,7:45PM,<b> Author: </b>,"Chitra G. Solomonson, Green River Community College",<b> Co-Author(s): </b>,"Andrew H. Rice, Christine K. Luscombe, Keith A. Clay","As more students seek to gain admission to universities, fewer seats are becoming available to them due to increasing budget cuts. Thus admission is becoming increasingly competitive. At the same time, more and more students are relying on community colleges to serve as a stepping stone to college. Introducing research experiences early on has short and long-term benefits. Experience in research is becoming an important component of STEM undergraduate programs in four year schools. Introducing them in a two-year college will enable our students to transfer successfully to a four-year university. Research experiences have also been shown to deepen students' resolve in persisting in STEM fields especially for underrepresented populations.1 In this project (funded by NSF DUE-1141339), faculty members at Green River Community College are collaborating with faculty members at the University of Washington to develop and implement research-like lab modules in the cutting edge fields of Organic Photovoltaics (OPVs) and Organic Light Emitting Devices (OLEDs).","Russell, S.H.; Hancock, M.P.; and McCullough, J. (2007). Benefits of undergraduate research experiences. Science, 316(5,824): 548?549. Christine Luscombe and Andrew Rice sponsored by Chitra Solomonson"
Session:,Online Physics Courses,Invited,Title:,"Online Physics Courses: Exemplars, Trends, Opportunities and Challenges",Meeting:,"2013 Winter Meeting: New Orleans, Louisiana",Location:,N/A,Date:,,<b> Time: </b>,4:00PM,<b> Author: </b>,"Robert V. Steiner, American Museum of Natural History",<b> Co-Author(s): </b>,None,"Online physics courses offer remarkable opportunities for student access as well as curricular and pedagogical innovation. However, such courses also raise fundamental questions, including questions about instructor roles and support for inquiry-based teaching methods. This session will provide an overview of the landscape of online physics courses, including examples of some current offerings. Various approaches to course design, development, implementation, and evaluation will be reviewed. Both opportunities and challenges of online courses will be explored within the context of some recent trends, including flipped classrooms, open source materials, massively open online courses and mobile computing. The presenter directs online and blended teacher education programs at the American Museum of Natural History and is a member of the adjunct faculty at the City University of New York's Queens College. He is the co-author of Mathematics for Physics Students and currently serves as the chair of the AAPT's Committee on Educational Technologies.",None
Session:,PER: Student Reasoning,Contributed,Title:,When Does a Group Ignore their Own Question?,Meeting:,"2013 Winter Meeting: New Orleans, Louisiana",Location:,N/A,Date:,,<b> Time: </b>,2:30PM,<b> Author: </b>,"Alex M. Barr, University of Texas at Austin",<b> Co-Author(s): </b>,Amy D Robertson,"The growth of tutorial- and discussion-style recitation sections has made group work an integral part of many physics classrooms. Goals for group work often include increasing student agency and encouraging students to ask their own questions. Once asked, these questions can either be taken up or be disregarded by the group as a whole. What factors influence this decision? We analyze an interaction between three teachers in the Energy Project at Seattle Pacific University in which the question of what makes a material magnetic is first disregarded and then later taken up for an extended discussion. We examine the teachers' framing of their activity to help understand when and why this question is taken up by the group.",Supported in part by NSF 0822342.
Session:,Online Physics Courses,Contributed,Title:,Data-Driven Strategies for Student Success in Online Physics Courses,Meeting:,"2013 Winter Meeting: New Orleans, Louisiana",Location:,N/A,Date:,,<b> Time: </b>,4:30PM,<b> Author: </b>,"Curtis M. Shoaf, Parkland College",<b> Co-Author(s): </b>,Denice Hood,"Can students learn physics online? Do they learn differently? Are students that enroll in online courses different from students in the general population? Are there indicators of student success in online physics courses? What are students' attitudes toward online physics courses? I will answer these questions based upon data collected from a fully online algebra-based physics course. I have been teaching, and continually developing, a fully online college physics course at Parkland College for six years. More recently, I have been collecting targeted data to make future data-driven improvements to the course. I will share the results of my data and future plans for the courses based on the data collected.",None
Session:,Recruiting and Retaining Physics Students,Contributed,Title:,Networking Nights; a Tool to Improve the Retention of Women,Meeting:,"2013 Winter Meeting: New Orleans, Louisiana",Location:,N/A,Date:,,<b> Time: </b>,2:00PM,<b> Author: </b>,"Jolene L Johnson, University of St. Catherine",<b> Co-Author(s): </b>,None,"For the past five years Women in Physics and Astronomy (WiPA) at the University of Minnesota has organized a women in physics undergraduate event that brings together students from up to 15 different institutions to network and learn about opportunities in physics and related fields. Many small colleges in the area have small physics departments with only a handful of female majors. This can lead to female students feeling isolated within their departments. We developed this annual event to both overcome some of this isolation and allow students to explore future education and career options in physics and engineering. In this talk I will present the most effective format we have discovered for these events, and well as outcomes and feedback.",None
Session:,Upper Division/Graduate Courses,Contributed,Title:,The Advanced Lab: Modern Techniques in a Research-Type Environment,Meeting:,"2013 Winter Meeting: New Orleans, Louisiana",Location:,N/A,Date:,,<b> Time: </b>,8:40AM,<b> Author: </b>,"Andra Troncalli, Austin College, Department of Physics",<b> Co-Author(s): </b>,None,"Our advanced lab is a junior-level elective whose purpose is to strengthen our students' experimental research skills. In order to achieve this goal, students are introduced to modern techniques: phase sensitive detection, temperature measurement and control, and instrument interfacing through LabVIEW. Once trained in using the equipment, students design their own experiments in order to investigate the relevant properties of the materials under study. Specific topics include high temperature superconductivity, diode laser, and Faraday rotation. The approach is more similar to that used in a research setting, rather than in a traditional classroom.",None
Session:,Apparatus Gumbo,Contributed,Title:,A Low-cost Method To Measure the Speed of Sound,Meeting:,"2013 Winter Meeting: New Orleans, Louisiana",Location:,N/A,Date:,,<b> Time: </b>,8:20PM,<b> Author: </b>,"David Kardelis, Utah State University Eastern",<b> Co-Author(s): </b>,None,"The science equipment suppliers offer a nice apparatus to measure the speed of sound using a water column. While this is a nice device, it is relatively expensive, difficult to store, and the students usually make a mess in the classroom. A low-cost alternative to this device will be shown. The device, made out of readily available PVC pipe, has several advantages. Both open and closed pipe resonances can be used. The pipe can be easily expanded to use lower frequency waves and several of the setups can be stored in a small space.",None
Session:,PER: Student Reasoning,Contributed,Title:,Effectiveness of a 3D Interactive Demonstration of EM Plane Waves,Meeting:,"2013 Winter Meeting: New Orleans, Louisiana",Location:,N/A,Date:,,<b> Time: </b>,1:30PM,<b> Author: </b>,"Ximena C. Cid, University of Washington",<b> Co-Author(s): </b>,"Paula R.L. Heron, Lillian C. McDermott, Ramon E. Lopez","Electromagnetic (EM) plane waves are arguably one of the most difficult and abstract ideas taught in an introductory physics course. Instruction on this topic typically involves the use of both three-dimensional diagrams (shown in two dimensions) and mathematical representations. Both of these representations rely heavily on the ability of students to visualize electric and magnetic fields in space and to visualize how they change over time. This presentation will focus on an investigation of an EM plane wave in free space that was used in conjunction with Tutorials in Introductory Physics(1) at the University of Washington. 1 Tutorials in Introductory Physics, 2002, 1st Edition (Prentice Hall, Upper Saddle River, NJ. *This work has been supported in part by the National Science Foundation under Grant No. DUE-0733276.",None
Session:,Introductory Courses,Contributed,Title:,An Integrated Lab-Lecture Approach to Increasing Student Engagement,Meeting:,"2013 Winter Meeting: New Orleans, Louisiana",Location:,N/A,Date:,,<b> Time: </b>,7:40PM,<b> Author: </b>,"Doug Bradley-Hutchison, Sinclair Community College",<b> Co-Author(s): </b>,Lalitha Locker,"For approximately the past five years we have scheduled several sections of calculus-based physics courses each term so that lab and lecture are integrated. The class is then taught using a mixture of lecture/discussion, activity work (which often is hands on) and labs. Topics are frequently introduced through exploratory activities, or lab so that students can develop a phenomenological sense of the material prior to the development of any formal theory. Lab handouts are written in an open- ended manner so that students draw conclusions without reference to any overriding theory and serve the purpose of setting the stage for material developed through lecture/discussion. Thus students engage in dynamic experimental learning exercises as opposed to being passive listeners. We will present the specifics of several topic scenarios and discuss our conclusions regarding the overall effectiveness of this approach.",None
Session:,Physics Preparation for Preservice Elementary Teachers,Invited,Title:,An Inquiry-based Course in Chemistry and Physics for Pre-service Teachers,Meeting:,"2013 Winter Meeting: New Orleans, Louisiana",Location:,N/A,Date:,,<b> Time: </b>,8:20PM,<b> Author: </b>,"Michael Loverude, California State University Fullerton",<b> Co-Author(s): </b>,None,"Physics/Chemistry 102, ""Physical Science for Future Elementary Teachers"" is one of three courses that were developed at California State University Fullerton as part of an NSF-funded initiative to enhance the science content understanding of prospective teachers; the other courses cover geology and biology. Phys/Chem 102 is taught in a weekly six-hour lab format, with enrollment limited to 26 students per section and little or no lecture instruction. The course emphasizes learning science in context and a strong focus on conceptual understanding. The intention is that prospective teachers will see science as an interconnected discipline with real-world implications, rather than a collection of facts and equations. In this talk, we describe the course and its development, present research on student understanding for students in this course and similar-level lecture courses, and examine the present and future prospects for the course.",None
Session:,Upper Division/Graduate Courses,Contributed,Title:,Student Connections between Multiplicity and Macroscopic Entropy,Meeting:,"2013 Winter Meeting: New Orleans, Louisiana",Location:,N/A,Date:,,<b> Time: </b>,8:10AM,<b> Author: </b>,"Michael E. Loverude, California State University Fullerton",<b> Co-Author(s): </b>,Sissi L. Li,"As part of an ongoing project involving research and curriculum development in upper-division thermal physics, we have investigated student understanding of the concept of entropy and the approach to thermal equilibrium. In the thermal physics approach, the second law of thermodynamics is motivated by an extended examination of statistical properties and entropy is first introduced in terms of multiplicity. In the current talk, we present data from written problems in which students are asked about entropy and multiplicity in the context of interacting bodies. In particular, we will show responses that suggest that the link between multiplicity and entropy can be more challenging for students than might be expected.",Supported in part by NSF grant DUE 0817335.
Session:,Recruiting and Retaining Physics Students,Contributed,Title:,Introductory Calculus-based Physics for Underprepared Students,Meeting:,"2013 Winter Meeting: New Orleans, Louisiana",Location:,N/A,Date:,,<b> Time: </b>,2:40PM,<b> Author: </b>,"Dean Richardson, Xavier University of Louisiana",<b> Co-Author(s): </b>,None,"Part of the mission of Xavier University of Louisiana is to admit some students who are not fully prepared for the rigors of college- level courses. A different approach is needed in order for these students to reach the necessary level of competency by the time they graduate. Some of the methods used in our introductory physics sequence for physics majors will be discussed. These include specific implementations of in-class problem solving, detailed lab reports and homework.",None
Session:,Just Labs,Poster,Title:,Instructional Labs in Modern/Materials Physics,Meeting:,"2013 Winter Meeting: New Orleans, Louisiana",Location:,N/A,Date:,,<b> Time: </b>,6:50PM,<b> Author: </b>,"Gabriel C. Spalding, Illinois Wesleyan University",<b> Co-Author(s): </b>,None,"We will discuss a course where students take on six of the following: LabVIEW programming for GPIB control of instrumentation; DC measurement of milli-ohm samples (2-probe vs. 4-probe); Lock-in measurement of resistivity; Elastic moduli measurements (uniform vs non-uniform strain); Diffraction of light by 1D, 2D and 3D crystalline arrays (with microwaves); Wave Nature of Matter: Quantized Conductance of gold wire nanocontacts (Mechanical Break Junctions); Particle-like Behavior of Localized Electrons: Coulomb Blockade with gold nanoparticles; Modes of coupled oscillators; Detecting Phonon Modes in Si Tunnel Diodes at Low-Temperature; Temperature dependence of Hall Effect; Extracting Boltzmann statistics from sedimenting colloid; Measurement of 1/f noise; Examination of Johnson noise; Blinking Quantum Dots; Examination of ordering: g(r) and S(k); Curie Temperature of Gadolinium (and thermoelectric temperature control).",None
Session:,Introductory Courses,Contributed,Title:,The Application of Play Theory to Textbook Design,Meeting:,"2013 Winter Meeting: New Orleans, Louisiana",Location:,N/A,Date:,,<b> Time: </b>,8:30PM,<b> Author: </b>,"Juan R. Burciaga, Mount Holyoke College",<b> Co-Author(s): </b>,None,"Though play theory can be an effective paradigm to apply to course design, its application to a static textbook provides many challenges. What are the aspects of play theory that apply to textbook design? How can these aspects be evaluated? What do we gain by applying play theory to textbook structure? An earlier paper (""Textbook Design: An Exploration of Pedagogical Properties of Textbooks"", PERC 2012) proposed seven properties that can be used to evaluate textbooks. This paper will present an update of how well those properties are being used in evaluating three physics books that each have distinctly different goals. The perspectives of play theory that can be applied to textbook design are discussed and illustrated with examples from the textbooks being evaluated.",None
Session:,How to Gear an Introductory Physics Course Toward Allied Health Majors,Contributed,Title:,Sonography and Physics Classroom Crossover Part II,Meeting:,"2013 Winter Meeting: New Orleans, Louisiana",Location:,N/A,Date:,,<b> Time: </b>,2:30PM,<b> Author: </b>,"Erick Agrimson, St. Catherine University",<b> Co-Author(s): </b>,Susan Hummel,"The Physics Department at St. Catherine University has been offering Physics for the Health Sciences for over 10 years. Of the students who have taken the course, well over 60% were, or are, involved in an Allied Health emphasis. One of the many ways we have adapted the course is to include ultrasound physics. Not only do we talk about waves, but also about phenomena in the optics section that have ultrasonic similarities i.e. refraction, edge artifact and wave interference. We also make connections between electrical resistance and hemodynamics in the course. Since I teach the physics course that the students in the ultrasound sequence take, I will talk about the advantages of the physics and ultrasound physics crossover and how it benefits all of our Allied Health majors.",None
Session:,SPS Undergraduate Poster Reception,Poster,Title:,Determining DNA Breaks Due to Neutron Radiation,Meeting:,"2013 Winter Meeting: New Orleans, Louisiana",Location:,N/A,Date:,,<b> Time: </b>,8:00PM,<b> Author: </b>,Linda J. Poplawski,<b> Co-Author(s): </b>,None,"The amount of radiation that a human being is safely allowed to receive is determined from a linear curve extrapolated from unfortunate events in which large doses were delivered, such as atomic accidents. In order to determine if the body reacts to neutron radiation in a different way, such as with a threshold, DNA breaks were examined. Large doses of neutron radiation, from a neutron generator, were given to plasmid DNA placed in a copper holding block to determine if there are any damages in the DNA specifically due to radiation. The irradiated DNA was then analyzed using gel electrophoresis and measurements were taken from those images. Assumptions have been used in order to create a simpler calculation of the radiation given and to determine an approximated dose received by the plasmid DNA.",None
