Session:,PER: Student Reasoning and Problem Solving,Contributed,Title:,Problem Solving Reflection: Homework Versus In-Class Problem Solution,Meeting:,"2014 Winter Meeting: Orlando, Florida",Location:,N/A,Date:,,<b> Time: </b>,9:30AM,<b> Author: </b>,"Andrew J. Mason, University of Central Arkansas",<b> Co-Author(s): </b>,None,"A preliminary study in a spring 2013 introductory physics for life sciences (IPLS) course focused on a metacognitive activity of reflecting on a chosen homework problem during the initial portion of each lab over the duration of the course, with the assistance of a reflection rubric. Artifact data was gathered from a MPEX pre-post survey, students' reflection attempts and exam solutions, and a post-test reflection survey. Combined data suggested that students were of mixed-to-positive opinion of the metacognitive activity. While students appeared to benefit somewhat, many chose to obviate the exercise a priori by obtaining the correct solution for the homework problem in advance. To explore the robustness of these indications, implementations to the exercise were made to be more ergonomic to the course material and prevent this occurrence. We revisit the preliminary data from last spring in light of the fall semester's progress.",None
Session:,PER: Topical Understanding and Attitudes,Contributed,Title:,Investigating Physics and Engineering Students' Understanding of op-amp Circuits*,Meeting:,"2014 Winter Meeting: Orlando, Florida",Location:,N/A,Date:,,<b> Time: </b>,11:30AM,<b> Author: </b>,"MacKenzie R. Stetzer, University of Maine",<b> Co-Author(s): </b>,"Kevin L. Van De Bogart, Christos P. Papanikolaou","As part of a new effort at the University of Maine to investigate the learning and teaching of concepts in thermodynamics and electronics that are integral to both undergraduate physics and engineering programs, we have been examining student learning in electrical engineering and physics courses on electric circuits and electronics. A major goal of this work at the physics-engineering interface is to probe the extent to which the nature of student understanding (including the prevalence of specific difficulties) depends upon the disciplinary context. In this talk, I will focus on our efforts to probe student understanding of basic operational-amplifier circuits using free-response questions. Preliminary results from questions administered in both physics and engineering courses will be presented. *This work has been supported in part by the National Science Foundation under Grant Nos. DUE-1323426, DUE-1022449, and DUE-0962805.","*This work has been supported in part by the National Science Foundation under Grant Nos. DUE-1323426, DUE-1022449, and DUE-0962805."
Session:,Lecture/Classroom Posters,Poster,Title:,Whiteboarding in Conceptual Physics: Evidence From a First Year Experience*,Meeting:,"2014 Winter Meeting: Orlando, Florida",Location:,N/A,Date:,,<b> Time: </b>,8:30PM,<b> Author: </b>,"Bradley F. Gearhart, Buffalo Public Schools",<b> Co-Author(s): </b>,"John Bihr, Dan MacIsaac","During the 2012-2013 school year, Riverside High School, a persistently low achieving school in the Buffalo Public School District (Buffalo, NY), launched their first offering of Conceptual Physics to support the a new Health Science Academy within the school. Two teachers integrated whiteboarding into three sections of Conceptual Physics. Despite chronic absenteeism, high levels of initial student apathy, a preponderance of ESL students, and extraordinarily diverse student demographics, whiteboards demonstrated profound levels of student thinking and highly varied interpretations of shared evidence not typically associated with students in low performing urban schools. Evidence gathered from student whiteboards demonstrated cognitive interaction beyond that typically reflected on high stakes standardized testing for this student population.","This project was supported by Buffalo State College, and the National Science Foundation (NSF) funded Interdisciplinary Science and Engineering Partnership (ISEP) MSP project."
Session:,Qualitative and Ethnographic Methods in PER,Invited,Title:,Selecting and Analyzing Mountains of Data: Creating Ethnographies,Meeting:,"2014 Winter Meeting: Orlando, Florida",Location:,N/A,Date:,,<b> Time: </b>,4:30PM,<b> Author: </b>,"Idaykis Rodriguez, Florida International University",<b> Co-Author(s): </b>,None,"Ethnographies may sometimes be viewed as a catch-all qualitative research method, but there is more to ethnographies than just collecting all types of data. Between participant observations, interviews, document analysis, and fieldwork it can be daunting to sort through all the data. This talk discusses how researchers organize, select, and analyze the multiple forms of data in an ethnographic study to tell a story about a group's culture. Within the specific example of an ethnography of a physics research group, I will present field notes of participant observation, interviews with group members, video recording of research meetings, and final group documents to understand graduate student development of writing scientific papers.",None
Session:,Technologies Posters,Poster,Title:,Simulating Simple Roller Coaster Physics for Animation and Interactive Applets,Meeting:,"2014 Winter Meeting: Orlando, Florida",Location:,N/A,Date:,,<b> Time: </b>,8:00AM,<b> Author: </b>,"Michael R. Gallis, Penn State Schuylkill",<b> Co-Author(s): </b>,None,"This poster presents the underlying physics used to simulate motions typically discussed under the auspices of ""Roller Coaster Physics"" in animation and an interactive java applet used in introductory physics. The car is modeled as a mass moving along a parametric curve, either at constant speed or coasting (with and without friction). Generating solutions to the resulting equations of motion places some constraints on the parametric equations describing the path of the track through space. The resulting materials are used to explore topics such as energy, power, circular motion, reaction forces and friction. In order to dramatize the repercussions of failing to loop at sufficient speed, collision dynamics are employed to simulate the car bounding off of the track and ground. Visual materials generated using the model are available online.(1,2)",1: Roller Coaster Model (Java applet) http://www.opensourcephysics.org/items/detail.cfm?ID=8228 2: Roller Coaster Physics Animation http://www.youtube.com/watch?v=5yD2tOhI8SU
Session:,Innovations in Research and Teaching Astronomy,Contributed,Title:,Evaluating the Use of Internet-based Robotic Telescopes for General Education,Meeting:,"2014 Winter Meeting: Orlando, Florida",Location:,N/A,Date:,,<b> Time: </b>,5:10PM,<b> Author: </b>,Katie J. Berryhill,<b> Co-Author(s): </b>,"Kim Coble, Timothy F. Slater, Kevin M. McLin, Lynn R. Cominsky","Responding to national science education reform documents calling for students to have more opportunities for authentic research experiences, several national projects have developed online telescope networks to provide students with Internet-access to research grade telescopes. Internet-based robotic telescopes allow scientists and STEM educators to conduct observing sessions on research-grade telescopes remotely. This project examines the educational value of using Internet-based robotic telescopes in general education astronomy courses. Students at several institutions conducted observational programs using telescopes that are part of Skynet. Using a grounded theory approach, we examined what the students did or did not gain from the project, including students' understanding of the process of science. Analysis suggests that students value using research-grade instrumentation and develop deeper understandings of the nature of scientific research when formulating proposals for telescope use.(1)",1. Also see our associated presentation on Engaging General Education Astronomy Students with Internet-Based Robotic Telescopes by Coble et al.
Session:,Inservice Preparation for Pre High School Teachers,Contributed,Title:,Energy: Deeper and Cheaper: Lessons Low Cost but High Potential Part 1,Meeting:,"2014 Winter Meeting: Orlando, Florida",Location:,N/A,Date:,,<b> Time: </b>,12:30PM,<b> Author: </b>,"Gene Easter, retired",<b> Co-Author(s): </b>,"Bill Reitz, Nina Daye, Leslie Embrey, Marge Cotton","A workshop was given to local Orlando third to fifth grade teachers prior to this Winter 2014 AAPT Meeting by a number of PTRAs. In this talk we will share the difficulties and successes of that workshop and the philosophy and hopes for future workshops. Meant as a guide to teaching energy concepts using the cheap and the familiar, the workshop attempted to develop deeper conceptual understanding of energy storage, transfer, transformation and degradation. We emphasized cutting down the cognitive load by reducing jargon and providing concrete examples from everyday experience. Activities were chosen to align with the NGSS and CCSS and were drawn from Energy Theater (Seattle Pacific University), Operation Primary Physical Science, Robert Karplus, Fred Goldberg and Pat Heller among others.",None
Session:,SPS Research and Outreach Poster Session,Poster,Title:,Local University Astronomy Club + Local High School Astronomy Club = Success!,Meeting:,"2014 Winter Meeting: Orlando, Florida",Location:,N/A,Date:,,<b> Time: </b>,8:00PM,<b> Author: </b>,"Kathleen A. Gustavson, Nicolet High School",<b> Co-Author(s): </b>,None,"Having a RET position at the local university with a faculty-led astronomy club has opened a wide door, for both myself and my students. There now exists a partnership between the astronomy club at the local university (UWM) and the astronomy club at my high school (Nicolet HS). I frequently take my students to UWM for the meetings, where they enjoy talks by undergrads, graduates, post docs, faculty, and guest speakers. The occasional field trips are also enjoyed. Processed radio data is available for the students to search for pulsars. From these opportunities, the students get first-hand knowledge of the processes of science at the university level. They see the research positions available to undergraduates and graduate students, and the in-depth work the faculty does in their own research.",None
Session:,Using History to Teach Astronomy and Physics,Invited,Title:,"Contact with the Past, Hands on the Phenomena:Laboratory Activites in Ancient Astronomy",Meeting:,"2014 Winter Meeting: Orlando, Florida",Location:,N/A,Date:,,<b> Time: </b>,4:00PM,<b> Author: </b>,"James Evans, University of Puget Sound",<b> Co-Author(s): </b>,None,"Ancient astronomy is rich in opportunities for hands-on learning, about the natural world, as well as about intellectual and cultural history. This talk will illustrate some ways in which students can develop a deeper appreciation of the history of science while also learning some astronomy that is still perfectly valid and applicable today. Topics to be covered include constructing a sundial, making a parapegma (a star calendar), and predicting the position of a planet in the zodiac.",Invited by Todd Timberlake
Session:,Innovations in Research and Teaching Astronomy,Contributed,Title:,Engaging General Education Astronomy Students with Internet-based Robotic Telescopes,Meeting:,"2014 Winter Meeting: Orlando, Florida",Location:,N/A,Date:,,<b> Time: </b>,5:00PM,<b> Author: </b>,"Kimberly Coble, Chicago State University",<b> Co-Author(s): </b>,"Katie Berryhill, Timothy F. Slater, Kevin M. McLin, Lynn R. Cominsky","At Chicago State University we have implemented an observational project in our general education astronomy class using the Global Telescope Network (GTN), which is controlled using Skynet. We wanted to expose students to realistic practices used by professional astronomers, including proposal writing and peer review. The project consisted of the use of planetarium software to determine object visibility,observing proposals (with abstract, background, goals, and dissemination sections),peer review (including written reviews and panel discussion according to NSF intellectual merit and broader impacts criteria), andclassroom presentations showing the results of the observation. GTN is a network of small telescopes funded by the Fermi mission and managed by the NASA E/PO Group at Sonoma State University. This work was supported by CCLI Grant #0632563 and IL Space Grant. Also see our associated presentation on Evaluating the Use of Internet-Based Robotic Telescopes for General Education by Berryhill et al.",None
Session:,Inservice Preparation for Pre High School Teachers,Contributed,Title:,Energy: Deeper and Cheaper: Low Cost High Potential Part 2,Meeting:,"2014 Winter Meeting: Orlando, Florida",Location:,N/A,Date:,,<b> Time: </b>,12:40PM,<b> Author: </b>,"William E. Reitz, retired",<b> Co-Author(s): </b>,"Leslie Embrey, Mari Hayes, Marge Cotton, Nina Daye",A continuation of the discussion of a workshop presented in Orlando to grade 3 to 5 teachers prior to this Winter AAPT meeting. Part of the motivation to organize this workshop was to serve local pre-high school teachers of host city by utilizing the expertise of members who would be attending the meeting and introducing that community to the services of PTRA and AAPT. We will share the difficulties and successes of the workshop and the philosophy and hopes for future workshops.,None
Session:,Teacher Preparation and Enhancement,Contributed,Title:,Who is Teaching High School Physics in Central Florida?,Meeting:,"2014 Winter Meeting: Orlando, Florida",Location:,N/A,Date:,,<b> Time: </b>,5:20PM,<b> Author: </b>,"Jacquelyn J. Chini, University of Central Florida",<b> Co-Author(s): </b>,"Kevin H. Thomas, Malcolm B. Butler, Talat S. Rahman","The University of Central Florida has recently become a PhysTEC comprehensive site to promote the recruitment and training of highly qualified physics teachers in the Central Florida area. PhysTEC has identified several key components of successful physics teacher preparation programs, including efforts directed at our own students, such as a learning assistant program and early teaching experiences, as well as efforts directed at the teaching community, such as fostering communication and mentoring with and between local physics teachers. To better support the local high school physics teaching community and provide relevant mentoring to our future teachers, we need to understand the backgrounds of our local teachers. We will present results from a survey of the pathways local teachers took to their current positions, highlighting their certification process and other training, and discuss how these results will shape our future efforts to engage and support the high school physics teaching community.",None
Session:,Teacher Preparation and Enhancement,Contributed,Title:,Tracking High School Physics Teaching in Iowa,Meeting:,"2014 Winter Meeting: Orlando, Florida",Location:,N/A,Date:,,<b> Time: </b>,4:40PM,<b> Author: </b>,"Jeffrey T. Morgan, University of Northern Iowa",<b> Co-Author(s): </b>,Darian Everding,"In 2009, we surveyed Iowa high school physics teachers to ascertain their educational backgrounds, content coverage, and pedagogical approaches in their courses, and views of effective instruction, among others.(1) We repeated the survey in 2013, keeping many questions the same but tweaking others to gain new insights into the reasons some teachers leave the profession and the amount of inquiry-oriented instruction that teachers employ. We present survey highlights and trends observed over the four-year period that inform stakeholders in Iowa and similar states with significant numbers of small, rural schools.",(1) The survey report is available at http://www.physics.uni.edu/teacher-survey.
Session:,The Relevance of Laboratory and Apparatus,Contributed,Title:,Guidelines for the Undergraduate Laboratory Curriculum,Meeting:,"2014 Winter Meeting: Orlando, Florida",Location:,N/A,Date:,,<b> Time: </b>,1:00PM,<b> Author: </b>,"Joseph F. Kozminski, Lewis University",<b> Co-Author(s): </b>,None,A subcommittee of the AAPT Committee on Laboratories has been established to review various documents relating to goals of the undergraduate lab at all levels and to recommend guidelines or goals for the laboratory in the undergraduate curriculum. We are working to develop fairly broad guidelines that cut across the various levels of undergraduate labs and that can be implemented at any college or university. Specific recommendations will be given for implementation in introductory and advanced labs. The guidelines and recommendations generated by the subcommittee will be presented in this talk.,"The other members of this subcommittee are Nancy Beverly, Duane Deardorff, Dick Dietz, Melissa Eblen-Zayas, Robert Hobbs, Dean Hudek, Heather Lewandowski, Steve Lindaas, Ann Reagan, Randy Tagg, Jeremiah Williams, Benjamin Zwickl."
Session:,PER: Student Reasoning and Problem Solving,Contributed,Title:,Characterizing Students' Use of Models During Experimentation,Meeting:,"2014 Winter Meeting: Orlando, Florida",Location:,N/A,Date:,,<b> Time: </b>,8:40AM,<b> Author: </b>,"Benjamin M. Zwickl, Rochester Institute of Technology",<b> Co-Author(s): </b>,"H J. Lewandowski, Noah Finkelstein","Models are simplified and abstract representations of real-world phenomena that are used for creating and communicating scientific explanations. In this study we analyze students' use of models in a 30-minute think-aloud lab activity involving basic electronic and optical components. The framework used for our fine-grained analysis of modeling during experimentation was developed independently in the context of curriculum development for upper-division physics laboratories. We review general patterns in students' use of models, describe our coding scheme, and conclude with a discussion of implications for the design of modeling-focused lab activities and lab-appropriate assessments.",None
Session:,Physics Education Research Posters 2,Poster,Title:,Characterizing Students' Use of Models During Experimentation,Meeting:,"2014 Winter Meeting: Orlando, Florida",Location:,N/A,Date:,,<b> Time: </b>,8:30PM,<b> Author: </b>,"Benjamin M. Zwickl, Rochester Institute of Technology",<b> Co-Author(s): </b>,"H. J. Lewandowski, Noah Finkelstein","Models are simplified and abstract representations of real-world phenomena that are used for creating and communicating scientific explanations. In this study we analyze students' use of models in a 30-minute think-aloud lab activity involving basic electronic and optical components. The framework used for our fine-grained analysis of modeling during experimentation was developed independently in the context of curriculum development for upper-division physics laboratories. We review general patterns in students' use of models, describe our coding scheme, and conclude with a discussion of implications for the design of modeling-focused lab activities and lab-appropriate assessments.",None
Session:,Teacher Training and Enhancement Posters,Poster,Title:,"Merging Engineering Design, Technology and Physics for K-12 Teachers",Meeting:,"2014 Winter Meeting: Orlando, Florida",Location:,N/A,Date:,,<b> Time: </b>,9:15PM,<b> Author: </b>,"Dan L. MacIsaac, SUNY Buffalo State College Physics",<b> Co-Author(s): </b>,"Sam Cirpili, Bradley Gearhart, Kathleen Stadler, Clark Greene","We describe efforts of the Interdisciplinary Science and Engineering Partnership (ISEP), a $10M NSF Math Science Partnership supported project involving SUNY at Buffalo (UB), Buffalo Public Schools, Buffalo State College, the Buffalo Museum of Science, PraxAir Corp and other partnering education institutions and corporate partners. This poster focuses on the creation of specific courses combining Engineering Design, Technology and Physics content addressing NGSS standards for K-12 teachers. These courses are offered as part of the SUNY Buffalo State Summer Physics Teachers' Academy.",None
Session:,Teacher Training and Enhancement Posters,Poster,Title:,SUNY Buffalo State Summer Physics Teachers' Academy: The First Decade,Meeting:,"2014 Winter Meeting: Orlando, Florida",Location:,N/A,Date:,,<b> Time: </b>,9:15PM,<b> Author: </b>,"Alyssa Cederman, SUNY Buffalo State College Physics",<b> Co-Author(s): </b>,"Dan MacIsaac, David Abbott, Kathleen Falconer, David Henry","The SUNY Buffalo State Summer Physics Teachers' Academy, partially modeled after the Arizona State University Summer Modeling workshops, has run since summer 2002, serving more than 400 individual teachers seeking NYSED physics certification, including over 100 M.S.Ed. (Physics) degree graduates and candidates from the Buffalo State Physics Department. Each summer between two and five graduate credit teacher workshop courses have been offered, serving as many as 30 students per class. We share demographic data, insights, and experiences from the first decade of our summer academy, including recommendations and pitfalls for others interested in creating summer academies for physics teachers.",None
Session:,Labs/Apparatus Posters,Poster,Title:,Acoustic Wave Lab for Introductory and Upper Level Physics Majors,Meeting:,"2014 Winter Meeting: Orlando, Florida",Location:,N/A,Date:,,<b> Time: </b>,8:00AM,<b> Author: </b>,"Daniel Hartman, University of West Georgia",<b> Co-Author(s): </b>,"Ben Jenkins, Bob Powell","Iowa Doppler Products' (IDP) instrumentation has been used to measure the speed of sound through a variety of media. Other measurements, such as a single slit experiment and refraction at a corner, have also been performed. Errors in the speed of sound in water were typically about 0.5%. This equipment will be used in the University of West Georgia's (UWG) introductory honors physics lab and upper level experimental physics labs. The tool's versatility also will allow for multiple junior and senior level research projects for our undergraduate majors.",Sponsored by Bob Powell
Session:,Stereotypes and the Princess Threat,Contributed,Title:,Strategies for Identifying and Teaching Gifted Students in Physics and Astronomy,Meeting:,"2014 Winter Meeting: Orlando, Florida",Location:,N/A,Date:,,<b> Time: </b>,12:40PM,<b> Author: </b>,"Alice M. Hawthorne Allen, Concord University",<b> Co-Author(s): </b>,None,"Gifted students in K-12 education become many of the students in our physics classrooms, but our training for university faculty positions contains little to no guidance on how to best teach and address their educational needs. Just based on population statistics and self-selection for additional education, all college classes are bound to have a gifted population regardless of institution and admissions selectivity, and independent of whether the students are identified as such. Recent research has also identified additional twice-exceptional students (i.e. individuals who are both gifted and have other special needs) where their exceptionalities mask each other and lead the student to not stand out academically. The extreme variability amongst gifted individuals makes teaching them an exceptional challenge. However, there are common characteristics that can be identified and teaching strategies that are successful in connecting with these students. These characteristics and strategies will be addressed in this talk.",None
Session:,Teacher Training and Enhancement Posters,Poster,Title:,Supporting the Metamorphosis from Physics Student to Physics Teacher,Meeting:,"2014 Winter Meeting: Orlando, Florida",Location:,N/A,Date:,,<b> Time: </b>,8:30PM,<b> Author: </b>,"Mary A. Norris, Virginia Tech Physics Department",<b> Co-Author(s): </b>,"John Simonetti, Leo Piilonen, George Glasson, Brenda Brand","The Virginia Tech Physics Department and School of Education are in their third year of a collaboration with the Physics Teaching Education Coalition (PhysTEC) to increase the number of highly prepared physics teachers graduating from the university. Among the techniques employed to realize this goal are providing early field experiences for students, providing a course on physics-specific pedagogy, and providing financial support during the master's of education (MAEd) program through a physics graduate assistantship. In the past two years, six students have graduated from the program with their MAEd. All currently teach high school physics. All entered the classroom well prepared and excited to teach. What happened after they met their students and closed their doors? This study traces the evolution of these teachers' beliefs and practices during their first semester of teaching and the effect of both local and PhysTEC mentoring efforts.",None
Session:,Physics for Non-Scientists,Contributed,Title:,Development of a Blended Physical Science Course,Meeting:,"2014 Winter Meeting: Orlando, Florida",Location:,N/A,Date:,,<b> Time: </b>,9:40AM,<b> Author: </b>,"Sytil K. Murphy, Shepherd University",<b> Co-Author(s): </b>,Jeff Groff,"A blended course combines both traditional and online course content. In summer 2013, a blended physical science course for non-science majors was developed. A majority of the lecture portion of the course was online while the laboratory portion remained traditional. The blended course was implemented during a summer session concurrent with course development. In this talk, the course, the materials developed, the data obtained after their implementation, and the subsequent refinements to the course will be discussed.",None
