Session:,Pre-College PER,Invited,Title:,The Enactment of Content Knowledge for Teaching Energy During Instruction,Meeting:,"2014 Winter Meeting: Orlando, Florida",Location:,N/A,Date:,,<b> Time: </b>,5:00PM,<b> Author: </b>,"Robert Zisk, Rutgers University",<b> Co-Author(s): </b>,None,"Content knowledge for teaching (CKT) is a practice-based theory of the professional knowledge that a person needs in order to be able to effectively teach a subject (Ball, Thames and Phelps, 2008). Originally conceptualized in the subject of mathematics, our work is centered on CKT for physics, specifically in the area of energy. In developing the framework for CKT for teaching energy, we have identified the aspects and tasks of teaching physics, and more specifically, of teaching energy, that are needed for effective instruction. This talk will discuss the development of the tasks of teaching and demonstrate how these tasks are enacted in the classroom during instruction using video collected from a group of teachers during the teaching of energy.",None
Session:,SPS Research and Outreach,Contributed,Title:,Evidence for Dark Matter in the Galactic Rotation Curve,Meeting:,"2014 Winter Meeting: Orlando, Florida",Location:,N/A,Date:,,<b> Time: </b>,3:20PM,<b> Author: </b>,"Melvin Jason Ezell, Campbell University",<b> Co-Author(s): </b>,Jacob K Bartlett,"The mass of the dark matter halo, or ""missing mass"" interior to the Sun's orbit was calculated by creating a galactic rotation curve for the Milky Way galaxy. This rotation curve was created by measuring the orbital velocity of interstellar hydrogen at different distances from the galactic core. A 4.6-meter radio telescope was used to collect data on the radio waves emitted by hydrogen at various galactic longitudes. Since hydrogen emits radio waves at a baseline frequency of 1.42 GHz, the Doppler shifted wavelengths observed provided a means to calculate the orbital velocity of the galaxy's matter. This rotation curve was then compared to the amount of visible mass in the galaxy and the missing mass was calculated. This research was converted to a laboratory exercise for undergraduate physics students at Campbell University which included a pre-assessment of content-specific knowledge and a post-assessment of learning outcomes.",None
Session:,International Models of Physics Teacher Preparation,Invited,Title:,Comparing Finland to Germany: Lessons Learned in Teacher Preparation,Meeting:,"2014 Winter Meeting: Orlando, Florida",Location:,N/A,Date:,,<b> Time: </b>,5:00PM,<b> Author: </b>,Meike Kricke,<b> Co-Author(s): </b>,None,"Since the ""PISA Shock"" after 2001, educational research in Europe has recognized new emphasis on the success of the Finnish educational system: Finland is ""seen as a major international leader in education"" (OECD 2010, 118). The approach of integrating core sciences and education curricula in the one-phase teacher preparation studies, was identified as a key factor of success, as well as the intense use of dialogical reflection tools, like portfolio techniques in school and in teacher preparation. The focus is directed toward pupils at schools and students at universities. As is highlighted in this talk, adapting the key factors from the Finnish into the central European educational systems is not an easy task. One example of the University of Cologne is presented. It shows how Finnish key factors and educational ideas can be integrated into teacher education: ""International teacher education laboratory -- Developing inclusive values and ideas through e-portfolios"".",None
Session:,Apparatus Magic,Contributed,Title:,A Quantitative Comparison of Four Different Lighting Types,Meeting:,"2014 Winter Meeting: Orlando, Florida",Location:,N/A,Date:,,<b> Time: </b>,7:40PM,<b> Author: </b>,"Stephen A. Minnick, Kent State University at Tuscarawas",<b> Co-Author(s): </b>,None,"Most students have little idea of the differences between the four basic types, incandescent, CFL, LED, and halogen, of household light bulbs being marketed. In order to drive home these differences and demonstrate the tradeoffs between lighting quality, efficiency, and costs, a new laboratory experiment has been developed suitable for high school and undergraduate students in basic science courses. For each lighting type, various quantities such as input power, light output, and efficiency are measured and then compared. Light quality from each bulb is determined by using inexpensive spectroscopes.",None
Session:,Labs/Apparatus Posters,Poster,Title:,An Inexpensive Quantitative Demonstration of Harmonics in Piped Sound Makers,Meeting:,"2014 Winter Meeting: Orlando, Florida",Location:,N/A,Date:,,<b> Time: </b>,8:45AM,<b> Author: </b>,"Stephen A. Minnick, Kent State University at Tuscarawas",<b> Co-Author(s): </b>,None,"A simple inexpensive activity, which can be included as part of a larger laboratory experiment, utilizes open-source software and a computer microphone to display the harmonics of open and closed end pipes. Students calculate the theoretical frequencies produced by blowing across the top of short lengths of PVC tubing and compare them to the display of actual frequencies present.",None
Session:,SPS Research and Outreach Poster Session,Poster,Title:,Stratospheric Thermal Wake Investigation,Meeting:,"2014 Winter Meeting: Orlando, Florida",Location:,N/A,Date:,,<b> Time: </b>,8:00PM,<b> Author: </b>,"Mara Blish, St.Catherine University",<b> Co-Author(s): </b>,"Rachel Hedden, Amanda Grove, Erick Agrimson, James Flatten","We present data characterizing the thermal wake that trails below ascending high-altitude balloons (AKA weather balloons) as they ascend into the stratosphere. This wake, which is warmer than the ambient air during the day but colder during night flights, is reported to be significant within 25 feet of the base of the balloon. We have built and flown a ""wake boom"" that hangs below latex weather balloons with a 1-D array of temperature sensors that extends horizontally from directly beneath the balloon to outside of the predicted width of the thermal wake. We present analysis of the temperature profiles collected utilizing this apparatus.",Mara Blish (Undergraduate) is being sponsored by Erick Agrimson AAPT member
Session:,Innovative Undergraduate Labs,Contributed,Title:,SPAD- The World's Cheapest Single Photon Detector,Meeting:,"2014 Winter Meeting: Orlando, Florida",Location:,N/A,Date:,,<b> Time: </b>,8:10PM,<b> Author: </b>,"Jonathan F. Reichert, TeachSpin, Inc.",<b> Co-Author(s): </b>,None,"Chances are you already have several of the world's cheapest single photon detectors in your parts junk drawer. For those ""n-the-know"", these are called Single Photon Avalanche Diodes (SPADs), but most of us know them as LEDs. It turns out, if you reverse bias some LEDs with about 25 volts DC, they exhibit avalanche breakdown when a visible photon strikes the sensitive area of the p-n junction. Studying this breakdown phenomenon to confirm that it is a single photon event, and that it obeys the Poissonian statistics for some experimental parameters and not for others, is an important exercise for students. One only needs an LED, an operational amplifier, associated power supplies, oscilloscope, pulse counter, and a computer in order to study these pulses. These may be the world's cheapest single photon detectors, but they are also probably the world's most inefficient!",None
Session:,Innovative Undergraduate Labs,Contributed,Title:,Magnetic Field Measurements,Meeting:,"2014 Winter Meeting: Orlando, Florida",Location:,N/A,Date:,,<b> Time: </b>,7:50PM,<b> Author: </b>,"Barbara Wolff-Reichert, TeachSpin, Inc.",<b> Co-Author(s): </b>,None,"The existence of cheap commercial Hall effect sensors make it possible for both high schools and colleges to create valuable experiments where their students can measure the magnetic fields that they study in their theoretical courses. This includes the fields from currents in a long straight wire, a wire loop, and a Helmholtz pair of wire loops, as well as their dependence on distance. Students can measure the on-axis magnetic field dependence as a function of distance for a small uniformly magnetized disk and discover the 1/r3 dependence. They can determine the local Earth's magnetic field. All these measurements require the calibration of the sensor by the student. This in itself, is a useful exercise in standards measurement. Something rarely done in this computerized-instrument age.",None
Session:,Effective Practices in Educational Technology,Contributed,Title:,Technologies for Computational Physics,Meeting:,"2014 Winter Meeting: Orlando, Florida",Location:,N/A,Date:,,<b> Time: </b>,12:50PM,<b> Author: </b>,"Larry Engelhardt, Francis Marion University",<b> Co-Author(s): </b>,None,"It is generally recognized that computer simulations provide important tools for solving a wide variety of 21st century physics problems. In this presentation, we discuss the technologies that we use for teaching undergraduate physics students to create and use computer simulations. At the introductory level, students use the Python programming language for creating simulations and analyzing data. At the upper level, students learn parallel programming and execute their simulations on a high-performance computing cluster.",This project is supported by the NSF EPSCoR RII Track 1 cooperative agreement awarded to the University of South Carolina.
Session:,International Models of Physics Teacher Preparation,Invited,Title:,Models and Perspectives of International Student Exchanges in Teacher Education,Meeting:,"2014 Winter Meeting: Orlando, Florida",Location:,N/A,Date:,,<b> Time: </b>,4:00PM,<b> Author: </b>,Nina Glutsch,<b> Co-Author(s): </b>,"Andr Bresges, Myrle Dziak-Mahler, Christiane M. Bongartz","In Europe, e.g. Germany, teacher education has changed in the past years. By adapting the international Bachelor/Master degrees, the approach to a more practice-orientated teacher education has been focused on. Also, a more internationalised teacher education is emphasized. As it is neccessary for students -- our future teachers -- to deal creatively with diversity in schools and work with bi-or multilingual children, gaining the experience of living in another country and working in a foreign school system is highly supported by the University of Cologne. Successful concepts of other countries are seen to be a motivating factor for students in order to implement new and innovative ideas back home. However, teachers in general are still more ""local activists"" than ""global players"" (Jaritz 2011). Therefore, the University of Cologne is about to develop different exchange programs with schools all over the world, e.g. the U.S., South Africa, Uganda, Europe, and Finland.",None
Session:,SPS Research and Outreach Poster Session,Poster,Title:,GPUs: What Language Do You Speak?,Meeting:,"2014 Winter Meeting: Orlando, Florida",Location:,N/A,Date:,,<b> Time: </b>,8:00PM,<b> Author: </b>,"Tiffany Prosser, Francis Marion University",<b> Co-Author(s): </b>,Larry Engelhardt,"We present the results of an undergraduate research project that explores the use of Graphics Processing Units (GPUs) for scientific computing. In recent years GPUs have become popular for scientific computing due to their ability to provide massive parallelism (with thousands of cores) at a reasonable price. Since GPUs are still relatively foreign to most people, we present a comparison of a few basic GPU programming languages. These languages includes CUDA and OpenACC. CUDA C is an extended version of C/C++. OpenACC (accULL and PGI) is a programming standard that allows FORTRAN and C/C++ programmers to easily take advantage of CPU/GPU systems.",Sponsored by Larry Engelhardt. This project is supported by the NSF EPSCoR RII Track 1 cooperative agreement awarded to the University of South Carolina.
Session:,Physics for the Life and Health Sciences,Invited,Title:,The Challenges and Rewards of Teaching Physics for Biology and Medicine,Meeting:,"2014 Winter Meeting: Orlando, Florida",Location:,N/A,Date:,,<b> Time: </b>,3:30PM,<b> Author: </b>,"Jack Tuszynski, University of Alberta",<b> Co-Author(s): </b>,None,"I made a transition from condensed matter physics to biophysics following my sabbatical year in Europe in 1993/4. Since that time I made efforts to build a research program in biophysics and in computational biology. My efforts to teach physics for biology and medicine resulted in a textbook but the experience of teaching this course was less than satisfying. Subsequently, I published graduate-level textbooks in biophysics and taught biophysics to a class of physicists and various blocks and invited classes in various departments including Oncology and biochemistry. I also mentored medical students in the Discovery Learning blocks covering almost all areas of medicine and tried to introduce physical thinking whenever possible. I will describe this experience and my conclusions about where the greatest challenges and potential rewards lie in trying to educate life sciences students in quantitative subjects such as physics and biophysics.",None
Session:,SPS Research and Outreach Poster Session,Poster,Title:,A Novel Low-cost Gamma Ray Spectroscopy for Undergraduate Physics Labs,Meeting:,"2014 Winter Meeting: Orlando, Florida",Location:,N/A,Date:,,<b> Time: </b>,8:00PM,<b> Author: </b>,"Abaz Kryemadhi, Messiah College",<b> Co-Author(s): </b>,"Kyler Chrestay, Joel Love","Gamma Ray Spectroscopy has been traditionally expensive for physics labs due to needs for multichannel analyzers and/or NIM crates. We have been able to design a low-cost gamma ray spectroscopy for physics labs using a silicon photomultiplier as a photodetector, a LYSO crystal for scintillation, and a typical digital oscilloscope with Labview. The method we use does not only provide low-cost gamma ray spectra from different isotopes but also unlike the black box approach in multichannel analyzers, it provides opportunities for undergraduate students to be familiar with detection techniques in particle and nuclear physics.",None
Session:,The Relevance of Laboratory and Apparatus,Contributed,Title:,MOOC Tools to Enhance Professional Development in the Advanced Lab,Meeting:,"2014 Winter Meeting: Orlando, Florida",Location:,N/A,Date:,,<b> Time: </b>,1:10PM,<b> Author: </b>,"Sean P. Robinson, MIT",<b> Co-Author(s): </b>,None,"I will describe recent experiences with the use of online education tools developed for the MOOC community (EdX) to enhance the purely residential educational experience for students in the MIT Physics advanced lab (""Junior Lab""). This is a rigorous academic subject that places heavy emphasis on the student's professional development as a scientist (e.g. oral and written communication, the troubleshooting process, professional scientific attitude, data analysis, reasoning about uncertainty), using experimental physics as the educational medium. Recent curriculum changes attempt to shift the content delivery phase for these broad learning goals into online preparatory exercises and video lectures, freeing up lab time with the faculty for more nuanced dialog and active practice. Preliminary and anecdotal results from the fall 2013 semester will be presented.",None
Session:,Distance Labs,Invited,Title:,Interactive Online Laboratories,Meeting:,"2014 Winter Meeting: Orlando, Florida",Location:,N/A,Date:,,<b> Time: </b>,8:30AM,<b> Author: </b>,"Mats Selen, University of Illinois",<b> Co-Author(s): </b>,None,"We have built an inexpensive battery-powered wireless laboratory system that allows students to do hands-on physics activities outside the classroom, guided by their own computer. The system, called IOLab, combines flexible software with a wireless data acquisition platform containing an array of sensors to sample and display real-time measurements of position, velocity, acceleration, force, rotation rate, orientation, magnetic fields, voltages, light intensity, sound intensity, pressure, and temperature. In this talk I will demonstrate the IOLab system and will show results from two clinical studies done at the University of Illinois to assess the learning outcomes of students performing Interactive Online Laboratories in an independent setting.",None
Session:,Engaging Physics and Astronomy Students in Service Learning,Invited,Title:,Service Learning in Introductory Astronomy & Physics,Meeting:,"2014 Winter Meeting: Orlando, Florida",Location:,N/A,Date:,,<b> Time: </b>,9:00AM,<b> Author: </b>,"Michael P. Orleski, Misericordia University",<b> Co-Author(s): </b>,None,"Faculty in the Physics Department at Misericordia University incorporate Service Learning into some introductory astronomy and physics courses. Astronomy students conduct observation sessions for local school classes and the MU campus community. Physics students work with not-for-profit organizations such as Habitat for Humanity and Rails to Trails performing manual work. A key component of Service Learning is reflection on the service activity after it is completed. Astronomy students analyze how the preparation and operation of the observations aids their learning in the class and how it affects the attendees. Physics students analyze how they use physics, such as motion, forces, and levers, in the tasks they perform. A description of how Service Learning in supported at MU will also be presented.",None
Session:,Physics Education Research Posters,Poster,Title:,Clarifying the Force Concept Inventory via Think-Aloud Interviews,Meeting:,"2014 Winter Meeting: Orlando, Florida",Location:,N/A,Date:,,<b> Time: </b>,8:45AM,<b> Author: </b>,"Matthew R. Semak, University of Northern Colorado",<b> Co-Author(s): </b>,"Wendy K. Adams, Richard D. Dietz","Over the past two years we have conducted three iterations of think-aloud interviews with students as they grappled with questions on the Force Concept Inventory (FCI). Doing so has shown us that the difficulties they have with some questions have nothing to do with their understanding of physics. These difficulties involve diagrams, notations, and vocabulary that make perfect sense to physics teachers but can easily confuse beginning students. Informed by those think-aloud interviews, we have been modifying a subset of questions to improve clarity and then administered each version of the clarified FCI to students in two introductory physics courses. Here we show how and why we modified a few specific questions to construct our latest version of the clarified FCI and compare the consequent results with several years of archival data generated with the canonical Inventory.",None
Session:,Labs/Apparatus Posters,Poster,Title:,MOOCs in the Physics Lab? Reports from the Front,Meeting:,"2014 Winter Meeting: Orlando, Florida",Location:,N/A,Date:,,<b> Time: </b>,8:45AM,<b> Author: </b>,"Sean P. Robinson, MIT",<b> Co-Author(s): </b>,"Gunther Roland, Charles I Bosse, Christopher Sarabalis","We report on progress, challenges, and lessons learned in the first semester (fall 2013) of using the edX software platform --- principally targeted at delivering so-called massive open online courses (MOOCs) --- to deliver parts of a residential physics advanced lab course at MIT which is neither massive, open, nor predominantly online. The MOOC tools were used to enable ""flipped classroom"" methods for teaching data analysis and basic equipment usage: content delivery was shifted to online preparatory exercises and video lectures, freeing up lab time for active learning exercises, group discussion, and student-teacher dialog. MOOC tools were also used to deliver preparatory background material which students were required to complete before starting each new experiment.",None
Session:,Classical Mechanics in the Upper-Level Core: Frontiers and the Classroom,Invited,Title:,Using Research to Investigate and Enhance Learning in Upper-division Mechanics,Meeting:,"2014 Winter Meeting: Orlando, Florida",Location:,N/A,Date:,,<b> Time: </b>,12:00PM,<b> Author: </b>,"Bradley Ambrose, Grand Valley State University",<b> Co-Author(s): </b>,None,"Researchers in physics education have repeatedly shown that traditionally taught introductory courses have minimal effect on the conceptual understanding, problem solving skills, and scientific reasoning ability of most students' including physics majors. Much of that research suggests that lingering difficulties can adversely impact student learning of more advanced material. Research in the context of sophomore/junior level courses in intermediate mechanics has been particularly fruitful in investigating student learning beyond the introductory level. Such research has also been invaluable in guiding the development and assessment of innovative instructional strategies that can complement (and exceed the effectiveness of) traditional lectures. This presentation will highlight results from research conducted at Grand Valley State University, the University of Maine (by co-PI Michael Wittmann) and pilot site institutions in the Intermediate Mechanics Tutorials project. We present evidence of specific student difficulties as well as examples of the use of guided inquiry in addressing these difficulties.",None
Session:,Technologies,Contributed,Title:,"iDevices as Lab, Data, & Analysis Tools",Meeting:,"2014 Summer Meeting: Minneapolis, Minnesota",Location:,N/A,Date:,,<b> Time: </b>,2:20PM,<b> Author: </b>,"Taoufik Nadji, InterlochenArts Academy",<b> Co-Author(s): </b>,None,"The presenter will share a variety of experiments (including the one featured in TPT) that he conducts in his classes using iDevices (iPads, iPods, & iPhones) as data gathering, analyses, and lab tools. The presentation will feature actual footages of the said experiments as conducted with the students and the attendees will participate in at least two such experiments.",None
Session:,Introductory Courses,Contributed,Title:,Phenomenon-based Learning Using Gadgets & Gizmos,Meeting:,"2014 Summer Meeting: Minneapolis, Minnesota",Location:,N/A,Date:,,<b> Time: </b>,8:40AM,<b> Author: </b>,"Matthew Bobrowsky,",<b> Co-Author(s): </b>,None,"Phenomenon-Based Learning (PBL) arose from a collaboration with teachers in Finland, which is now seen as a major international leader in education. PISA assessments showed that Finnish students were among the top in science proficiency levels. Of 74 countries, in 2009 Finland ranked #2 in science. (The U.S. ranked #23.) The PBL teaching philosophy combines elements of what's done in Finland with what's known about effective teaching based on science education research. The approach includes responsive teaching and inquiry-based collaborative learning, along with elements of problem-based learning, project-based learning, and hands-on experiments. The idea is to teach broader concepts and useful thinking and performance skills (as with NGSS) rather than asking students to simply memorize facts. By exploring first and getting to a theoretical understanding later, students are working like real scientists, having the opportunity to pursue creative approaches to understanding, learning more, and having fun in the process!",None
Session:,Additional Strategies to Support Female Students,Contributed,Title:,Examination of Pathways to Excellence Scholarship Program for Women in STEM Fields,Meeting:,"2014 Summer Meeting: Minneapolis, Minnesota",Location:,N/A,Date:,,<b> Time: </b>,9:50AM,<b> Author: </b>,"Joseph Di Rienzi,",<b> Co-Author(s): </b>,None,"Notre Dame of Maryland University (NDMU) is in the third year of an NSF S-STEM grant (1060595), Pathways to Excellence, providing 10 scholarships annually to academically talented women undergraduates with demonstrated financial need who are pursuing degrees in mathematics, physics, computer information systems, or engineering. The program has a tri-part mentoring system with a faculty member in the student's discipline, a peer from the program and an alumnae. Scholars also take an annual thematic seminar course. Each student constructs a career development plan in assistance with her faculty mentor and sets measurable annual goals. In addition, all scholarship students are requested to have an experiential experience. As a result, NDMU aims to strengthen its role in increasing the numbers of well-educated and skilled women employees from diverse backgrounds, including first-generation college students, in technical and scientific areas. Early assessment of the program produced modifications and now these can be evaluated.",None
Session:,Histories Useful for Teaching Physics,Contributed,Title:,The Spheres of Eudoxus,Meeting:,"2014 Summer Meeting: Minneapolis, Minnesota",Location:,N/A,Date:,,<b> Time: </b>,2:00PM,<b> Author: </b>,"Todd K. Timberlake, Berry College",<b> Co-Author(s): </b>,None,"In the 4th Century BCE, the Greek astronomer and mathematician Eudoxus of Cnidus developed a geometrical model to explain the observed motion of the planets. His model consisted of a series of connected, rotating spheres, all centered on the Earth. I will discuss the key features of Eudoxus' model (as reconstructed by Giovanni Schiaparelli in 1875) and present an open-source computer simulation that illustrates the model. I will discuss both the successes and the flaws of this model, and explain how a basic understanding of Eudoxan astronomy can help students appreciate the power and beauty of the later Ptolemaic astronomy. The computer simulation is available from the Open Source Physics collection at www.compadre.org/osp/.",None
