Session:,Physics for the Life and Health Sciences,Invited,Title:,"The X-Laboratory: A Freshman Laboratory Integrating Biology, Chemistry, and Physics",Meeting:,"2014 Winter Meeting: Orlando, Florida",Location:,N/A,Date:,,<b> Time: </b>,4:30PM,<b> Author: </b>,"David Julian, University of Florida",<b> Co-Author(s): </b>,Gabriela Waschewsky,"The Cross-Disciplinary Laboratory (X-Lab), part of the UF-HHMI Science for Life Program, has three main goals: increase STEM retention by helping students develop a synthetic, cross-disciplinary approach to understanding the natural sciences; engage students in inquiry-based experiments that model modern, authentic research; and train students in the key theoretical and practical skills necessary to participate meaningfully in modern biomedical research as undergraduates. The two-semester, six-credit course is targeted to STEM undergraduates as an alternative to traditional laboratory courses in general biology, general chemistry and physics. All laboratory activities and experiments merge key concepts from at least two of the traditional disciplines while emphasizing critical thinking, formulating and testing hypotheses, quantitative and analytical reasoning, and communicating results. The courses meet the traditional laboratory course requirements for all UF undergraduate STEM majors and the Schools of Medicine, Dentistry and Veterinary Medicine. More information, including learning outcomes and skills, is at x-laboratory.org.",Sponsor: Nancy Beverly
Session:,100Kin10: Training and Retaining Teachers,Invited,Title:,The 100Kin10 Partnership Effect: Many Hands Make Light Work,Meeting:,"2014 Winter Meeting: Orlando, Florida",Location:,N/A,Date:,,<b> Time: </b>,4:30PM,<b> Author: </b>,M Colleen Megowan- Romanowicz,<b> Co-Author(s): </b>,None,"In his 2011 State of the Union address, President Obama outlined the need for 100,000 new STEM teachers within the next 10 years. Shortly thereafter Carnegie Corporation of New York and Opportunity Equation convened representatives from teacher education and professional development programs and foundations across the country and in June of 2011 the 100Kin10 partnership was launched at the Clinton Global Initiative Meeting. Of the 150 partner organizations 22 are funding partners. The rest are best-in-class organizations who prepare, develop, and retain excellent STEM teachers who are incentivized by funding from donor partners to work together and multiply the effectiveness of partners' programs. This presentation will highlight the work of a number of AAPT-affiliated associations and institutions that are 100Kin10 partners, discuss collaborations among these partners and outline how other organizations can join or connect with the movement.",None
Session:,Classical Mechanics in the Upper-Level Core: Frontiers and the Classroom,Invited,Title:,Classical Mechanics Activities Across the Paradigms in Physics,Meeting:,"2014 Winter Meeting: Orlando, Florida",Location:,N/A,Date:,,<b> Time: </b>,12:30PM,<b> Author: </b>,"Elizabeth Gire, University of Memphis",<b> Co-Author(s): </b>,Corinne A Manogue,"The Paradigms in Physics courses at Oregon State University are well known for blurring the traditional subdisciplines of physics. Topics in classical mechanics in particular are distributed throughout the curriculum and are often paired with topics from other subdisciplines. These pairings are chosen to reinforce conceptual and mathematical similarities among topics and to highlight important differences. The Paradigms in Physics courses also, and perhaps more importantly, feature a variety of active engagement instructional strategies. I will discuss a few of the classical mechanics activities with emphasis on their instructional goals and affordances, as well as the affordances of sequencing with topics in other subdisciplines. I will also comment on how these activities might be used in more traditionally structured classical mechanics courses.",None
Session:,Labs/Apparatus Posters,Poster,Title:,Redesign of Introductory Mechanics Labs to Increase Retention and Graduation of STEM Students,Meeting:,"2014 Winter Meeting: Orlando, Florida",Location:,N/A,Date:,,<b> Time: </b>,8:00AM,<b> Author: </b>,"Nina Abramzon, Cal Poly Pomona",<b> Co-Author(s): </b>,"Barbara M Hoeling, Phu Tran, Peter B Siegel, Claudia L Pinter-Lucke",Programs aimed at increasing retention and graduation rates of STEM students have been implemented at Cal Poly Pomona and at Norco College. As part of these programs there were interventions done to the freshman physics labs. The new labs were designed to follow the inquiry-based approach. The design elements will be presented in detail together with assessment of student learning and student attitudes.,None
Session:,The Relevance of Laboratory and Apparatus,Invited,Title:,Four-Semester Laboratory Course: A Ramp Toward Doing Science,Meeting:,"2014 Winter Meeting: Orlando, Florida",Location:,N/A,Date:,,<b> Time: </b>,12:30PM,<b> Author: </b>,"Anna Karelina,",<b> Co-Author(s): </b>,None,"Through discussions and group meetings with faculty members of the Occidental College, we formulated the learning goals of introductory laboratories for physics and engineering majors. Using methods and approaches of the Investigative Science Learning Environment (ISLE) [1] we were able to create a consistent four-semester course sequence to achieve these goals. The course prepares students for independent research in advanced lab courses, for summer research, and their future scientific work. At the end the course our students demonstrate that they have built up higher-level thinking skills and scientific abilities, such as the ability to design an experiment, to test a hypothesis, to analyze, to evaluate the results and many others.","[1] Etkina, E. & Van Heuvelen, A. (2001). Investigative Science Learning Environment: Using the processes of science and cognitive strategies to learn physics. Proceedings of the 2001 Physics Education Research Conference, Rochester, NY, 17-21"
Session:,SPS Research and Outreach,Contributed,Title:,Undergraduates Creating a High Performance Computer Cluster,Meeting:,"2014 Winter Meeting: Orlando, Florida",Location:,N/A,Date:,,<b> Time: </b>,2:40PM,<b> Author: </b>,"Scott C. Garland, Francis Marion University",<b> Co-Author(s): </b>,"William Dixon, Larry P Engelhardt, Ginger Bryngelson, Galen Collier","We present the student-led creation and management of Francis Marion University's new Patriot Cluster. Supercomputers have become essential tools for many computational scientists. Undergraduate access to such machines can, therefore, boost the competency of computational physics students who have opportunities to interact with them. For this reason, the Patriot Cluster's creation and resources are being used as tools for undergraduate education and research. This project is supported by the NSF EPSCoR RII Track 1 cooperative agreement awarded to the University of South Carolina.",Sponsored by Larry Engelhardt
Session:,Sustainability of Teacher Preparation Programs,Invited,Title:,Sustainability Study of PhysTEC Sites,Meeting:,"2014 Winter Meeting: Orlando, Florida",Location:,N/A,Date:,,<b> Time: </b>,12:00PM,<b> Author: </b>,"Monica Plisch,",<b> Co-Author(s): </b>,Rachel Scherr,"The Physics Teacher Education Coalition (PhysTEC) project conducted a study on the sustainability of teacher preparation programs at sites that had previously received PhysTEC funding. A consultant (Rachel Scherr) conducted site visits and/or telephone interviews with eight institutions, and gathered qualitative and quantitative data. Quantitative data included longitudinal data on program funding, staffing, and physics education graduates. In addition, sites completed a survey to document sustainability of individual key components, i.e. whether each component was maintained, evolved, grown, reduced, or eliminated. Case studies of individual institutions looked at the institutional motivation for sustaining programs, the role of the champion, and the mechanisms for sustaining program activities. Results will be synthesized where possible to identify common themes among sites.",None
Session:,PER: Investigating Classroom Strategies,Contributed,Title:,Video Resource for Professional Development of University Physics Educators,Meeting:,"2014 Winter Meeting: Orlando, Florida",Location:,N/A,Date:,,<b> Time: </b>,2:30PM,<b> Author: </b>,"Rachel E. Scherr, Seattle Pacific University",<b> Co-Author(s): </b>,Renee Michelle Goertzen,"The Video Resource for Professional Development of University Physics Educators is being developed to support a wide range of university physics educators (four-year university faculty, two-year-college faculty, graduate teaching assistants, and undergraduate learning assistants) in engaging with key issues in teaching and learning. Based on compelling classroom video of best-practices university physics instruction, the resource is organized into ""video workshops"" that each introduce a significant topic in the teaching and learning of physics, such as formative assessment or cooperative learning. The topic is introduced through a captioned video episode of introductory physics students in the classroom, chosen to prompt collaborative discussion. Discussion questions prompt participants who view the episode to reflect on their pedagogical beliefs and on their own practice. The Video Resource will provide materials to be incorporated into a variety of professional development situations, including self-organized groups of professors, graduate TA training, LA pedagogy courses, and online professional development communities.",None
Session:,Physics Education Research Posters 2,Poster,Title:,Video Resource for Professional Development of University Physics Educators,Meeting:,"2014 Winter Meeting: Orlando, Florida",Location:,N/A,Date:,,<b> Time: </b>,9:15PM,<b> Author: </b>,"Rachel E. Scherr, Seattle Pacific University",<b> Co-Author(s): </b>,Renee Michelle Goertzen,"The Video Resource for Professional Development of University Physics Educators is being developed to support a wide range of university physics educators (four-year university faculty, two-year-college faculty, graduate teaching assistants, and undergraduate learning assistants) in engaging with key issues in teaching and learning. Based on compelling classroom video of best-practices university physics instruction, the resource is organized into ""video workshops"" that each introduce a significant topic in the teaching and learning of physics, such as formative assessment or cooperative learning. The topic is introduced through a captioned video episode of introductory physics students in the classroom, chosen to prompt collaborative discussion. Discussion questions prompt participants who view the episode to reflect on their pedagogical beliefs and on their own practice. The Video Resource will provide materials to be incorporated into a variety of professional development situations, including self-organized groups of professors, graduate TA training, LA pedagogy courses, and online professional development communities.",None
Session:,Recruiting and Retaining Physics Students II,Invited,Title:,Increasing Physics Enrollments by Targeting Underrepresented Minorities,Meeting:,"2014 Winter Meeting: Orlando, Florida",Location:,N/A,Date:,,<b> Time: </b>,11:00AM,<b> Author: </b>,"Jesus Pando, DePaul University",<b> Co-Author(s): </b>,None,"Underrepresented minorities (URM) such as African-Americans, Hispanics, and Native Americans collectively accounted for less then 10% of physics bachelor's degrees in 2010 (NSF data). These groups comprised 32% of the population in 2010 and predictions indicate that this percentage will increase. There appears to be an untapped pool of students among these groups from which to recruit into physics programs. Yet despite repeated efforts over the last 20 years, the percentage of URM students in physics is little changed. This talk will outline some of the reasons why previous efforts have failed by identifying in broad terms, some of the characteristics of URM students that these programs have not addressed. Examples of programs that have addressed some of the unique issues the URM students bring to the table and hence, successfully attracted URM students, will be discussed.",None
Session:,Optics Labs Beyond the First Year,Contributed,Title:,"Spy Physics: Using a Laser to ""Hear"" a Conversation",Meeting:,"2014 Winter Meeting: Orlando, Florida",Location:,N/A,Date:,,<b> Time: </b>,5:20PM,<b> Author: </b>,"Timothy Todd Grove, IPFW",<b> Co-Author(s): </b>,Trunghieu T Nguyen,"We will present a simply constructed laser experiment for students beyond their first year in physics. The goal of this particular experiment is to not only give students experience with laser interferometry, but to allow students to have greater excitement than they would normally get counting fringes or making precision measurements. Our experiment started when a student asked ""Is it true that you could use a laser beam to detect a conversation in an office by its reflection off of a window."" To accomplish this task we used a simple Michelson interferometer in which one mirror vibrated in response to a sound source. A speaker connected to a radio inside a small box with a tinted glass window served as a mirror for the laser beam and also represented the office that we were ""spying upon."" At present time, we have tried the experiment in two different ways--one in which the sound source is directly connected to the mirror (the easy version) and one in which the sound must propagate through air to vibrate the mirror (the harder version). We will demonstrate our results if the audio equipment is willing.",None
Session:,Labs/Apparatus Posters,Poster,Title:,"Spy Physics: Using a Laser to ""Hear"" a Conversation",Meeting:,"2014 Winter Meeting: Orlando, Florida",Location:,N/A,Date:,,<b> Time: </b>,8:45AM,<b> Author: </b>,"Timothy Todd Grove, IPFW",<b> Co-Author(s): </b>,Trunghieu T Nguyen,"We will present a simply constructed laser experiment for students beyond their first year in physics. The goal of this particular experiment is to not only give students experience with laser interferometry, but to allow students to have greater excitement than they would normally get counting fringes or making precision measurements. Our experiment started when a student asked ""Is it true that you could use a laser beam to detect a conversation in an office by its reflection off of a window."" To accomplish this task we used a simple Michelson interferometer in which one mirror vibrated in response to a sound source. A speaker connected to a radio inside a small box with a tinted glass window served as a mirror for the laser beam and also represented the office that we were ""spying upon."" At present time, we have tried the experiment in two different ways-- one in which the sound source is directly connected to the mirror (the easy version) and one in which the sound must propagate through air to vibrate the mirror (the harder version). We will demonstrate our results if the audio equipment is willing.",None
Session:,Technologies Posters,Poster,Title:,Gauging Effectiveness of Pen-based Computing for Collaborative Introductory Physics Problem Solving,Meeting:,"2014 Winter Meeting: Orlando, Florida",Location:,N/A,Date:,,<b> Time: </b>,8:00AM,<b> Author: </b>,"Duncan Cantrell, Columbus State University",<b> Co-Author(s): </b>,"Kimberly A Shaw, Zdeslav Hrepic","Advancements in pen-input computing technology combined with synchronously interactive software opened new venues for promoting active instruction and collaborative problem solving [1]. The research goal of the present study was to isolate the effect of the methodology itself from that of the involved educational technology. We repeated the comparison of the performance of students taking the same introductory physics lecture course while enrolled in two separate problem-solving sections [2]. One section used tablet PCs to facilitate group problem solving while the other section used whiteboards or paper for one third of the semester (covering Kinematics). Sections then traded technologies for the middle third of the term (covering Dynamics). For the last segment of the semester, students were free to choose between tablet PCs or low tech. Preliminary analysis of quiz, exam and standardized pre-post test results indicate primacy of methodology over technology for student learning.","1. Sisson, C.J., Tablet-based recitations in Physics: Less lecture, more success, in The impact of Tablet PCs and pen-based technology on education: new horizons, D.A. Berque, L.M. Konkle, and R.H. Reed, Editors. 2009, Purdue University Press: West Lafayette, IN. p. 133-139. 2. Hrepic, Z., K. Lodder, and K.A. Shaw, Pedagogy and/or Technology: Making Difference in Improving Students? Problem Solving Skills. AIP Conf. Proceedings (2012 Physics Education Research Conference), 2013. 1513: p. 182-185."
Session:,Bridging Teacher Preparation and Professional Development,Invited,Title:,Preparing Pre-service and In-service Physics Teachers to Teach Through Inquiry *,Meeting:,"2014 Winter Meeting: Orlando, Florida",Location:,N/A,Date:,,<b> Time: </b>,8:30AM,<b> Author: </b>,Donna L. Messina,<b> Co-Author(s): </b>,None,"The Physics Education Group (PEG) at the University of Washington has a long history of conducting courses for both pre-service and in-service teachers. Two major goals are: (1) to help teachers develop a deep and robust understanding of the pivotal topics in physics that they are expected to teach and (2) to provide them with the experience of learning in the way they are expected to teach (through a process of inquiry). These goals, together with ongoing research on the learning and teaching of physics, have guided the development of physics by Inquiry1. This talk illustrates the ways in which these materials help teachers learn (or relearn) physics content and model an approach to teaching through inquiry. Other course components that contribute to the professional development of both pre- and in-service teachers will also be discussed, including how these courses can help build professional learning communities between both groups.","*This work has been supported in part by the National Science Foundation. 1L.C. McDermott and the Physics Education Group at the University of Washington, Physics by Inquiry (Wiley, 1996)."
Session:,Recruiting and Retaining Physics Students,Invited,Title:,The Next Steps in Developing Inclusive Physics Departments,Meeting:,"2014 Winter Meeting: Orlando, Florida",Location:,N/A,Date:,,<b> Time: </b>,4:30PM,<b> Author: </b>,"Juan Burciaga, Mount Holyoke College",<b> Co-Author(s): </b>,None,"Many departments operate under the assumptions that the key to developing inclusive departments is to focus on strategic recruiting. That somehow getting students from under-represented groups to enter the department was by itself a sufficient development to catalyze wide-spread change. But recruiting is just one step, and may not even be the first step, in developing a department that is diverse ... inclusive ... and excellent. But what are the steps that will allow a department to keep momentum moving toward a diverse, inclusive and engaged community of students and faculty? And how does such a community help promote and develop an atmosphere of excellence in the students? ...in the faculty? ... and in the department?",None
Session:,SPS Research and Outreach,Contributed,Title:,Modeling Mass-Radius Relationships of Planets Using Differential Equations,Meeting:,"2014 Winter Meeting: Orlando, Florida",Location:,N/A,Date:,,<b> Time: </b>,3:10PM,<b> Author: </b>,"Kevin D. Thielen, Eckerd College",<b> Co-Author(s): </b>,"Alexander K Zielinski, Stephen P Weppner","Models of mass-radius relationships for planets have been recently developed by making assumptions about the relationship between pressure and density in order to avoid having to work with more complex equations of state. In our model we construct a Non-linear Homogeneous Ordinary Differential Equation, whose parameters can be readily obtained experimentally, and solve it numerically by making an observation about the relationship of density and compressibility as a function of pressure. We then compare our numerical results to models such as the Preliminary Earth Reference Model (PREM) and models of pressure density relationships of materials from low pressures up to pressures within the region of the Thomas Fermi Dirac theoretical EOS where electron degeneracy pressure becomes a factor.",Sponsored by Anne Cox
Session:,PER: Investigating Classroom Strategies,Contributed,Title:,A Taxonomy for Identifying Visual Elements of Textbooks,Meeting:,"2014 Winter Meeting: Orlando, Florida",Location:,N/A,Date:,,<b> Time: </b>,2:40PM,<b> Author: </b>,"Juan R. Burciaga, Mount Holyoke College",<b> Co-Author(s): </b>,Alexandra Lau,Visual elements are integral components of todays textbooks. The applications for these elements vary from simply breaking up the textual narrative ... to establishing a supplemental or an alternative narrative ... to summarizing or communicating key concepts. To better understand the impact of visual elements in the pedagogical framework of textbooks we have created a taxonomy to identify their roles. The taxonomy is being used to analyze the number and placement of visual elements in both a traditional text and a non-traditional one. The resulting analysis is being used as a basis for designing additional visual elements.,None
Session:,Interactive Lecture Demonstrations - What's New? ILDs Using Clickers and Video Analysis,Contributed,Title:,Clicker Questions for Interactive Lecture Demonstrations,Meeting:,"2014 Winter Meeting: Orlando, Florida",Location:,N/A,Date:,,<b> Time: </b>,1:00PM,<b> Author: </b>,"Tetyana Antimirova, Ryerson University",<b> Co-Author(s): </b>,None,"Lecture demonstrations are often counterintuitive and potentially confusing to students. Just showing the demonstrations in class can often lead the students to incorrect conclusions. Requiring the students to make predictions about the demonstration outcomes improves the effectiveness of the demonstrations [1]. Clickers allow very fast collection of the predictions in large-enrollment classes. However, the success of this approach relies on the availability of meaningful multiple choice questions to probe the students' understanding. We will discuss the multiple-choice questions writing activities in a large introductory physics class as well as an upper-year independent study project in which the students themselves learn how to create multiple choice questions for the interactive lecture demonstrations. [1.] D.R. Sokoloff, R.K.Thornton (2006). Interactive Lecture Demonstrations, Active Learning in Introductory Physics, Wiley.",None
Session:,Mentoring High School Teachers,Invited,Title:,Mentoring Teachers Through Conversations,Meeting:,"2014 Winter Meeting: Orlando, Florida",Location:,N/A,Date:,,<b> Time: </b>,4:00PM,<b> Author: </b>,"Ximena Cid, University of Washington",<b> Co-Author(s): </b>,None,"The Physics Education Group (PEG) at the University of Washington (UW) offers courses that directly impact teachers. One sequence of courses is focused on the preparation of pre-service K12 teachers held during the academic-year and the other sequence of courses provides professional development for in-service K12 teachers during the Summer Institute. In-service teachers who have participated in the Summer Institute, and who live within commuting distance of UW, also attend the academic-year Continuation Course. During the Continuation Course, teachers have the opportunity to collaborate with other teachers or with instructors from PEG as they continue to adapt their teaching practices. In addition, pre-service teachers are invited once a year to attend the Continuation Course in order to interact with current K12 teachers. This talk will focus on the discussions that take place during the Continuation Course and how mentoring develops organically through teacher-teacher interactions as well as through teacher-instructor interactions.",None
Session:,Optics Labs Beyond the First Year,Invited,Title:,Open-ended Laboratory Projects in an Undergraduate Lasers Course,Meeting:,"2014 Winter Meeting: Orlando, Florida",Location:,N/A,Date:,,<b> Time: </b>,4:30PM,<b> Author: </b>,"Chad Hoyt, Bethel University",<b> Co-Author(s): </b>,None,"We describe the format and experience of an undergraduate Lasers course at Bethel University. The course, which includes a standard, rigorous lecture portion, is built on open-ended research projects that have a novel aspect. It begins with four weeks of small student groups rotating between several standard laser laboratory exercises such as alignment and characterization of a helium neon laser. During the remainder of the course, student groups (2-4 people) choose and pursue research questions in the lab. Their work culminates in a group manuscript typeset in LaTeX and a 20-minute presentation to the class. Projects in the spring 2013 Lasers course included ultrafast optics with a mode-locked erbium fiber laser, quantum optics, saturated spectroscopy of indium, nano-optics and plasmonics (led by Nathan Lindquist), and improvements to a lithium magneto-optical trap. The experience in Lasers is representative of other upper-level courses at Bethel, including Optics, Fluid Mechanics and Computer Methods.",None
