Session:,Physics and Society,Poster,Title:,Photovoltaics at Davidson College -- a Community-based Learning Project,Meeting:,"2013 Winter Meeting: New Orleans, Louisiana",Location:,N/A,Date:,,<b> Time: </b>,9:00AM,<b> Author: </b>,"Tim Gfroerer, Davidson College",<b> Co-Author(s): </b>,None,"In the fall of 2012, our junior-level electronics class conducted an investigation of photovoltaics at Davidson College. We started by touring the new 100 KW installation on the campus sports complex. Then we employed a solar cart (built by the physical plant using a spare 300 W panel) to study the circuitry required to store and utilize solar energy. The cart facilitated an in-depth examination of the practical, electrical, environmental, and thermal issues inherent in photovoltaic energy conversion. We concluded the study with a public exhibit at the local (Town of Davidson) farmer's market.",This project was supported by a curriculum development grant from the Center for Civic Engagement at Davidson College.
Session:,Implementation and Assessment of Physics by Inquiry,Invited,Title:,PbI as a First-Year Experience for Underprepared Physics Majors,Meeting:,"2013 Winter Meeting: New Orleans, Louisiana",Location:,N/A,Date:,,<b> Time: </b>,8:30AM,<b> Author: </b>,"James C Moore, Coastal Carolina University",<b> Co-Author(s): </b>,Louis J Rubbo,"A large percentage of freshman physics majors at Coastal Carolina University (CCU) enter underprepared in mathematics and scientific abilities. These students are otherwise talented, though lacking in preparation, and it is exactly these types of students that we should strive to retain within the STEM pipeline. In this talk, we will discuss the implementation and assessment of Physics by Inquiry (PbI) as a freshman first-year experience for our majors. We present an adaptation of the PbI curriculum that includes an explicit approach to scientific abilities and reasoning. Specifically, we discuss the implementation of pre-class micro-lectures, lab notebooks, and authentic research experiences at the end of major learning units. The combination of PbI with simulated cognitive apprenticeship experiences results in significant gains on the Lawson's Classroom Test of Scientific Reasoning, greater retention, and increased success in the subsequent calculus-based introductory course.",None
Session:,Introductory Courses,Contributed,Title:,Measuring Information Presentation in a Physics Class,Meeting:,"2013 Winter Meeting: New Orleans, Louisiana",Location:,N/A,Date:,,<b> Time: </b>,8:10PM,<b> Author: </b>,"John Stewart, University of Arkansas",<b> Co-Author(s): </b>,None,"At some level, the performance of students in a science class must depend on what is taught, the information content of the materials and assignments of the course. The introductory calculus-based electricity and magnetism class at the University of Arkansas is examined using a catalog of the basic reasoning steps involved in the solution of problems assigned in the class. These fundamental steps are used to quantify the distribution of informational content within the different elements of the course: laboratory, lecture, reading, and homework. This distribution of content is compared with the instructional outcomes measured by the Conceptual Survey of Electricity and Magnetism and by course exams to determine the relative efficacies of the various mechanism of presenting the information. Using this characterization technique, an exceptionally detailed picture of the information flow and the information structure of the class can be produced. Variation of the types and the amount of information presented is analyzed over multiple semesters.",None
Session:,Physics Education Research,Poster,Title:,Measuring Information Presentation in a Physics Class,Meeting:,"2013 Winter Meeting: New Orleans, Louisiana",Location:,N/A,Date:,,<b> Time: </b>,8:30PM,<b> Author: </b>,"John Stewart, University of Arkansas",<b> Co-Author(s): </b>,None,"At some level, the performance of students in a science class must depend on what is taught, the information content of the materials, and assignments of the course. The introductory calculus-based electricity and magnetism class at the University of Arkansas is examined using a catalog of the basic reasoning steps involved in the solution of problems assigned in the class. These fundamental steps are used to quantify the distribution of informational content within the different elements of the course: laboratory, lecture, reading, and homework. This distribution of content is compared with the instructional outcomes measured by the Conceptual Survey of Electricity and Magnetism and by course exams to determine the relative efficacies of the various mechanism of presenting the information. Using this characterization technique, an exceptionally detailed picture of the information flow and the information structure of the class can be produced. Variation of the types and the amount of information presented is analyzed over multiple semesters.",None
Session:,Online Physics Courses,Contributed,Title:,Peer Instruction for the Online Classroom,Meeting:,"2013 Winter Meeting: New Orleans, Louisiana",Location:,N/A,Date:,,<b> Time: </b>,4:40PM,<b> Author: </b>,"Cynthia J. Sisson, LSU-Shreveport",<b> Co-Author(s): </b>,Samantha Morgan,"One of the challenges of teaching online is in bringing effective aspects of face-to-face teaching to the online experience. In this talk we discuss the process of implementing a Peer Instruction cycle in an online conceptual physics course, and how (and why) that process has evolved over three semesters of teaching online.",None
Session:,Insights and Benefits from Framing a Class as a Discourse Community,Invited,Title:,Attending to the Development of a Physics Learning Community,Meeting:,"2013 Winter Meeting: New Orleans, Louisiana",Location:,N/A,Date:,,<b> Time: </b>,3:30PM,<b> Author: </b>,"Renee Michelle Goertzen, Florida International University",<b> Co-Author(s): </b>,"Eric Brewe, Laird Kramer","Past research has demonstrated that students' sense of community is connected with their persistence, the rate at which they stay in college. We similarly expect that students' sense of community impacts whether they remain in their physics classes. We discuss the need to attend to students' sense of community and to the development of a physics learning community and we highlight the importance of both at Florida International University, a Hispanic serving institution. A goal of the reforms implemented by the Physics Education Research Group at FIU has been the establishment of multiple opportunities for entry into the physics learning community. These opportunities include classes using research-based curricula (Modeling Instruction and Investigative Science Learning Environment), a Learning Assistant program, and a growing cohort of physics majors.",None
Session:,Overview of High School Physics in the U.S.,Invited,Title:,Modeling Instruction Workshops: A Robust Framework for Science Teacher Professional Development,Meeting:,"2013 Winter Meeting: New Orleans, Louisiana",Location:,N/A,Date:,,<b> Time: </b>,8:30AM,<b> Author: </b>,Kathleen A. Harper,<b> Co-Author(s): </b>,Jane Jackson,"A collaboration between a high school physics teacher and a university physicist led to the creation of Modeling Instruction in the early 1990s. A grant from NSF-funded multiple national workshops in the mid to late '90s, and from there, Modeling has spread through grass-roots efforts, directly impacting approximately 5500 teachers through workshops all around the country. This includes nearly 10% of the nation's physics teachers. These workshops have been shown to have strong positive impacts on teacher content knowledge, classroom pedagogy, and student learning. In addition, they have created strong and supportive professional networks, both at the local level and nationally. This talk will give a brief synopsis of the program's history, an overview of the Modeling framework, a description of a typical workshop, and data on the current state of Modeling Instruction in the U. S. and planned future directions.",None
Session:,Best Practices in Educational Technology,Invited,Title:,"Easy Java Simulations Meets Moodle, Arduino, and (Walks Towards) the iPad",Meeting:,"2013 Winter Meeting: New Orleans, Louisiana",Location:,N/A,Date:,,<b> Time: </b>,8:20PM,<b> Author: </b>,"Francisco Esquembre, Universidad de Murcia",<b> Co-Author(s): </b>,"Luis de la Torre, Ruben Heradio, Andres Mejias, Marco A. Marquez","Easy Java Simulations (EJS) is a modeling and authoring tool that helps teachers and students create interactive simulations of physics processes. We show in this talk some new additions to EJS that help integrate EJS applets with online courses and laboratory activities. In particular, we show how to embed EJS generated applets into Moodle courses, including communication of the applet with the Moodle file repository and collaborative learning. We also show how EJS simulations can send and receive data to/from a number of laboratory equipment such as Arduino and Phidgets (and others to come). Finally, we show work in progress that reuses EJS architecture for tablets. This work will eventually help us quickly port existing EJS simulations at ComPADRE into tablets supporting Javascript and HTML5, such as the iPad and Android tablets.",Sponsored by Anne J Cox
Session:,Lecture/Classroom,Poster,Title:,Color-Coded Algebra,Meeting:,"2013 Winter Meeting: New Orleans, Louisiana",Location:,N/A,Date:,,<b> Time: </b>,7:45PM,<b> Author: </b>,"Bradley McCoy, Azusa Pacific University",<b> Co-Author(s): </b>,None,"One challenge during problem solving is distinguishing between known and unknown variables in algebraic equations. A color coding system helps reduce cognitive load, clarifies algebra strategy, and serves as a useful tool for identifying needed equations.",None
Session:,Preparing Teachers for Technology Needed in Teaching Physics,Invited,Title:,Technology Integration as a Means to Enhance Teaching and Learning,Meeting:,"2013 Winter Meeting: New Orleans, Louisiana",Location:,N/A,Date:,,<b> Time: </b>,2:00PM,<b> Author: </b>,"Howard M Glasser, Knowles Science Teaching Foundation",<b> Co-Author(s): </b>,None,"Technology changes rapidly and it can be challenging for physics teachers and teacher preparation programs to keep pace. It is especially difficult to find ways to meaningfully incorporate digital resources into instruction in ways that enhance teaching and learning. This talk will focus on how teachers and teacher preparation programs can address this issue. I will share ways they can integrate digital resources into their classes in ways that will further develop students' skills in broad areas that transcend specific science content. These skills can include things like collaborating, communicating, and demonstrating understanding. Teachers will be able to better enhance and assess students' content knowledge using various digital resources if they can learn how technology can be used to develop these broader skills.",None
Session:,Tracker: Video Analysis,Invited,Title:,Interesting Projects Using Tracker Video Analysis,Meeting:,"2013 Winter Meeting: New Orleans, Louisiana",Location:,N/A,Date:,,<b> Time: </b>,9:00AM,<b> Author: </b>,"Rhett J. Allain, Southeastern Louisiana Univ",<b> Co-Author(s): </b>,None,"Video analysis makes any project more exciting and interesting. In this talk, I will go over my favorite examples of video analysis including (but not limited to): video analysis of Angry Birds, using video analysis to spot faked videos, determining the height of a space balloon, and examining the download progress bar on your computer.",None
Session:,Apparatus Gumbo,Contributed,Title:,Charles Grafton Page and His Shocking Coil,Meeting:,"2013 Winter Meeting: New Orleans, Louisiana",Location:,N/A,Date:,,<b> Time: </b>,7:20PM,<b> Author: </b>,"Thomas B. Greenslade, Jr., Kenyon College",<b> Co-Author(s): </b>,None,"Charles Grafton Page (1812-1865) was the first American who worked as a full-time electrical experimenter and inventor. Among the instruments that he developed in the late 1830s was the ancestor of the induction coil. This consisted of what we would now call a step-up transformer, with an interrupter in series with the primary coil to produce the necessary pulsating voltage signal. The example in my collection dates from the 1860s and was listed as a ""vibrating shocker"" in the 1860 catalogue of E.S. Ritchie of Boston. The 1842 edition of Daniel Davis's ""Manual of Magnetism"" includes it in the section on medical electricity. Devices like this are the precursors of the induction coil whose use led to the discovery of the electron and x rays.",None
Session:,Insights and Benefits from Framing a Class as a Discourse Community,Contributed,Title:,Researching and Presenting a Scientific Article in Sophomore and Junior Level Classes,Meeting:,"2013 Winter Meeting: New Orleans, Louisiana",Location:,N/A,Date:,,<b> Time: </b>,4:50PM,<b> Author: </b>,"Nina Abramzon, California Polytechnic University Pomona",<b> Co-Author(s): </b>,Barbara M Hoeling,"Because of the expense and amount of faculty time required, many undergraduate physics students will not have the opportunity to work under a mentor on original research. However, many of the key elements of undergraduate research can be incorporated into courses that are part of the standard undergraduate curriculum, making the benefits of research experience available to a broader audience of students. For example, in our modern physics and optics courses, we gave students the assignment to research and understand a scientific article from the American Journal of Physics, and finally critically discuss in a group presentation to their peers. We will describe this group research presentation experience and present results of student learning and attitude surveys from these courses.",None
Session:,Implementations of Physics for Future Presidents,Contributed,Title:,Basic Science Behind the Headlines,Meeting:,"2013 Winter Meeting: New Orleans, Louisiana",Location:,N/A,Date:,,<b> Time: </b>,9:10AM,<b> Author: </b>,"Sean J. Bentley, Adelphi University",<b> Co-Author(s): </b>,None,"I will discuss my course ""Basic Science Behind the Headlines."" Designed not only to generate future presidents, but also more generally (and perhaps more importantly) to generate an electorate with a knowledge of science, the course alternates between learning about science from discussions based on readings in Muller's text to then discussing related issues that are found by the students in news articles. Each student is responsible for finding and posting a link on the class website to at least one article for every topic, with these articles being the basis for in-depth discussion. The class emphasizes the wide-reaching impacts of science and technology on our modern world, and how the issues of science, economics, culture, and politics are difficult to separate when exploring complex questions. The goal is to generate students who will become informed and critical thinkers in their actions related to technological issues throughout their lives.",None
Session:,Astronomy,Poster,Title:,Introducing the Newtonian Gravity Concept Inventory,Meeting:,"2013 Winter Meeting: New Orleans, Louisiana",Location:,N/A,Date:,,<b> Time: </b>,8:30PM,<b> Author: </b>,"Shannon Willoughby, Montana State University",<b> Co-Author(s): </b>,"Kathryn Williamson, Ed Prather","Multiple-choice Concept Inventories have become important tools in Astronomy Education Research for assessing student learning and the effects of instructional interventions. We introduce for the Newtonian Gravity Concept Inventory (NGCI), a 26-item research validated instrument to quickly and effectively assess introductory college astronomy students' understanding of gravity. The conceptual focus of the NGCI covers four conceptual domains: (1) Independence of gravity from other factors, (2) Application of the force law (including mass and distance proportionality relationships, (3) Behavior at certain thresholds (such as low mass and high distance limits, as well as atmospheric boundaries), and (4) Directionality, including superposition. After three iterations of testing and refining, the NGCI has proven to be both a reliable and valid instrument. As evidence, we present a full statistical analysis of overall instrument reliability, item difficulty and discriminatory power, supplemented with qualitative information from think-aloud student interviews and expert review.",None
Session:,Teacher Training/Enhancement,Poster,Title:,Overview: New Faculty Experience for Two-Year College Physics Instructors,Meeting:,"2013 Winter Meeting: New Orleans, Louisiana",Location:,N/A,Date:,,<b> Time: </b>,11:00AM,<b> Author: </b>,"Todd R. Leif, Cloud County Community College",<b> Co-Author(s): </b>,Scott F. Schultz,"The American Association of Physics Teachers has developed an 18-month experience to transform undergraduate physics programs at two-year colleges by developing newly hired physics instructors. The program seeks to equip these new faculty members with the tools, skills, and theory of active engagement techniques that have been developed based on Physics Education Research and successfully implemented at Two-Year Colleges. The lead presenters of the experience are all master two-year college faculty that also serve as mentors for the participants as the new faculty work to implement novel techniques and strategies in the classroom. The culmination of the experience is the commencement conference held in tandem with this national meeting. This poster will discuss the professional development delivered to the participants, the diversity of the group, and the lessons we as leaders have learned from the experience.",*Funding supported by NSF grant # 0940857
Session:,Apparatus Gumbo,Contributed,Title:,Writing a Graphite Variable Resistor,Meeting:,"2013 Winter Meeting: New Orleans, Louisiana",Location:,N/A,Date:,,<b> Time: </b>,8:10PM,<b> Author: </b>,"David Venne,",<b> Co-Author(s): </b>,None,"Graphene, a single layer of carbon atoms, is an exotic new material that has been shown to be stronger than diamond and conduct electricity better than copper. Andre Geim and Konstantin Novoselov won the 2010 Nobel Prize in Physics for being the first to obtain single layer graphene. Students in a middle or high school classroom can repeat this groundbreaking experiment without a million- dollar lab facility. The ""scotch tape"" experiment can be expanded upon by constructing a variable resistor on a CD disc by connecting two Cu electrodes with a battery and a light emitting diode (LED). The CD circuit is used to demonstrate the concept of variable resistance by scribing a pencil between two Cu leads. The LED is turned on once the transferred graphite pieces complete the circuit. The light emission dims as the graphite layers are erased.",None
Session:,Reforming the Introductory Physics Course for Life Science Majors VIII,Poster,Title:,Physics in Biomedicine: An Elective Course for Pre-Health Majors,Meeting:,"2013 Winter Meeting: New Orleans, Louisiana",Location:,N/A,Date:,,<b> Time: </b>,9:00AM,<b> Author: </b>,Grace R. Van Ness,<b> Co-Author(s): </b>,Ralf Widenhorn,"We describe the curriculum development of the Physics in Biomedicine course at Portland State University. This course addresses a gap in the number of intermediate-level algebra-based physics courses for pre-health majors in the United States. The curriculum was developed by a physicist though the community engagement of students, physicians, clinical and basic science researchers. Course activities include a combination of regular and guest lectures, hands-on exercises, web-based activities, discussions, and a poster information session highlighting an aspect of physics in medicine at a local science museum. Demographic data revealed that the majority of students were biology majors, followed by science and physics majors. Approximately two-thirds of students were pursuing a career in medicine, while a smaller proportion of students were pursuing a career in scientific research. Furthermore, this course sparked motivation for continued self-study by engaging students into biomedical physics-related educational research projects.",Ralf Widenhorn
Session:,Pre-college/Informal and Outreach,Poster,Title:,AAPT's PhysicsBowl -- A Contest for High Schools,Meeting:,"2013 Winter Meeting: New Orleans, Louisiana",Location:,N/A,Date:,,<b> Time: </b>,10:15AM,<b> Author: </b>,"Michael C. Faleski, Delta College",<b> Co-Author(s): </b>,None,"The PhysicsBowl is an annual contest for high school students. The contest itself is 40 multiple-choice questions in length to be answered in no more than 45 minutes In 2012, there were more than 5000 students participating from approximately 260 schools across the world. In the past few years, schools have competed from the United States, Canada, China, Taiwan, Japan, the Republic of Korea, and Italy. Prizes are awarded to both the students and schools for high performers. This poster is to give high school teachers more information about the contest.",None
Session:,PER: Investigating Classroom Strategies,Contributed,Title:,Increases in Problem Solving and Conceptual Understanding Without Sacrificing Content,Meeting:,"2013 Winter Meeting: New Orleans, Louisiana",Location:,N/A,Date:,,<b> Time: </b>,8:20AM,<b> Author: </b>,"David J. Webb, University of California, Davis",<b> Co-Author(s): </b>,None,"Four large sections of intro-physics for physical scientists are compared. One section (treatment) was organized so that students worked to learn the classical ideas connecting forces and motion over the first six weeks of the 10-week quarter and then used the final four weeks to apply those principles to algebraically complicated physical problems. The other three (control) sections learned ideas at essentially the same time as calculations. The treatment group and one of the control sections were taught by the same instructor, had identical curricular materials, and this instructor was blind to the comparison measure, the final exam. After controlling for GPA as well as for incoming conceptual understanding, the treatment group was found to perform significantly better on the final exam than the control group taught by the same instructor and, by a similar measure, the treatment group performed significantly better than any other section.",None
Session:,Broader Perspectives: Technology in the Classroom,Invited,Title:,Design-based Research in Classroom and University with Mobile Devices,Meeting:,"2013 Winter Meeting: New Orleans, Louisiana",Location:,N/A,Date:,,<b> Time: </b>,1:30PM,<b> Author: </b>,"Andr Bresges, University of Cologne",<b> Co-Author(s): </b>,None,"University of Cologne encourages learning in small workgroups, but is sensitive to meet standards for expected outcome. Solution is a Learning Management System to prepare workgroups and provide data-driven feedback. Prior and following workgroup meetings, students perform mandatory electronic quizzes. The results are discussed in tutor preparation courses, identifying both students' misunderstandings and weaknesses of the lecture. This guides the planning of the groupwork. Process of individual groups is weekly discussed based on results and on supervision. Thus, teacher education studentsare encouraged to view evaluation not as device for grading, but as a key to develop better lessons. This experience is anchor to follow-up project learning courses. In the Design Based Research project ""Planetary Research with iPads"" quizzes, supporting material and activities are aggregated into an iBook. Teacher education students design the iBook, guide and evaluate student's activities, and adapt the iBook to meet the design targets.",Website of the author: http://www.physikdidaktik.uni-koeln.de
Session:,Broader Perspectives: Technology in the Classroom,Contributed,Title:,Physics Learning Enhanced by Student Creation of MATLAB GUI Tools,Meeting:,"2013 Winter Meeting: New Orleans, Louisiana",Location:,N/A,Date:,,<b> Time: </b>,2:40PM,<b> Author: </b>,"Thomas F. Finke, Trinity School at Greenlawn",<b> Co-Author(s): </b>,Craig S Lent,"For the past seven years Trinity School has been teaching all high school juniors and seniors on three campuses to program in MATLAB. Students write their own code which helps make mathematical manipulations and conceptual ideas concrete. Our approach focuses on the construction of GUI tools-student created computational models of physical phenomena which include a graphical user interface (GUI).[1] This allows students to easily vary values using sliders and text boxes and thereby explore the behavior of the physical system being modeled. This in turn helps in shaping and refining physical intuition. Student-written computational models can also be integrated with laboratory data. We introduce basic numerical techniques that enable the GUI Tools to include nonideal effects like aerodynamic drag, which are often difficult to model analytically. We will describe the structure of our pedagogical approach and show examples of student work.",[1] http://www.learningmatlab.com
