Session:,PER: Classroom Strategies and Problem Solving Using Online Tools,Contributed,Title:,Capitalizing on Digital Natives' Technological Skills,Meeting:,"2013 Summer Meeting: Portland, Oregon",Location:,N/A,Date:,,<b> Time: </b>,9:20AM,<b> Author: </b>,"Angela M. Cannava, University of Colorado, Boulder",<b> Co-Author(s): </b>,None,"The PER community has developed materials that build on students' conceptual and epistemological resources. However, little attention has been given to students' technological resources, which are becoming increasingly important. As ""digital natives"" make up the majority of our student population, a simple change of replacing paper and pencil lab notebooks with digital notebooks may have a dramatic impact on the extent to which students feel valued and respected. Additionally, digital notebooks are more aligned with the way digital natives have learned to do their work. Initial results suggest that digital lab notebooks lead to increased student achievement, engagement, and quality of work. Survey results revealed that students preferred digital notebooks because they allow for ""easier data sharing"" and increased ""versatility."" These results will be discussed along with implications for instruction and further research.",None
Session:,PER: Student Reasoning and Topical Understanding,Contributed,Title:,Effectiveness of Computer-based Training on Vector Products,Meeting:,"2013 Summer Meeting: Portland, Oregon",Location:,N/A,Date:,,<b> Time: </b>,3:20PM,<b> Author: </b>,"Brendon D. Mikula, The Ohio State University",<b> Co-Author(s): </b>,Andrew F. Heckler,"Computer-based training on dot products and cross products was given to N=223 students in an introductory level, calculus-based electromagnetism course at The Ohio State University. The level of feedback in training was varied as follows: no training (control), correctness feedback, correctness and correct answer feedback, correctness and explanation feedback. Training lasted for approximately 10 minutes, and a paper assessment was given immediately afterwards. This assessment consisted of both arrow format questions, similar to those in the training, and conceptual/transfer questions related to vector products selected from the Vector Concept Test (Zavala & Barniol). All training conditions significantly outperformed control on both question types (d > 0.46). Consistent with VanLehn's interaction plateau hypothesis, high-level feedback was significantly more effective than low-level feedback for arrow notation questions (d = 0.35) and no significant difference was observed between the high-level feedback conditions for either question type.",None
Session:,Physics & Society,Invited,Title:,Wacky or Real: What Are YOU Doing About It?,Meeting:,"2013 Summer Meeting: Portland, Oregon",Location:,N/A,Date:,,<b> Time: </b>,1:00PM,<b> Author: </b>,"Erik Bodegom, Portland State University",<b> Co-Author(s): </b>,None,"There are 7 billion people on Earth, most with crazy ideas, beliefs, and superstitions that spread quickly far and wide by e-means. Prior to the Pony Express, ideas spread slowly, haphazardly. Because of the today's flood of misinformation, junk science, and woo-woo, it is necessary that people are vaccinated against moronity. It is the mission of the sciences and philosophy to inoculate the masses, but are we failing? Even many notable scientists have shown a shocking lack of understanding, e.g., Josephson, Pauling, Shockley, Mullis, Lenard, Mullis, Watson, Giaever, P. Curie, and Collins. Why? We live under the pretense that we are more than ""Cro-Magnon."" But are we?",None
Session:,Teaching Physics Online,Contributed,Title:,Einstein via MOOC,Meeting:,"2013 Summer Meeting: Portland, Oregon",Location:,N/A,Date:,,<b> Time: </b>,8:10AM,<b> Author: </b>,"Larry Lagerstrom, Stanford University",<b> Co-Author(s): </b>,None,"I will report on the experience of teaching a massive open online course on ""Understanding Einstein: The Special Theory of Relativity"" to a wide range of students. The course offered participants the choice of three approaches to the material: a more quantitative approach (involving weekly problem sets), a more qualitative approach (involving a creative project), and an auditing approach. Course content was presented via video clips, handouts, and discussion forums, along with two recommended readings: Einstein's original paper on the special theory of relativity, and a profile on the life and work of the young Einstein (L. Randles Lagerstrom, ""Young Einstein: From the Doxerl Affair to the Miracle Year,"" http://www.amazon.com/dp/B00BKKHS4U).",None
Session:,Posters on Apparatus,Poster,Title:,Using Smartphones as Science Laboratory Instruments,Meeting:,"2013 Summer Meeting: Portland, Oregon",Location:,N/A,Date:,,<b> Time: </b>,4:00PM,<b> Author: </b>,"Kyle Forinash, Indiana University Southeast",<b> Co-Author(s): </b>,Raymond F. Wisman,"Smartphones and tablets available today have the computational power for data analysis such as the Fast Fourier Transform as well as built-in sensors such as accelerometers, magnetometers, microphones, speakers, and GPS. With existing apps, portable electronic devices can potentially bring a laboratory experience to the student outside of the classroom or lab. An additional valuable feature of smartphones and similar devices is the headset port which offers a method to communicate with external circuits and sensors, greatly enhancing the potential for use as a laboratory data collection tool. In this presentation we look at the use of mobile devices as laboratory data collection tools and demonstrate simple examples of a smartphone communicating with an external circuit via the headset port. Reference: R. Wisman and K. Forinash, ""Smartphones as portable oscilloscopes for physics labs"", The Physics Teacher, Vol. 50 No. 4 (2012) p242. K. Forinash and R. Wisman, ""Smartphones- Experiments with an External Thermistor Circuit"", The Physics Teacher, Vol. 50 No. 9 (2012) p566.",None
Session:,Investigating Classroom Strategies,Contributed,Title:,The Interrogation Method: Framework for Helping Students Read a Textbook,Meeting:,"2013 Summer Meeting: Portland, Oregon",Location:,N/A,Date:,,<b> Time: </b>,11:00AM,<b> Author: </b>,"Robert C. Zisk, Rutgers University",<b> Co-Author(s): </b>,"Elana M. Resnick, Eugenia Etkina","Being able to read and interpret scientific texts is an essential scientific ability for our students. One method that has been developed to enhance students' ability to read texts is a question-based reading strategy, the interrogation method. Students read a section of the text and then use the information found in the section to answer the question ""Why is this sentence true?"" for a paraphrased sentence from that section. Critical to the efficacy of this method is the selection of productive sentences for students to interrogate. Sentences that are highly interrogatable require students to reason through the text and connect concepts in order to completely respond to the prompt. We have explored the use of this method in an introductory physics course. In this talk we will discuss the framework we have developed for choosing productive sentences that are both highly interrogatable and have a high epistemological value.",None
Session:,Assessment of Informal Science Education,Invited,Title:,Evaluating Informal Learning Experiences,Meeting:,"2013 Summer Meeting: Portland, Oregon",Location:,N/A,Date:,,<b> Time: </b>,8:30AM,<b> Author: </b>,"David R. Heil, David Heil & Associates, Inc.",<b> Co-Author(s): </b>,None,"Evaluation is an increasingly important element of both public and private funded projects. This session will explore the nature of informal learning and the role that evaluation plays in helping a project team successfully meet their goals and objectives, introduce a variety of approaches used in informal education evaluation, and share lessons learned from the field. The presenter will describe the value and methodologies of three types of evaluation: Front End, which measures an audience's prior knowledge, interests, needs, and expectations as well as assessing the landscape within which a program or exhibit will be used; Formative, which helps inform the design and revisions of educational programs and exhibits with real data; and Summative, which measures the efficacy and impact of an educational experience. Examples from a range of informal learning experiences will be shared and attendees will be given the opportunity to ask questions about evaluating their own projects.","1. Invited Paper Sponsored by: Amber Stuver, LIGO Livingston Observatory"
Session:,Investigating Classroom Strategies,Contributed,Title:,The Interrogation Method and Its Effects on Student Learning,Meeting:,"2013 Summer Meeting: Portland, Oregon",Location:,N/A,Date:,,<b> Time: </b>,11:10AM,<b> Author: </b>,"Elana M. Resnick, Rutgers University",<b> Co-Author(s): </b>,"Robert C. Zisk, Eugenia Etkina","The interrogation method is a strategy that has been developed to help students read and interpret science texts. In this method, students are prompted to read a section of the text, and then answer why a sentence from the text is true based on the reading. We have explored the use of this method in an introductory physics course for non-physics science majors. Students were required to respond to two to four interrogation sentences each week on their homework based on the sections there were reading each week. Each exam then included three sentences for the students to interrogate without the text. In this talk, we will discuss the student responses to the sentences, as well as the evolution of their responses throughout the semester. We will then discuss the relation between the students' homework responses and their responses on the exam questions as well as their overall performance in the course.",None
Session:,What Does Success Mean in Graduate School?,Invited,Title:,Physics Graduate Students: Assess the Program or the Individual?,Meeting:,"2013 Summer Meeting: Portland, Oregon",Location:,N/A,Date:,,<b> Time: </b>,8:00AM,<b> Author: </b>,"Kathie E. Newman, University of Notre Dame",<b> Co-Author(s): </b>,None,"Graduate physics programs are run in a very different way than undergraduate ones. While the early years for a graduate student tend to be spent in graduate courses, serving as teaching assistants, and passing any required examinations, the PhD student spends an even longer period of apprenticeship under a senior research adviser. Graduate programs can be assessed by input (admissions) and output (graduations), research productivity (conference attendance, papers published), and external funding support. A new tool is developing, that of more individual assessment of a given student, what is the student's desired outcome, does he or she obtain success in graduate school, and who decides that? Annual assessments of students help departments as a community to take responsibility globally for all of its students, encouraging soft skills development in addition to the more traditional academic and research related skills.",Sponsored by Steve Turley.
Session:,Demo and Lab Ideas for the H.S. Physics Classroom,Invited,Title:,Fun and Insightful Demonstrations for High School Teachers,Meeting:,"2013 Summer Meeting: Portland, Oregon",Location:,N/A,Date:,,<b> Time: </b>,4:00PM,<b> Author: </b>,Ralf Widenhorn,<b> Co-Author(s): </b>,"Justin Dunlap, Elliot Mylott, Lester Lampert, Elizabeth Anderson","We will present a number of demonstrations for the high school physics classroom covering a range of topics. The presentation is done by Portland State University's Science Outreach Society and physics high school teachers and demonstrators from Oregon, led by Ralf Widenhorn of Portland State University. The presentation includes time for discussion and questions and contributions throughout the half hour.",None
Session:,Investigating Classroom Strategies,Contributed,Title:,PER User's Guide Plus: PER-based Assessment Guide and Results Database,Meeting:,"2013 Summer Meeting: Portland, Oregon",Location:,N/A,Date:,,<b> Time: </b>,10:30AM,<b> Author: </b>,"Adrian M. Madsen, American Association of Physics Teachers",<b> Co-Author(s): </b>,"Sarah B. McKagan, Eleanor C. Sayre","As part of the PER User's Guide (http://perusersguide.org), we are developing an online database of PER-based assessment instrument scores and an accompanying data explorer. Here physics instructors can upload their students' assessment data and compare it to the larger data set. The system includes ""one-click analysis,"" enabling users to visualize their data, make comparisons, and view statistics such as gain scores, effect sizes, and statistical significance. Users can compare their data in a variety of ways, such as to data from peer institutions, national data, or before and after a change in teaching method. We plan to conduct a large-scale comparison of assessment data from traditional and interactive-engagement classes as the database is populated. Additionally, we are developing guides to these PER-based assessments, including information about their background, research validation, and guidelines for administration. We solicit your feedback on our system and your assessment data to include in our database.",None
Session:,Physics Education Research II,Poster,Title:,PER User's Guide Plus: PER-based Assessment Guide and Results Database,Meeting:,"2013 Summer Meeting: Portland, Oregon",Location:,N/A,Date:,,<b> Time: </b>,9:15AM,<b> Author: </b>,"Adrian M. Madsen, American Association of Physics Teachers",<b> Co-Author(s): </b>,"Sarah B. McKagan, Eleanor C. Sayre","As part of the PER User's Guide (http://perusersguide.org), we are developing an online database of PER-based assessment instrument scores and an accompanying data explorer. Here physics instructors can upload their students' assessment data and compare it to the larger data set. The system includes ""ne-click analysis"", enabling users to visualize their data, make comparisons and view statistics such as gain scores, effect sizes, and statistical significance. Users can compare their data in a variety of ways, such as to data from peer institutions, national data, or before and after a change in teaching method. We plan to conduct a large-scale comparison of assessment data from traditional and interactive-engagement classes as the database is populated. Additionally, we are developing guides to these PER-based assessments, including information about their background, research validation, and guidelines for administration. We solicit your feedback on our system and your assessment data to include in our database.",None
Session:,Physics Preparation of Preservice Elementary Teachers,Invited,Title:,Coordinating Instruction Across the Sciences for Preservice Elementary Teachers,Meeting:,"2013 Summer Meeting: Portland, Oregon",Location:,N/A,Date:,,<b> Time: </b>,11:00AM,<b> Author: </b>,"Leslie J. Atkins, California State University, Chico",<b> Co-Author(s): </b>,None,"In 2007, the College of Natural Sciences at CSU, Chico hired three tenure-track faculty in biology, physics, and geoscience education and launched the Science Education Department in 2008. Over the past five years, these faculty have focused their efforts on the science content preparation of preservice elementary students, establishing a core sequence of content courses that all preservice students take. Our initial approach was to divide-and-conquer: ensuring that each standard was addressed in at least one of our core courses. With NGSS and Framework in mind, we have recently begun work to coordinate instruction, presenting core ideas, representations, and scientific writing in greater depth throughout our sequence. In this talk I will present some of our early work in coordinating this instruction, including challenges and preliminary outcomes.","This work has been supported by NSF grants 0837058, 0942391, and 1140860."
Session:,Upper Division and Graduate,Poster,Title:,Sources and Resources for Training Physics Students to Write,Meeting:,"2013 Summer Meeting: Portland, Oregon",Location:,N/A,Date:,,<b> Time: </b>,9:15AM,<b> Author: </b>,"Jean-Francois S. Van Huele, Brigham Young University",<b> Co-Author(s): </b>,None,"Whether you assign term papers, require lab reports, supervise publishable student research, or teach an advanced writing class in physics, there are lots of resources for you out there. This poster collects and organizes available sources and provides expert resources, including some practical do's and don'ts for physics students, their teaching assistants, and their writing instructors.",None
Session:,PER:Teacher Preparation and Professional Development,Contributed,Title:,Analysis of Pre-Service Teachers' Reflections on Teaching,Meeting:,"2013 Summer Meeting: Portland, Oregon",Location:,N/A,Date:,,<b> Time: </b>,4:10PM,<b> Author: </b>,"Marianne Vanier, Rutgers University",<b> Co-Author(s): </b>,"Marina Malysheva, Eugenia Etkina",Pre-service physics teachers at Rutgers University teach laboratories and recitations in a reformed introductory physics course as part of their teacher preparation program. They reflect on their weekly teaching experiences on a Google group page. We developed a coding scheme to analyze their reflections and analyzed patterns in the reflections (total of 300 journal entries). We focused on the dependence of the content and depth of reflection on the class material and the time of teaching (before or after student teaching). In this talk we will present the patterns that emerged.,None
Session:,Modern Physics in the High School Classroom,Contributed,Title:,Students Videoconference to Compare their LHC Particle Event Analyses,Meeting:,"2013 Summer Meeting: Portland, Oregon",Location:,N/A,Date:,,<b> Time: </b>,9:20AM,<b> Author: </b>,"Dave Trapp, SequimScience.com & QuarkNet",<b> Co-Author(s): </b>,None,"The U.S. Masterclass, part of the International Masterclass program, engages students to analyze recent high-energy collision data from the LHC including possible Higgs events. Students share, compare, and discuss their analyses via videoconference with physicists and other groups of students around the U.S. and often other countries in the Americas, Europe, and around the Pacific rim. By encouraging students to emulate the processes physicists use, it helps them understand what is science and what it has and can accomplish. This talk will discuss the details of these video conferences, their features and their success.",None
Session:,Other,Contributed,Title:,"'Hobab Theory' Theory of Everything, Including Social Aspects",Meeting:,"2013 Summer Meeting: Portland, Oregon",Location:,N/A,Date:,,<b> Time: </b>,3:20PM,<b> Author: </b>,"Shahrad Faghihi,",<b> Co-Author(s): </b>,None,"The Universe started with Big Explosion-Jump. It started from a certain point of extremely contracted space holding energy. If one contracts space, then sspace gets folded, like a three-dimensional spring. Space resists contraction and contracted space tends to expand. Space reaction to contraction is becoming denser and starting to roll and make curls right from the middle, where it bears the maximum pressure. Almost like coil. It starts boiling and rotating. If contracting continues it starts to split itself in two, four, eight and so on--the same way a cell divides itself. Space Balls look like a bubble full of space. One could see these Bubbles as spherical space surfaces or space membranes near each other and fully touching and pushing each other, as we know from geometry. The boiling of Space Bubbles and the folds give its membranes a vibrating motion. It has a wavy form. All particles and phenomena in physics can be explained as different form and interaction of these contracted Space Bubbles.",None
Session:,Teacher Training/Enhancement,Poster,Title:,Content and Depth of Reflection on Teaching: Does Evolution Occur?,Meeting:,"2013 Summer Meeting: Portland, Oregon",Location:,N/A,Date:,,<b> Time: </b>,9:15PM,<b> Author: </b>,"Marina Malysheva, Rutgers University",<b> Co-Author(s): </b>,"Marianne Vanier, Eugenia Etkina","The poster will show the patterns that emerged from our analysis of pre-service teachers' reflections on teaching in an introductory physics course. The teaching occurred before and after the formal student teaching internship. Over 300 reflections were coded for the study. We were interested in the changes in reflections, specifically the content (what the pre-service teachers focus on) and the nature of the reflections (how deeply they analyze teaching situations). To accomplish this goal we developed and validated a coding scheme.",None
Session:,Best Practices in Educational Technology II,Contributed,Title:,Improving Formative Assessment in High School Physics with Learning Catalytics,Meeting:,"2013 Summer Meeting: Portland, Oregon",Location:,N/A,Date:,,<b> Time: </b>,3:00PM,<b> Author: </b>,"Lisa Lamont, Windward School",<b> Co-Author(s): </b>,"Simon Huss, Brian Lukoff","The Windward Science and Technology Department has implemented Learning Catalytics in its introductory physics classroom, utilizing this cloud-based audience-response platform to take formative assessment to the next level. Developed by Harvard researchers, Learning Catalytics greatly expands on existing clicker technology, offering additional means of assessing student comprehension. Windward faculty has integrated this tool into their existing student-centered, inquiry-based curriculum. The curriculum combines hands-on laboratory activities and demonstrations with formative assessments delivered via the Learning Catalytics platform. The program utilizes proven teaching strategies such as Physics Ranking Tasks and Interactive Lecture Demonstrations that are quickly delivered and evaluated using this unique system. The discussion will include Windward's experience with implementation, observed outcomes, and directions for future study, described in the context of two academic units.",Please visit the Learning Catalyics website at: LearningCatalytics.com
Session:,"PER: Reasoning, Mathematics, and Representations",Contributed,Title:,Student Interpretation of Multi-Variable Expressions: Transfer Between Different Contexts,Meeting:,"2013 Summer Meeting: Portland, Oregon",Location:,N/A,Date:,,<b> Time: </b>,4:50PM,<b> Author: </b>,"Mila Kryjevskaia, North Dakota State University",<b> Co-Author(s): </b>,None,"Student reasoning difficulties with applying and interpreting multi-variable expressions have been reported previously. In the context of a math course, for example, it may be appropriate to reason that, for the given relationship y = x/a, if x increases, y must also increase; in such cases, it is commonly assumed that variables (e.g., x and y) and constants (e.g., positive a) have been clearly established. However, a direct mapping of the same reasoning in the context of physics (namely, for the given relationship f= v/lamda, if the propagation speed v increases, frequency f must also increase) leads to an erroneous conclusion. In this investigation we are probing the impact of targeted instruction on student ability to apply multi-variable expressions and to transfer their knowledge and skills between different contexts. Data from introductory calculus-based physics courses will be presented and discussed.",None
Session:,Upper Division and Graduate,Contributed,Title:,Of Cats and Students: Discovering Quantum Information with Undergraduates,Meeting:,"2013 Summer Meeting: Portland, Oregon",Location:,N/A,Date:,,<b> Time: </b>,3:20PM,<b> Author: </b>,"Jean-Francois S. Van Huele, Brigham Young University",<b> Co-Author(s): </b>,None,Can you violate the Heisenberg uncertainty relation? How do quantum operations work? What new insight does weak measurement provide? What restrictions exactly apply to cloning? When does entanglement come in handy? And what's a quantum Cheshire cat? Quantum theory has evolved significantly beyond its traditional coverage in the physics curriculum. About all that we need to constrain quantum mysteries are linear algebra and creative thinking. This turns quantum information into fertile ground for undergraduate research projects and teaching. I review my experience with students and their projects and give examples on how to ask questions of current relevance in quantum theory and get the students to answer them.,None
Session:,Investigating Classroom Strategies,Contributed,Title:,"Introducing Students to Active Learning: ""Framing"" Strategies",Meeting:,"2013 Summer Meeting: Portland, Oregon",Location:,N/A,Date:,,<b> Time: </b>,11:50AM,<b> Author: </b>,"Stephanie V. Chasteen, University of Colorado Boulder",<b> Co-Author(s): </b>,"Andrew Boudreaux, Jon D.H. Gaffney","How can we introduce our students to active learning strategies? An interactive course can challenge or even conflict with student views of learning, and of the roles of the instructor and students in the classroom. Instructors are often concerned about lack of engagement and sometimes face active push-back against interactive teaching strategies. How can we let students know what is expected of them, to support productive engagement and buy-in? How can we ""frame"" for them what the class is about? Through an informal poll, we have gathered a wide variety of materials from instructors around the country in order to provide shared resources for instructors. We will report on common themes and approaches in how instructors frame active learning classrooms for their students, and describe future work in this area.",Materials can be found at http://www.colorado.edu/sei/fac-resources/
