4090,Contributed Poster,Faculty Perspectives about Institutional Assessment of Teaching Effectiveness,"Faculty and their institutions should have a shared set of metrics by which they measure teaching effectiveness.  Unfortunately, the current situation at most institutions is far from this ideal.  As part of a larger interview study, physics faculty were asked to describe how their institutions evaluate teaching effectiveness. The most common response was that institutions commonly rely on anonymous numerical ratings of courses by students (student evaluations of teaching effectiveness) for most or all of their assessment.  Faculty were often skeptical that the metrics used by their institutions were sufficient to reasonably evaluate teaching effectiveness.  In this poster we present faculty perspectives of institutional evaluation of teaching effectiveness and compare these to the research literature on the evaluation of teaching effectiveness.",Charles Henderson,http://www.per-central.org/perc/2011/detail.cfm?ID=4090,Western Michigan University,"Chandra Turpen, Western Michigan University
Melissa Dancy, University of Colorado at Boulder",2011
4118,Contributed Poster,Finding Meaningful Search Features for Automated Analysis of Students Short Responses to Conceptual Questions,"The Pathway Active Learning Environment synthetic tutoring system is capable of collecting large numbers of students' short responses to open-ended questions.  The analysis of these responses may provide insight into the utility of the system, as well as information about student understanding of physics.  The free-response nature of our data lends itself to qualitative analysis, however large data sets benefit from automated analysis.  Natural language processing and data mining approaches, such as clustering, have been of interest across a variety of fields for automating the analysis of qualitative data.  However, content-specific vocabulary, an abundance of search features, some of which are irrelevant, and inherent limitations on computers abilities to match meaning are challenges that must be overcome.  In this poster we discuss the extraction of features from human-grouped responses that may be meaningful and also useful for training automated systems for the analysis of future data.",Christopher M. Nakamura,http://www.per-central.org/perc/2011/detail.cfm?ID=4118,Kansas State University Physics Department,"Sytil K. Murphy 
Kansas State University Physics Department

Dean A. Zollman
Kansas State University Physics Department

Michael Christel
Carnegie Mellon University Entertainment Technology Center

Scott M. Stevens
Carnegie Mellon University Entertainment Technology Center",2011
4077,Contributed Poster,Following Student Gaze Patterns in Lectures,"This study investigates the gaze patterns of undergraduate college students attending a lecture-based physical science class to better understand the relationships between gaze and focus patterns and student attention during class. The investigators used a new eye-tracking product; Tobii Glasses.  The glasses eliminate the need for subjects to focus on a computer screen or carry around a backpack-sized recording device, thus enabling the ability to investigate a broader range of research questions.  This investigation includes what students focus on in the classroom (i.e. demonstrations, instructor, notes, board work, and presentations) during a normal lecture, what diverts attention away from being on task as well as what keeps a subject on task. We report on the findings from 8 subjects during lectures designed for future elementary school teachers.",David Rosengrant,http://www.per-central.org/perc/2011/detail.cfm?ID=4077,Kennesaw State University,"Doug Hearrington, Kennesaw State University
Danielle Keeble, Kennesaw State University
Kerriann Alvarado, Dutchtown Middle School",2011
4136,Contributed Poster,Free-Response Administration of a Mechanics Reasoning Inventory,"Strategic knowledge is required to appropriately organize procedures and concepts to solve problems.  We are in the process of validating a standardized instrument assessing strategic knowledge in the domain of introductory mechanics.  This instrument is inspired in part by Lawson's Classroom Test of Scientific Reasoning and Van Domelen's Problem Decomposition Diagnostic.  The predictive validity of the instrument has been suggested by studies showing significant correlation with performance on final exams administered in introductory mechanics courses at the Massachusetts Institute of Technology and the Georgia Institute of Technology.  In order to study the validity of the content from the students perspective, we have administered the instrument in free-response format to 40 students enrolled in calculus-based introductory mechanics at the University of Wisconsin-Platteville.  This procedure has the additional advantage of improving the construct validity of the inventory, since student responses suggest effective distractors for the multiple-choice form of the inventory.",Andrew Pawl,http://www.per-central.org/perc/2011/detail.cfm?ID=4136,University of Wisconsin-Platteville,"Analia Barrantes, MIT
Carolin Cardamone, MIT
Saif Rayyan, MIT
David E. Pritchard, MIT",2011
4169,Contributed Poster,Further Investigation of Examining Students Understanding of Lenzs law and Faradays Law,"Magnetic induction has been known to be a particularly difficult concept in introductory physics. In this project, we build upon our previous research on probing the difficulties students have with magnetic flux in regards to Lenz's Law and Faraday's Law. This presentation will explore student responses when the format of the instrument was reversed, so that students had to use a flux vs. time graph to infer details of the physical situation. Although the newer version of the survey identifies other difficulties students have, the student responses suggest the value of this reverse process in both probing student thinking and in instruction on magnetic flux.

Supported in part by the CSU Louis Stokes Alliance for Minority Participation and Ronald E. McNair Post-Baccalaureate Achievement Program.",Casey Sanchez,http://www.per-central.org/perc/2011/detail.cfm?ID=4169,Cal State University Fullerton,"Dr. Michael E. Loverude, Professor, Department of Physics, California State University Fullerton.",2011
4139,Contributed Poster,Gender Bias in the Force Concept Inventory?,Could the well-established fact that males tend to score higher than females on the Force Concept Inventory (FCI) be due to gender bias in the questions? The eventual answer to the question hinges on the definition of bias. We assert that a question is biased only if a factor other than ability (in this case gender) affects the likelihood that a student will answer the question correctly.  The statistical technique of differential item functioning allows us to control for ability in our analysis of student performance on each of the thirty FCI questions. This method uses the total score on the FCI as the measure of ability. We conclude that the evidence for gender bias in the FCI questions is marginal at best.,Richard D. Dietz,http://www.per-central.org/perc/2011/detail.cfm?ID=4139,University of Northern Colorado,"Robert H. Pearson
Matthew R. Semak
Courtney W. Willis

all at University of Northern Colorado, Greeley, CO 80639",2011
4123,Contributed Poster,Gender Differences in Conceptual Gains and Attitude Regarding Problem Design,"It has been known that context in homework exercises and exam questions affects student performance and highlights gender differences in the physics classroom.  Writing assignments that ask students to evaluate and create may help overcome some of these issues and improve conceptual gains of female students.  One example of such an assignment is that of problem design.  Problem design assignments were assigned to a subset of students in an undergraduate College Physics course, and assessment was performed to measure and compare conceptual gains for all students.  Two concept surveys (FCI and EMCS) were used to assess the students conceptual gains and whether females or males might benefit more from the assignment, with the awareness that gender biases may exist within the surveys themselves.  The students' attitudes were also probed to investigate if those opinions shaped the outcome of the potential benefits associated with the completion of the problem design assignment.",Rachel Snyder,http://www.per-central.org/perc/2011/detail.cfm?ID=4123,Bowling Green State University,"Eric Mandell, Bowling Green State Unviersity",2011
4128,Contributed Poster,Grading by Conceptual Category: A Technique that Emphasizes Conceptual Understanding,"When grading a large stack of student solutions, there are two things I find most difficult; 1) determining how much each error is worth, and 2) balancing that with how much correct work the student has shown while still applying the rubric fairly. I describe a grading technique in use for a large-enrollment introductory physics course that separates student responses into concept-centered categories and effectively eliminates these two difficulties.  More importantly this technique allows instructors to assign grades based on apparent conceptual understanding rather than procedural ability.  Data from our study comparing traditional and categorical graders will also be discussed.",Cassandra Paul,http://www.per-central.org/perc/2011/detail.cfm?ID=4128,University of California-Davis,"Emily A. West, David Webb, Wendell H. Potter",2011
4064,Contributed Poster,How accurately can students estimate their performance on an exam and how does this relate to their actual performance on the exam?,"Research has shown that students' beliefs regarding their own abilities in math and science can influence their performance in these disciplines.  I investigated the relationship between students' estimated performance and actual performance on five exams in a second semester calculus-based physics class.  Students in a second-semester calculus-based physics class were given about 72 hours, after the completion of each of five exams, to estimate their individual and class mean score on each exam.  Students were given extra credit worth 1% of the exam points for each estimating their score correct within 1% of the actual score and another 1% for estimating the class mean score within 1% of the correct value.  I compared students' individual and mean score estimations with the actual scores to investigate the relationship between estimation accuracies and exam performance of the students as well as trends over the semester.",N. Sanjay Rebello,http://www.per-central.org/perc/2011/detail.cfm?ID=4064,Kansas State University,,2011
4182,Contributed Poster,Impact of the Learning Assistant Experience for High School Physics Students,"An ongoing partnership was formed between the conceptual physics classes at an urban high school and the second-grade classes at an elementary school in the same district. During the latter half of the course, students in the high school classes learned how to create backward design lesson plans and utilize formative assessments to measure student understanding. The physics students then created lesson plans pertaining to three units of study (Newton's Laws, conservation of energy, and electrostatics), which they implemented in their partner elementary classroom. Participating physics classes were comparatively evaluated for effects on content understanding and retention, engagement, motivation, and perception of learning. Data from four classes will be presented with recommendations for continuing the elementary-secondary physics partnership. Project was partially funded by NSF grant #DUE 934921 and ING Financial Service's Unsung Hero Award.",Susan Nicholson-Dykstra,http://www.per-central.org/perc/2011/detail.cfm?ID=4182,Northglenn High School,"Joshua H. Cuchiaro, Valerie K. Otero",2011
4184,Contributed Poster,Implementing a Problem-Solving Assessment Tool on a Student-Centered Classroom,"In a large private Mexican University both introductory physics and mathematics courses are taught in a Student-Centered Learning Classroom (ACE classroom in Spanish) which is based on the Student Centered Active Learning Environment for Undergraduate Programs (SCALE-UP) classroom. [1] In both courses, activities to improve students' Problem-Solving skills are implemented. To assess Problem-Solving skills, we use the Physics Problem-Solving Assessment Rubric by Docktor [2] in which students' solution of a problem is assessed. In this contribution we propose an implementation protocol that reduces average raters' disagreement. This protocol enables novice raters to reach an average disagreement as low as 14% in the first implementation. 

1. R. Beichner, in Research-Based Reform of University Physics (2007), Vol. 1.
2. J. Docktor. Development and Validation of a Physics Problem-Solving Assessment Rubric. Dissertation, University of Minnesota, 2009,",Teresita Marin-Suarez,http://www.per-central.org/perc/2011/detail.cfm?ID=4184,Tecnologico de Monterrey,"Sujania A. Talavera
Tecnologico de Monterrey

Rodrigo Caas
Tecnologico de Monterrey

Angeles Dominguez
Tecnologico de Monterrey

Genaro Zavala
Tecnologico de Monterrey",2011
4159,Contributed Poster,Improving Interpersonal Communication Skills in College Science on a Student-Centered Classroom,"The ACE classroom (Spanish for Student-Centered Learning), based on SCALE-UP aims to establish a high collaborative participation and interactive learning environment [1]. Previous studies used qualitative video analysis to identify clusters of behavior that reflect verbal reasoning [2]. A multiple-case study was conducted using the heuristic for Taxonomies of Interpersonal Skills [3]. A total of 720 minutes of videorecordings were analyzed including sessions from both introductory physics and mathematics courses offered in ACE classroom during Fall 2010 and Spring 2011. There was a high recurrence for altercentrism ability and a large number of expressions of care and support among members of each team. There was also a considerable change in the communication context from a 10% academic at the beginning to nearly 90% by the end of the semester. These results confirm that design enables a collaborative learning environment and promotes development of students interpersonal skills.
1. R. Beichner, in Research-Based Reform of University Physics (2007), Vol. 1.
2. L. Conlin, A. Gupta, R. Scherr, and D. Hammer, AIP Conference Proceedings, 951, 69-72, 2007.
3. M. Knapp & J. Daly. Handbook of Interpersonal Communication. (SAGE Publications, Thousand Oaks, CA, 2002).",Diana T. Moreno,http://www.per-central.org/perc/2011/detail.cfm?ID=4159,Tecnologico de Monterrey,"Teresita Marin-Suarez
Tecnologico de Monterrey

Paulina Dominguez
Tecnologico de Monterrey

Genaro Zavala
Tecnologico de Monterrey",2011
4172,Contributed Poster,Improving Self-efficacy with Intentional Tutoring,"You've seen them in your college physics classes; bright students who seem to know the material, but fail the exams.  Even when you work with them one-on-one to help them master the physics, they still fail the exams.  We posit that knowing the material is not the problem, but rather it is about self-efficacy.  To test this hypothesis, we spent six weeks with two groups of students; one was given a heavy dose of physics instruction and homework; the other group was given a selection of PER-inspired activities designed to improve self-efficacy.  At the end of the semester both groups' self-efficacy improved as did their exam performance, but the difference is impressive.",Thomas Foster,http://www.per-central.org/perc/2011/detail.cfm?ID=4172,Southern Illinois University Edwardsville,"Tavish Hill, SIUE",2011
4039,Contributed Poster,Improving Student Understanding of Addition of Angular Momentum,"We describe the difficulties advanced undergraduate and graduate students have with concepts related to addition of angular momentum. We also describe the development and implementation of a research-based learning tool, a Quantum Interactive Learning Tutorial (QuILT), to reduce these difficulties. The preliminary evaluation shows that the QuILT on the addition of angular momentum is helpful in improving students' understanding of these concepts.",Chandralekha Singh,http://www.per-central.org/perc/2011/detail.cfm?ID=4039,University of Pittsburgh,"Guangtian Zhu, University of Pittsburgh",2011
4130,Contributed Poster,Improving physics self-efficacy in pre-service teachers,"Most of the students who enter the Physics content course for pre-service elementary and middle school teachers at the University of Kentucky are, at least anecdotally, uncomfortable with their understanding and ability to teach physics. Consequently, one goal for this course is to improve students' self-efficacy for both of those aspects; regardless of one's ability to do physics, how could we expect her to teach it if she feels uncomfortable with the subject? In this project, we investigate students' levels of self-efficacy at the beginning and end of the course, confirming that while students enter with low self-confidence, they leave significantly more confident both in their understanding of physics and their teaching of it. Nonetheless, there is still room for improvement. By comparing two distinct sections of the course, we seek to isolate specific aspects of the course with the greatest opportunity for impact.",Jon D. H. Gaffney,http://www.per-central.org/perc/2011/detail.cfm?ID=4130,"University of Kentucky, Department of Physics and Astronomy","Natasha Mamaril, University of Kentucky, Department of Education and Counseling Psychology
Amy L. Housley Gaffney, University of Kentucky, Department of Communication
Ellen Usher, University of Kentucky, Department of Education and Counseling Psychology",2011
4079,Contributed Poster,Influence of Visual Cues on Eye Movements and Reasoning in Physics Problems,"Research in several disciplines has shown that using visual cues to focus learners attention on relevant areas in diagrams and animations can increase comprehension and facilitate problem solving. We investigate the effectiveness of visual cues in introductory conceptual physics problems containing a diagram with respect to comprehension and transfer of physics concepts. We also investigate to what extent viewing short duration visual cues influences eye movements. Students in the treatment group saw an initial problem, and if they answered incorrectly, were shown a series of similar problems each overlaid with dynamic visual cues that related to the correct solution. Students in the control group saw the same problems, but without any visual cues.  Students in both groups verbally explained their reasoning after each question and answered transfer problems without cues. We report on students' eye movements while answering the questions, the correctness of answers and verbal reasoning for their answers.",Adrian Madsen,http://www.per-central.org/perc/2011/detail.cfm?ID=4079,Kansas State University,"Adam Larson, Kansas State University
Amy Rouinfar, Kansas State University
Allison Coy, Kansas State University
Lester Loschky, Kansas State University
N. Sanjay Rebello, Kansas State University",2011
4110,Contributed Poster,Institutionalizing Reform: Investing in Faculty Instructional Practices,"The Florida International University (FIU) Science Collaborative (FSC), a HHMI Science Education Project, seeks to transform instructional practices in biology, chemistry, and physics through supporting faculty as they implement reform. The projects goal is to integrate effective education practices into a model of sustainable, institutional science education reform that expands the talent pool of ethnically and gender diverse future scientists. FSC will: (a) develop a multi-disciplinary faculty cohort to serve as leaders for curriculum innovation; and (b) support their implementation of research-based curricula in introductory science courses. Faculty Scholars will receive significant curricular, assessment, and financial support; thus reducing barriers to reform. Through investing in faculty practices, we hope to develop faculty advocacy for education reform and seed sustained institutional change. These activities, as well as other FSC activities, will be presented.",Laird Kramer,http://www.per-central.org/perc/2011/detail.cfm?ID=4110,Florida International University,"Eric Brewe, FIU
David Brookes, FIU
Kenneth Furton, FIU
Joseph Lichter, FIU
Suzanna Rose, FIU
Ophelia Weeks, FIU",2011
4150,Contributed Poster,Interpretation of Vector Products: Effect of the Context and Position of the Vectors,"In this article we report an investigation on the effect of the context and the position of the vectors in the interpretation of dot and cross product. We administered two tests to 380 students completing all introductory physics courses at a large private Mexican university. We studied students' responses in four problems about dot product: 1) no physical context with a tail-to-tail representation, 2) no physical context with a head-to-tail representation, 3) work and 4) electric flux; and in four problems about cross product: 1) no physical context with a tail-to-tail representation, 2) no physical context with a head-to-tail representation, 3) torque and 4) magnetic force. In this article we report the analysis of the responses by comparing the frequencies of the errors in both types of problems to infer students' conceptions in the interpretation of vector products.",Pablo Barniol,http://www.per-central.org/perc/2011/detail.cfm?ID=4150,Tecnologico de Monterrey,"Genaro Zavala
Tecnologico de Monterrey",2011
4094,Contributed Poster,Interpreting Card-sorting data with categorization graphs,"On its 30th anniversary, we are re-examining the seminal paper by Chi et al., which firmly established the notion that novices categorize physics problems by surface features (e.g. incline, pendulum, or projectile motion), while experts use deep structure (e.g. energy conservation or Newtons second law). The paper has been cited over 3000 times in scholarly articles over a wide range of disciplines. Yet, this card sorting experiment's research design and analysis methods are not clear. In replicating the study, we set about looking for a way to compare one categorization to another without reference to some standard categorization set, and in doing so have developed a new method for analyzing card sorting experiments.",Steven Wolf,http://www.per-central.org/perc/2011/detail.cfm?ID=4094,Michigan State University,"Daniel P. Daugherty
Gerd Kortemeyer",2011
4060,Contributed Poster,Intuitive ontologies for energy in physics,"The nature of energy is not typically an explicit topic of physics instruction.  Nonetheless, participants in physics courses that involve energy are constantly saying what kind of thing they think energy is, both verbally and nonverbally.  The premise of an embodied-cognition theoretical perspective is that we understand the kinds of things that may exist in the world (ontology) in terms of sensorimotor experiences such as object permanence and movement.  We offer examples of intuitive ontologies for energy that we have observed in classroom contexts, including energy as a quasi-material substance; as a means of activation; as a fuel; and as an ineffable quantity which is not subject to further analysis.  In the classroom, multiple and overlapping metaphors for energy complement one another in complex representations of physical phenomena.",Rachel E. Scherr,http://www.per-central.org/perc/2011/detail.cfm?ID=4060,Seattle Pacific University,"Hunter G. Close, Texas State University - San Marcos
Sarah B. McKagan, McKagan Enterprises",2011
4126,Contributed Poster,Investigating Dynamics of Group Learning Using Huddleboards,"This study examined the different modes of group interaction among undergraduate students and their impact on student learning and transfer of learning. A series of group-based, problem- solving activities were designed and implemented throughout a semester in an introductory level physics course. The students were engaged in problem-solving sessions integrated with related laboratory activities using Huddleboards. The sequence of the laboratory activities and problem- solving sessions were altered throughout the semester. Mainly three modes of group interaction were observed: scaffolding mode, converging mode and leading-following mode. This paper describes the strategies used by the students in those modes and also reports the correlation of those modes with the group and individual performances as well as the subsequent transfer of learning. In addition, the impact of sequencing laboratory and problem-solving activities on group performances will be reported.",Bijaya Aryal,http://www.per-central.org/perc/2011/detail.cfm?ID=4126,University of Minnesota-Rochester,,2011
