4167,Contributed Poster,"""Good looking"" Animation  Improves Transfer by Loading Meaning into Math","Transferring physics principles from worked examples to new problems can be very hard for students, since they often tend to memorize math manipulations only. Elaborating verbal explanation of the meaning behind math expression often does not seem to help. Therefore, we decided to focus on visual perception. Based on knowledge from grounded cognition research, perception should be more powerful in conveying meaning. We designed several animated multimedia solutions for some difficult problems according to principles derived from grounded cognition, and compared their ability to improve transfer with two very similar animated solutions that contain equivalent spatial information but lack critical perceptual elements. The perceptually rich (good looking) solutions turn out to significantly improve transfer of physics principles, especially when the target problem involves much abstract logical reasoning, and is very different from the example in terms of surface feature.",Zhongzhou Chen,http://www.per-central.org/perc/2011/detail.cfm?ID=4167,University of Illinois at Urbana Champaign,"Gary Gladding
University of Illinois at Urbana Champaign",2011
4075,Contributed Poster,"""Implicit Action"": Understanding Discourse Management in Modeling Instruction","We present Implicit Action, a discourse management tool, through a qualitative video analysis of a Florida International University Modeling Instruction Introductory Physics I class. Implicit Action in Modeling Instruction is where instructors deliberately create intellectual space in which students ideally see value and need for the construction of new classroom norms and tools that are productive in developing a learning community. This space is created by the implications expressed through the instructor's deliberate actions. Discourse Management is a technique to moderate student discussion in Modeling Instruction classes at the university level that was initially described by Desbien. Implicit Action is one of 9 Modeling Discourse Management tools that we have identified. By means of qualitative analysis we illustrate the effectiveness of Implicit Action in implementing Modeling Pedagogical Theory.",Jared Durden,http://www.per-central.org/perc/2011/detail.cfm?ID=4075,FIU,"Eric Brewe/Co-author
Laird Kramer/Co-author",2011
4171,Contributed Poster,"A 12,000-student analysis of normalized gain and alternative metrics using the FCI","The normalized gain, g, is among the most widely- and easily-used metrics in physics education research, particularly as it is applied to the Force Concept Inventory (FCI).  However, its ease and ubiquity mask several pitfalls associated with the metric, particularly when it is used to directly compare a small number of courses.  Specifically, these pitfalls are: the ambiguities between class and student average gain, the tendency not to report error margins, the effect of losses in initially high-scoring populations, and the extent to which details about classes are washed out by reporting a single number.  Here, we extend the work of others by highlighting these pitfalls using data collected from over 12,000 students in several universities.  Ultimately, we propose an alternative metric that assesses the rate of Newtonian thinking in a class, which is more closely aligned with the description of the FCI suggested by the survey authors.",Jason Dowd,http://www.per-central.org/perc/2011/detail.cfm?ID=4171,Harvard University,"Kelly Miller, Harvard University
Brian Lukoff, Harvard University
Nathaniel Lasry, Harvard University and John Abbott College
Eric Mazur, Harvard University",2011
4138,Contributed Poster,A Comparison of Two REU Programs,"A widely used assessment tool for Research Experience for Undergraduates (REU) programs is the Survey of Undergraduate Research Experiences (SURE). [1]  A comparison of the SURE responses given by summer researchers in physics and biology in 2009 showed a difference on the perceived benefit toward understanding the research process.  In an attempt to understand this difference entrance and exit interviews on the topic were conducted with the students from both a physics and a biology REU program in the summer of 2010.  Both groups also completed the SURE. Analysis of the interview data and the SURE results will be discussed.  The REU programs are supported by grants from NSF: for physics, PHY-0851599 and for biology, DBI-0851835.  
1.  D. Lopatto, Cell Biology Education, 3, 270-277. (2004).",Sytil Murphy,http://www.per-central.org/perc/2011/detail.cfm?ID=4138,Kansas State University,Dean Zollman,2011
4181,Contributed Poster,A First Look: ISLE in a Pre-Service Teacher Science Classroom.,"Changes to the physics instruction for our pre-service middle level science teachers began in Fall 2010.  The core of those changes has been the Investigative Science Learning Environment (ISLE).  This initial implementation of an ISLE based curriculum provided an opportunity for qualitative investigation.  Students were asked a complex question requiring multiple representations and higher order thinking on their end of the quarter exam.  This poster will discuss the first iteration of the course, the question with student responses, and implications for further refinement of the use of ISLE in the pre-service teacher physics content courses.",Eric N. Rowley,http://www.per-central.org/perc/2011/detail.cfm?ID=4181,Wright State University,,2011
4048,Contributed Poster,A Large Scale Assessment of the Interaction of Lecture and Lab Interventions in Students Learning,"A large-scale assessment was conducted to assess the effectiveness of implementing lecture and lab interventions in increasing students' understanding of physics concepts and problem solving skills. Standardized conceptual and problem-solving tests (i.e., FCI & MBT) were administered to algebra-based and calculus-based introductory physics students over the course of multiple semesters. A 2 (lecture intervention: interactive engaged classrooms vs. non-interactively engaged classrooms) x 2 (lab intervention: traditional cookbook labs vs. reformed research-based labs) analysis of variance (ANOVA) was conducted. Possible synergism between the two interventions will also be discussed. A multiple regression analysis was performed to investigate the roles of students lab grade and TA effectiveness, as measured by RTOP, in students learning outcomes (i.e., FCI post scores, FCI gain scores, & MBT post scores). Supported by NIH (5RC1GM090897).",Amy Pietan,http://www.per-central.org/perc/2011/detail.cfm?ID=4048,Texas Tech University,"Beth Thacker and K. Kelvin Cheng*
Physics Department
Texas Tech University
Lubbock, Texas 79409",2011
4046,Contributed Poster,A Survey on Student Self-efficacy in Physics Problem Solving,"Self-efficacy is often described as a person's belief in her/his ability to accomplish a specific task, and is both content and context dependent. Self-efficacy is both informed by past performance (of the individual and of those considered to be peers), and can impact current performance levels.  This may be especially important for female students in science, who tend to drop out of science classrooms with much better performance records than their male counterparts.  Ethnic minorities are also under-represented in STEM fields.  Self-efficacy beliefs for both female and minority students informs course-taking patterns and career choices.  Work has been underway to develop an instrument to examine self-efficacy beliefs of students on their problem solving abilities in physics, paralleling work in math self-efficacy literature.  Analysis of student self-efficacy ratings  on physics problem solving tasks as they correlate with performance measures will be presented.  Differences by gender and ethnicity will also be analyzed.",Kimberly A Shaw,http://www.per-central.org/perc/2011/detail.cfm?ID=4046,Columbus State University,,2011
4067,Contributed Poster,A longitudinal study of the development of attitudes and beliefs towards Physics,"Student success in a Physics degree has been shown to depend on more than just performance in course assessment; important additional factors include student attitudes and beliefs about their subject. We have used an instrument (CLASS) that measures how student epistemologies evolve over the course of their undergraduate degrees. Our previous work has sampled a cross-section of students across the Physics undergraduate programme at Edinburgh in a given academic year, and found that student attitudes and beliefs remain essentially static. Here, we present fully longitudinal data collected over the past three years, where we track the evolution of attitudes and beliefs of one group of students. We find broadly similar results: attitudes and beliefs remain surprisingly consistent over time. This suggests that a cross-sectional or pseudo-longitudinal study (collecting snapshot data in one year) is a valid methodology, rather than necessarily having to wait several years to accumulate fully longitudinal data.",Ross Galloway,http://www.per-central.org/perc/2011/detail.cfm?ID=4067,University of Edinburgh,"Kate Slaughter, University of Edinburgh
Simon Bates, University of Edinburgh",2011
4113,Contributed Poster,A scalable system for teaching graphs.,"The ability to work with graphs is a necessary skill in all of the sciences, yet students still struggle with it.  Previous graph-related problems in LON-CAPA required students to pick the correct graph from a set of graphs or infer data from a given graph.  A new problem type has been developed in LON-CAPA that allows students to input (draw) graphs for themselves, in response to a given textual (or formulaic) description.  These graphs are then checked by the server, which determines whether or not the student submitted graph is correct or incorrect.  A study is underway to test the effectiveness of this approach.",James Laverty,http://www.per-central.org/perc/2011/detail.cfm?ID=4113,Michigan State University,,2011
4109,Contributed Poster,A study of student initiated questions in an introductory physics class,"We report findings of a study that investigated the features of student-initiated questions in a general introductory physics class. The questions were extracted from a small group, collaborative peer instruction learning environment. The learning environment was chosen because students freely construct dialogue in the genre of questions in such a setting.  We gained insight into the knowledge construction process by capturing and transcribing questions that arose as students i) tried to understand new ideas and ii) tried to deepen their understanding of already learned ideas. We observed, transcribed, coded and sorted the student-initiated questions for analysis. A preliminary finding is a language pattern suggestive of a questioning hierarchy. We coded questions in 3 key categories; strengthening, deepening, and extending understanding. A finer structure of hierarchy was identified by sorting on specific linguistic forms that students used, such as causal statements, counterargument, and metaphor.",Antoinette Stone,http://www.per-central.org/perc/2011/detail.cfm?ID=4109,"University of California, Davis, Ca","David Webb, Univeristy of California Davis, Ca.
Wendell Potter, University of California, Davis, Ca.",2011
4141,Contributed Poster,Adaptation and Implementation of the Physics and Everyday Thinking Curriculum in a High School Physics Classroom,"The Physics and Everyday Thinking (PET) curriculum is based on educational research and consists of carefully sequenced sets of activities intended to help students develop physics ideas through guided experimentation and questioning with extensive small group and whole class discussion.  A high school physics teacher has adapted and implemented the PET curriculum in two urban high schools with the aim of removing barriers that typically limit access to the physics curriculum. Though PET was not designed for secondary physics students, this teacher has worked closely with physics education research faculty and graduate students to simultaneously implement and investigate the impact of PET on urban high school students physics learning. Preliminary results indicate that an adapted version of PET has great potential to provide greater opportunities for access and success in understanding physics as well as the nature of science.",Shelly Belleau,http://www.per-central.org/perc/2011/detail.cfm?ID=4141,Mapleton Expeditionary School of the Arts,,2011
4104,Contributed Poster,Adapting a Theoretical Framework for Characterizing Students' Use of Equations in Physics Problem Solving,"Studies tend to focus on the resources that students activate and utilize while solving a given physics problem. However, few studies explore how students relate a given resource such as an equation, to various types of physics problems and contexts and they ascertain the meaning and applicability of that resource. We explore how students view physics equations, derive meaning from those equations, and use those equations in physics problem solving. We adapt Dubinsky and McDonalds description of APOS (action-process-object-schema) theory of learning in mathematics, to construct a theoretical framework that describes how students interpret and use equations in physics in terms of actions, processes, objects, and schemas. This framework provides a lens of how students construct their understanding of physics concepts and their relation to equations. We highlight how APOS theory can be operationalized to serve as a lens for studying the use of mathematics in physics problem solving.",Carina M. Rebello,http://www.per-central.org/perc/2011/detail.cfm?ID=4104,University of Missouri,"N. Sanjay Rebello, Kansas State University",2011
4055,Contributed Poster,Assessing Students Ability to Solve Introductory Physics Problems Using Integrals in Symbolic and Graphical Representations,"Integration is widely used in physics in electricity and magnetism (E&M), as well as in mechanics, to calculate physical quantities from other non-constant quantities. We designed a survey to assess students' ability to apply integration to physics problems in introductory physics.  Each student was given a set of 10 problems, and each set of problems had two different versions; one consisted of symbolic problems and the other graphical problems. Some students were given symbolic problems before graphical problems and others were given the problems in the opposite sequence. The purpose of this study was to investigate students skills in solving integrals they had learned after completing first semester mechanics compared to their skills after completing E&M in the second semester. We also investigated differences between the two sequences of problems.  The results from this integration survey will be presented and discussed.

This work is supported in part by U.S. National Science Foundation grant 0816207",Neelam Khan,http://www.per-central.org/perc/2011/detail.cfm?ID=4055,Georgia Gwinnett College,"Dehui Hu, Kansas State University
Dong-Hai Nguyen, Ho Chi Minh City University of Pedagogy
N. Sanjay Rebello, Kansas State University",2011
4112,Contributed Poster,Assessing Students Ability to Solve Textbook-Style Problems: Update,"Development of students problem-solving ability is commonly cited as a primary goal in introductory physics courses.  However, there is no broadly agreed upon definition of what is meant by problem solving.  Most physicists want students to successfully apply a logical yet flexible approach to solving real-world problems significantly different from any they have seen before.  Still, many introductory instructors are primarily concerned with how successfully and thoughtfully students solve standard textbook-style problems.  We report on our continuing efforts to construct and validate a 13-item survey to help assess students' abilities at solving textbook-style problems in the domains of Newtons Laws, momentum, and energy. Since the Fall of 2009, we have been beta-testing this instrument on introductory physics students (pre-instruction and post-instruction) at several institutes and on a pool of experts. In this poster, we will present details of the survey instrument, its administration, and some results from our beta-tests.",Jeff Marx,http://www.per-central.org/perc/2011/detail.cfm?ID=4112,McDaniel College,Karen Cummings,2011
4132,Contributed Poster,"Assessing a laboratory-based, inquiry-based algebra course","We discuss the assessment of a laboratory-based, algebra-based physics course, taught in an inquiry-based environment without a text. The course was designed 10 years ago and never fully assessed. The materials, developed with funding from two NSF grants (1), began as a modification of Workshop Physics (2) and evolved to incorporate materials designed for other populations (engineering students, pre-service teachers), modifying and adapting those materials for students in the algebra-based physics course and integrating them with our own materials. It is taught in an inquiry-based environment, with the students working through the materials, performing experiments, developing models (both qualitative and mathematical) and periodic Socratic dialog discussions with the instructors.  We have now assessed the course as part of a large-scale departmental assessment, using conceptual inventories, written pre- and post-tests and scientific attitude surveys, such as CLASS. We present the results and discuss the need to develop more comprehensive assessment instruments.

This project is supported by the NIH grant 5RC1GM090897-02. 

(1) CCLI #9981031: National Science Foundation - Course, Curriculum and Laboratory Improvement grant Workshop Physics with Health Science Applications. and CCLI-EMD #0088780: National Science Foundation - Course, Curriculum and Laboratory Improvement grant Humanized Physics -- Reforming Physics Using Multimedia and Mathematical Modeling.

(2)Priscilla W. Laws, Workshop Physics Activity Guide, (John Wiley & Sons, Inc., New York, 1999).",Beth Thacker,http://www.per-central.org/perc/2011/detail.cfm?ID=4132,Texas Tech University,Keith West,2011
4228,Contributed Poster,Assessment of student-driven multi-level homework,"We are investigating interactions with student-driven, multi-level homework as part of our Integrated Learning Environment for Mechanics.  Student-driven means that students choose their assignment from a set of easy (fewest points), medium, and hard (most points) problems subject to accruing a specific number of total points.  Problem levels were determined a priori based on the cognitive load of the required tasks [1] and our opinion of overall challenge.  We are assessing student interactions and performance on these problems in a number of ways: item response theory, time on task, and choice of level. We will present our findings and discuss further studies of the impact that multi-level, student-driven assignments have on students learning.

[1] R. Teodorescu, Cognitive Development in Introductory Physics: A Research-Based Approach to Curriculum Reform, Ph.D. Dissertation, The George Washington University, 2009.",Raluca E. Teodorescu,http://www.per-central.org/perc/2011/detail.cfm?ID=4228,Massachusetts Institute of Technology,"Daniel T. Seaton, Massachusetts Institute of Technology
Analia Barrantes, Massachusetts Institute of Technology
Carolin Cardamone, Massachusetts Institute of Technology
Andrew W. Pawl, University of Wisconsin - Platteville
Saif Rayyan, Massachusetts Institute of Technology
David Pritchard, Massachusetts Institute of Technology",2011
4095,Contributed Poster,Assessment of vertical transfer in problem solving: mapping the shape of problem design space,"In schema-based theories of cognition, vertical transfer occurs when a learner constructs a new schema to solve a transfer task.  Vertical transfer is interesting to study, but difficult to measure.  Did the student solve the problem with the desired schema or through a procedural heuristic?  Perhaps the problem cued the student to use certain resources without knowing why.  In this paper, we consider some of the dilemmas and trade-offs encountered in the process of problem design.  Although problems are often published as finished products, we look inside the box.  We map out the problem design space for some problems in calculus-based physics.  Free-response written or verbal assessment is crucial in measuring vertical transfer, but a quantitative problem can complement a qualitative investigation.",Joshua Von Korff,http://www.per-central.org/perc/2011/detail.cfm?ID=4095,Kansas State University,"Dehui Hu, Kansas State University
N. Sanjay Rebello, Kansas State University",2011
4162,Contributed Poster,Assessment preparation: Impacts of explicit reflection prompts on learning,"This research study addresses urban high school students' struggles with preparing for assessments.  In this study, students completed a questionnaire immediately following all quizzes and tests reflecting on several aspects of test preparation: how well they thought they did and why, how they knew what to study, what specific activities helped them prepare for the assessment, and what they will do differently to prepare for the next assessment.  Responses were analyzed for patterns in student language and metacognitive statements, examining trends in both individual students and classes over time. Responses were also correlated to assessment data and changes in instructional strategies.  Results from this study provide insight into what students do to prepare for a quiz or test, and also reveal trends in how students interpret the purpose of reflective activities.",Emily Quinty,http://www.per-central.org/perc/2011/detail.cfm?ID=4162,University of Colorado at Boulder,,2011
4072,Contributed Poster,Beyond the Standard Pedagogical Model II,"For several years, the physics department at Spelman College has used project-based instruction as a central focus of our curriculum at all levels. This presentation will describe our work on the second-semester introductory course, in which we have moved all of the circuits material to a project-based investigation conducted entirely in the lab. There are several important differences between our implementation and similar efforts such as Workshop Physics, notably the use of complex, ill-formed problems as a central focus of the pedagogy, the use of distributed expertise to drive collaboration and communication, and the improvement of process skills through iterative refinement. We will describe the foundations of our pedagogical design in cognitive and learning science and previous similar efforts in other learning contexts, contrast it with other inquiry-based designs, and describe some of what we are observing in the test and comparison classes. Data collection and processing is currently ongoing so this presentation will necessarily focus more on the design rationale than on the results. This is a more detailed discussion of a project introduced in the AAPT session FA05.",Paul J. Camp,http://www.per-central.org/perc/2011/detail.cfm?ID=4072,Spelman College,"Michael Burns-Kaurin
Derrick Hylton",2011
4052,Contributed Poster,Building blocks of a community of practice: TA professional development,"The goal of professional development (PD) for physics Teaching Assistants (TAs) is frequently about increasing their pedagogical content knowledge. Increased pedagogical content knowledge may better prepare TAs for the next week's instruction, but it is naturally tied to a specific topic, and is therefore limited. We present data from a TA PD seminar that offers pedagogical content knowledge and encourages TAs to reflect on their practice and to view their fellow TAs as resources for improving their instruction. These seminar goals are based on the idea that TAs will be see long-term benefits if they see themselves as part of a community of practice, where the practice is physics instruction. Using video data from weekly PD meetings, we report on elements are part of the establishment of a community of practice.",Renee Michelle Goertzen,http://www.per-central.org/perc/2011/detail.cfm?ID=4052,Florida International University,"Eric Brewe, Florida International University
Laird Kramer, Florida International University",2011
4054,Contributed Poster,Case Study of Students Ill-Structured Problem Solving during a Capstone Project in an Electronics Lab,"As students transition to become scientists they must develop the skills necessary to solve ill-structured problems encountered in their professional lives.  We have investigated students' ill-structured problem solving strategies during a capstone project in an upper-division electronics and instrumentation laboratory course. Prior to this project, the students had learned about electronics circuits and devices in this course through mini-lectures and laboratory activities earlier in the semester. Completing the ill-structured capstone project requires students to use their knowledge of electronics to improve the measurements done on a physics experiment they had worked on in a previous semester. As a group, the students proposed ideas to improve the measurement design and then built circuitry to implement this improved design. We describe the activities that students worked on as they completed the capstone project as well as their interactions with each other during this ill-structured task.

Supported in part by NSF grant DUE-0736897.",Nasser Juma,http://www.per-central.org/perc/2011/detail.cfm?ID=4054,Kansas State University,"Kristan L. Corwin, Brian R. Washburn, and N. Sanjay Rebello 
Kansas State University",2011
