4225,Contributed Poster,Reasoning with Physical Models,"Model-based reasoning in physics requires, among other skills, the use of deductive reasoning.  In two different contexts -- pencil and paper problems requiring qualitative reasoning, and computational activities modeling system dynamics -- we have observed that many science and engineering students in the introductory calculus-based course do not appear to be employing even simple formal deductive logic.   One of our studies focuses on modeling student deductive reasoning as a search through possibility space.  Another study focuses on designing tasks to keep students focused on a model rather than intuitive guessing, by asking them to predict the behavior of an incomplete model.  Understanding how students actually approach model-based deduction can inform the design of instruction in this and future courses (especially relativity and quantum mechanics) that rely heavily on students' ability to reason formally and their confidence in the results of such reasoning.",Ruth Chabay,http://www.per-central.org/perc/2011/detail.cfm?ID=4225,North Carolina State University,"Jonathan D.H. Gaffney, University of Kentucky;
Shawn Weatherford, Saint Leo University",2011
4087,Contributed Poster,Reinventing Time and Spacetime,"Research on learning and problem solving in upper-division physics courses reveals a significant gap between the levels of problem solving sophistication and of abstraction developed by students in traditional lower-division courses and those presumed by traditional upper-division instruction. The sophomore modern physics course focused on relativity, quantum mechanics and their applications is an ideal middle-division setting in which to help students bridge this gap. This paper is a preliminary report on a design research project to produce a modern physics curriculum that accomplishes this. Our approach tests and refines instructional design theory along with the new curriculum. The theory is grounded in cognitive science and mathematics education research on transfer and on abstraction that illuminates resource theory. The new modern physics curriculum is inspired by the Matter & Interactions introductory physics curriculum and explicitly exploits cognitive resources developed by students who have studied it.",Mark P. Haugan,http://www.per-central.org/perc/2011/detail.cfm?ID=4087,Purdue University,,2011
4059,Contributed Poster,Scaffolding students transfer of problem solving from calculus to physics,"Differentiation and integration are very powerful mathematical tools widely used in calculus-based introductory physics. Students are expected to have the prerequisite mathematical skills to solve physics problems. However, research shows that students encounter several difficulties when transferring calculus knowledge to physics problem solving. Based on the knowledge of the difficulties students encountered with the use of differentiation and integration in physics from previous studies, we are developing instructional materials aimed at facilitating students to address these difficulties in several topics in introductory physics. We have implemented these materials in group problem solving sessions aimed at enabling students to construct and apply the mathematical concepts of tangent lines, slope, Riemann sum, integration and approximation in physics contexts. We discuss the development of our instructional materials and students ability to transfer the concepts to new types of problems after our group problem solving sessions.",Dehui Hu,http://www.per-central.org/perc/2011/detail.cfm?ID=4059,"Physics Department, Kansas State University","Joshua Von Korff (Physics Department, Kansas State University)

 N. Sanjay Rebello (Physics Department, Kansas State University)",2011
4061,Contributed Poster,Scaffolding the Development of Students Mental Models of Pulleys,"Research has shown that students activate a diverse set of resources to construct a mental model of how pulley systems reduce the force needed to lift a load. We report on a study in which students enrolled in a conceptual physics laboratory spent two weeks investigating pulley systems using either physical or virtual manipulatives. Students were given written materials which guided them through a series of activities which scaffolded their construction of a mental model. They were required to make predictions and then test these predictions by building and comparing different pulley systems. Students were presented with a challenge to design the best pulley system to lift a piano at the end of each week. We compare how the students' models develop between the physical and virtual treatments as well as investigate the ways in which they use the manipulatives while completing the scaffolding activities. 

This work is supported in part by U.S. Dept. of Education IES grant award R305A080507.",Amy Rouinfar,http://www.per-central.org/perc/2011/detail.cfm?ID=4061,Kansas State University,"Adrian M. Madsen, Kansas State University
Tram Do Ngoc Hoang, Ho Chi Minh City University of Pedagogy
Sadhana Puntambekar, University of Wisconsin
N. Sanjay Rebello, Kansas State University",2011
4076,Contributed Poster,Scientific Reasoning:  Teacher and Student Connection,"In addition to promotion of inquiry-based classroom practices and increasing the level of content knowledge in the cases of both teachers and students, a major focus of the School Year Based Inquiry Learning (SYBIL) professional development program is that of scientific reasoning. While the learning of content knowledge is an important goal of K-12 science education, concepts such as process skills and reasoning ability are also becoming increasingly more prevalent aims.  Using a measure of scientific reasoning ability at both a teacher and student level, hierarchical linear modeling (HLM) analysis indicates a positive relationship between a teachers reasoning ability and the reasoning ability of his or her students. This analysis provides evidence that a teachers ability to reason scientifically affects his/her students ability to reason, and therefore a vital component of the professional development.",Jennifer Esswein,http://www.per-central.org/perc/2011/detail.cfm?ID=4076,The Ohio State University,"Bruce Patton
Jerome Mescher",2011
4080,Contributed Poster,Seeking Evidence of Reflective Practice in Learning Assistants' Writing Assignments,"One goal of Florida International Universitys  (FIU) Learning Assistant (LA) seminar is to help our participants develop as reflective practitioners.  We endeavor to reach this goal by means of classroom activities, classroom discussion, and homework assignments.  Weekly written reflections on course readings and teaching experiences are assigned to help our students learn to reflect through writing.  To assess our LAs' development in this regard, we have analyzed reflections from our chemistry, mathematics, and physics undergraduate LAs using Hatton and Smiths (1995) [1] criteria for the recognition of evidence for different types of reflective writing.  Presentation of this poster will include the results of our analysis of the level of reflection evident in our LAs writing and excerpts from a sample of the reflections illustrating their use of reflective teaching practices during their teaching experiences.
[1]Hatton, N. & Smith, D. (1995).  Reflection in teacher education:  towards definition and implementation.  Teaching and Teacher Education 11, 33-49.",Geraldine L. Cochran,http://www.per-central.org/perc/2011/detail.cfm?ID=4080,Florida International University,Laird H. Kramer and Eric Brewe,2011
4044,Contributed Poster,Should students be provided diagrams or asked to draw them while solving introductory physics problems?,Drawing appropriate diagrams is a useful problem solving heuristic that can transform the problem into a representation that is easier to exploit for solving the problem. A major focus while helping introductory physics students learn problem solving is to help them appreciate that drawing diagrams facilitates further problem solution. We conducted an investigation in which approximately 120 students in an algebra-based introductory physics course were subjected to three different interventions during the problem solving in recitation quizzes throughout the semester. They were either asked to solve problems in which the diagrams were drawn for them or they were explicitly told to draw a diagram or they were not given any instruction regarding diagrams. We developed a rubric to score problem solving performance of students in different intervention groups. We will present our findings including some surprising results for problems which involve final/initial situations. This work is supported by NSF.,Alexandru Maries,http://www.per-central.org/perc/2011/detail.cfm?ID=4044,University of Pittsburgh,"Chandralekha Singh, University of Pittsburgh",2011
4092,Contributed Poster,Socratic dialogs and clicker use in an upper-division mechanics course,"The general problem of effectively using interactive engagement in non-introductory physics courses remains open. We present a three-year study comparing different approaches to lecturing in an intermediate mechanics course at the Colorado School of Mines. In the first year, the lectures were fairly traditional. In the second year the lectures were modified to include Socratic dialogs between the instructor and students. In the third year, the instructor used a personal response system and Peer Instruction-like pedagogy. All other course materials were nearly identical to an established traditional lecture course. We present results from a new instructor-constructed conceptual survey, exams, and course evaluations. We observe little change in student exam performance as lecture techniques varied, though students consistently stated clickers were the best part of the course from which they learned the most. Indeed, when using clickers in this course, students were considerably more likely to become engaged than students in CSM introductory courses using the same methods.",Lincoln D. Carr,http://www.per-central.org/perc/2011/detail.cfm?ID=4092,Colorado School of Mines,"Patrick B. Kohl, Colorado School of Mines
H. Vincent Kuo, Colorado School of Mines
Noah D. Finkelstein, University of Colorado at Boulder",2011
4085,Contributed Poster,Speciation of energy concepts through speech and gesture in interaction,"When energy is added to a liquid to evaporate it, what is the form of energy in the gas?  Is it thermal energy, which is indicated by temperature? Is it chemical energy, which is indicated by chemical composition of a substance? [1] Maybe something else?  In a summer professional development course in the Energy Project [2] at Seattle Pacific University, secondary teachers posed this question while cooperating in Energy Theater [3] in order to figure out the energy transfers and transformations in a real refrigerator. Their negotiation of the name of this form of energy boiled down to a discussion of the difference between kinetic and potential energy.  We show how the speech and gesture that mediated the negotiation display different levels of distinction of energy concepts among the teachers, and we suggest how dynamic refinement, or speciation, of these concepts might be promoted strategically in instruction.

1. http://www.project2061.org/publications/bsl/online/index.php
2. Supported in part by NSF DRL 0822342
3. Scherr, R. E., Close, H. G., McKagan, S. B., & Close, E. W. (2010) Energy Theater: Using the body symbolically to understand energy. In C. Singh, M. Sabella, & S. Rebello (Eds.) 2010 Physics Education Research Conference Proceedings. Melville, NY: AIP Press.",Hunter Close,http://www.per-central.org/perc/2011/detail.cfm?ID=4085,Texas State University - San Marcos,"Rachel E. Scherr, Seattle Pacific University",2011
4133,Contributed Poster,Student Conversations while Completing Minimally Working Computational Models,"One learning objective of contemporary physics instruction is to introduce students to iterative predictions of motion and to some of the numerical integration techniques used to model problems that lack closed-form solutions. The Matter & Interactions introductory mechanics labs enact this objective by having student groups add the fundamental interactions and relations into a sequence of incomplete, yet functional computational models. We present an initial analysis of student conversations as they work in groups to construct a physically appropriate computational model of Rutherford Scattering. Interestingly, the students are able to invoke appropriate physics knowledge in this novel context, but they can also invoke knowledge of the analytic procedures emphasized in other aspects of the course, leading to confusions over the iterative structure of the computational models.",Brandon Lunk,http://www.per-central.org/perc/2011/detail.cfm?ID=4133,NCSU,"Ruth Chabay, NCSU.",2011
4093,Contributed Poster,Student Difficulty with non-Cartesian Unit Vectors in Upper Level E&M,"An upper level E&M course (i.e. based on Griffiths) involves the extensive integration of vector calculus concepts and notation with abstract physics concepts like field and potential.  We hope that students take what they have learned in their math classes and apply it to help represent and make sense of the physics.  To assess how well students are able to do this integration and application I have developed a simple concept test on position and unit vectors in Spherical coordinates. In this poster I describe this concept test and present results that show students at all levels (pre-E&M course, post-E&M course, 1st year graduate students) and in different disciplines (physics, electrical engineering) struggle with using non-Cartesian unit vectors.  A curriculum is being developed to address these difficulties.  Some preliminary results from this curriculum are shown.",Brant Hinrichs,http://www.per-central.org/perc/2011/detail.cfm?ID=4093,Drury University,,2011
4122,Contributed Poster,Student Problem Design: Learner-Driven Creation and Evaluation in Physics Assignments,"Writing assignments can be an effective way of getting students to practice higher-order learning skills in physics.  One example of such an assignment is that of problem design.  One version of the problem design assignment asks the student to evaluate the material from a chapter, after all instruction and other activities are complete.  The student is to decide what concepts and ideas are most central, or critical in the chapter, and construct a problem that he or she feels best encompasses the major themes.  Ideally, the designed problem could be given to another student to see if he or she truly understood the important concepts and problemsolving strategies in the chapter.  Students share these problems via Blackboard or another course web shell.  Here, we introduce the assignment and use two concept surveys (FCI and EMCS) to attempt to measure conceptual gains for students completing the problem design assignment.",Eric Mandell,http://www.per-central.org/perc/2011/detail.cfm?ID=4122,Bowling Green State University,,2011
4102,Contributed Poster,Student Understanding of Taylor Series Expansions in Statistical Mechanics,"One goal of physics instruction is to have students learn to make physical meaning of specific mathematical ideas, concepts, and procedures in different physical settings. As part of research investigating student learning in statistical physics, we are developing curriculum materials that guide students through a derivation of the Boltzmann factor, using a Taylor series expansion of entropy. Using results from written surveys, classroom observations, and both individual think-aloud and teaching interviews, we present evidence that, while many students can recognize and interpret series expansions, they often lack fluency with the Taylor series, despite previous exposures in both calculus and physics courses. We present students' successes and failures both using and interpreting Taylor series expansions in a variety of physical contexts.",Trevor I. Smith,http://www.per-central.org/perc/2011/detail.cfm?ID=4102,University of Maine,"John R. Thompson, University of Maine
Donald B. Mountcastle, University of Maine",2011
4024,Contributed Poster,Student Views of Similarity between Math and Physics Problems,"It is commonly known that students have difficulty connecting the techniques they learn in math classes with necessary steps for solving physics problems.  In this study, introductory-level physics students were given a set of pure math problems and a set of physics problems that required them to use the exact same mathematical processes.  The students were then asked to pair the analogous problems and explain the pairings.  Presented here are the results of that study, which support previous findings that students have difficulty determining how the two are connected and give some insight into what can be done to help scaffold that connection in the future.",Dyan McBride,http://www.per-central.org/perc/2011/detail.cfm?ID=4024,Mercyhurst College,,2011
4096,Contributed Poster,Student interpretation of definite integrals at the math-physics interface,"Physics students are expected to apply the mathematics learned in their mathematics courses to physics concepts and problems. Few PER studies have distinguished between difficulties students have with physics concepts and those with either mathematics concepts, application of those concepts, or the representations used to connect the math and the physics. We are conducting empirical studies of student responses to mathematics questions dealing with graphical representations of  (single-variable) integration. Reasoning in written responses could roughly be put into three major categories related to particular features of the graphs: area under the curve, position of the function, and shape of the curve. In subsequent individual interviews, we varied representational features to explore the depth and breadth of the contextual nature of student reasoning, with an emphasis on negative integrals. Results suggest an incomplete understanding of the criteria that determine the sign of a definite integral.",Rabindra Bajracharya,http://www.per-central.org/perc/2011/detail.cfm?ID=4096,University of Maine,"John R. Thompson, Thomas Wemyss",2011
4170,Contributed Poster,Students Reconciling Contradictory Commitments in Damped Harmonic Motion Problems,"In intermediate and advanced physics courses, students are expected to use mathematical, graphical, and physical reasoning, as well as their intuitions. These intuitions may contradict each other and can be inconsistent with ideas developed during small group learning activities. On the topic of damped harmonic motion, students have intuitions about the mathematics, the physics, and the way the graph of the motion should look. Students remain committed to some of these intuitions to the point of not using provided instructional resources. They also deal with contradictions when their commitments to one kind of reasoning conflict with their commitments to another (e.g., the analysis of a mathematical derivation conflicts with that of a free-body diagram summarizing physical reasoning). These multiple commitments have an effect on students' classroom discussion and the way that students reconcile contradictory commitments and conclusions.",Adam Kaczynski,http://www.per-central.org/perc/2011/detail.cfm?ID=4170,University of Maine,"Michael C. Wittmann, University of Maine",2011
4088,Contributed Poster,Students' Views of Macroscopic and Microscopic Energy in Physics and Biology,"Energy concepts are fundamental across the sciences, yet these concepts can be fragmented along disciplinary boundaries, rather than integrated into a coherent whole.   To teach physics effectively to biology students, we need to understand students' disciplinary perspectives.  We present interview data from an undergraduate student who displays multiple stances towards the concept of energy.  At times he views energy in macroscopic contexts as a separate entity from energy in microscopic (particularly biological) contexts, while at other times he uses macroscopic physics phenomena as productive analogies for understanding energy in the microscopic biological context, and he reasons about energy transformations between the microscopic and macroscopic scales.  This case study displays preliminary evidence for the context dependence of students' ability to translate energy concepts across scientific disciplines.  This points to challenges that must be taken into account in developing curricula for biology students that integrate physics and biology concepts.",Benjamin W. Dreyfus,http://www.per-central.org/perc/2011/detail.cfm?ID=4088,"University of Maryland, Department of Physics","Edward F. Redish
Jessica Watkins",2011
4149,Contributed Poster,Students Difficulties with Unit Vectors and Scalar Multiplication of a Vector,"In this article we report an investigation on students understanding of: 1) unit vectors and, 2) scalar multiplication of a vector. We administered two different tests to a total of 850 students after taking their first introductory physics course on mechanics in a large private Mexican university. The first test about unit vectors was taken by 270 students and the second test about scalar multiplication of a vector by 580 students. In the first part of this article, we analyze students' difficulties sketching the unit vector in the direction of a vector in the Cartesian coordinate plane. In the second part, we analyze students' responses in two types of problems: positive and negative scalar multiplication of a vector. In both parts of this article we describe frequent errors that have not been reported in the literature.",Genaro Zavala,http://www.per-central.org/perc/2011/detail.cfm?ID=4149,Tecnologico de Monterrey,"Pablo Barniol
Tecnologico de Monterrey",2011
4177,Contributed Poster,Successes and Constraints in the Enactment of a Relatively Successful Reform,"Despite research documenting the potentially positive impacts of research-based physics reforms, few high school physics teachers in the US enact them in their classrooms.  One of the more successfully disseminated reforms is Modeling Instruction.  Our primary research goal was to discern aspects of this reform that contributed to its widespread dissemination and organizational sustainability.  We interviewed five people who played important roles in the development of Modeling Instruction.  Drawing from the literature in communities of practice, innovation, and leadership, we analyzed the interviews to discern aspects of the reform that the interviewees felt led to some of the successes and constraints in its dissemination and sustainability.",May Lee,http://www.per-central.org/perc/2011/detail.cfm?ID=4177,University of Colorado - Boulder,"Melissa Dancy, University of Colorado - Boulder
Charles Henderson, Western Michigan University
Eric Brewe, Florida International University",2011
4156,Contributed Poster,"TRUSE Conference: Integrating undergraduate physics, chemistry and mathematics education research","In June 2010, the first of two biennial conferences on Transforming Research in Undergraduate STEM Education (TRUSE) brought together researchers in undergraduate physics, mathematics, and chemistry education to transform and integrate research across disciplines. The format included plenary talks, working groups, poster sessions and substantial unstructured time to network with colleagues and build capacity for future investigations.  Research described included projects that exemplify particular disciplinary approaches; work on trans-disciplinary topics such as transfer, representations, and reasoning strategies; and investigations on content topics that cross one or more disciplinary boundaries. After the conference, mini-grants were solicited for seed projects that could lead to longer-term interdisciplinary collaborations. A summary of the conference will be given with descriptions of sample presentations and implications for PER. The organizers will be running the conference again in 2012 with at least one more discipline being included.

Conference supported by NSF grants DUE-0941515 and -0941191. http://www.chem.purdue.edu/Towns/TRUSE/",John R. Thompson,http://www.per-central.org/perc/2011/detail.cfm?ID=4156,University of Maine,"Warren M. Christensen, North Dakota State University
Chris L. Rasmussen, San Diego State University
Marcy H. Towns, Purdue University",2011
