4163,Contributed Poster,Using Cogenerative Mediation to Assess an Aspect of Classroom Culture,"We present results of an action research project showing a class of pre-service elementary teachers (and their instructors) valuing different learning preferences at two different times during one semester of a Physics and Everyday Thinking course. This was observed using a cogenerative mediation process in which participants discussed individual preferences in order to collectively develop classroom goals near the beginning and again near the end of the course. Throughout the semester, instructors made conscious efforts to raise awareness of this aspect of classroom culture.  The data show a shift from passive (lecturing, giving a study guide, offering incentives), to more active preferences (note-taking, organization, opportunistic learning). As a result of the cogenerative process, changes were made to the course in order to facilitate teaching and learning the nature of science, in ways sensitive to everyones preferences. That sensitivity was informed by both academic literature and the specific classroom culture.",Natan Samuels,http://www.per-central.org/perc/2011/detail.cfm?ID=4163,"Florida International University, Dept. of Teaching & Learning","Eric Brewe, Florida International University, Department of Teaching & Learning

Laird Kramer, Florida International University, Department of Physics",2011
4056,Contributed Poster,Using Johnson-Laird's cognitive framework of sense-making to characterize engineering students' mental representations in kinematics,"The study investigates the kinds of mental representations constructed by engineering students at Kansas State University when solving problems in the context of kinematics. A cohort of 19 students completed six non-directed tasks posed in different representational forms (mathematical, linguistic and graphical) requiring the generation of linguistic or mathematical models. Individual interviews were conducted immediately after completing the tasks. Based on the students' actions when solving the problems together with their interview responses, two main profiles emerged from the data. Johnson-Laird (1983) cognitive framework was then related to the profiles for inferring about the categories of cognitive structures. The framework proposes three types of internal constructs: propositional representations, mental models and mental images. It is argued that comprehension occurs upon the construction of mental models. However, this study revealed that 11 in 19 participants are classified as using propositional representation while the remaining students construct a mental image.

Supported in part by NSF grant 0816207",Bashirah Ibrahim,http://www.per-central.org/perc/2011/detail.cfm?ID=4056,Kansas State University,"N. Sanjay Rebello, Kansas State University",2011
4111,Contributed Poster,Using Verbalizations To Understand How Students Think About Integration In Introductory Electromagnetism Contexts,Students in introductory physics have difficulties when applying calculus to physics problems.  The application of integration to physical situations is especially challenging yet it is crucial to several of the electromagnetism concepts taught in a typical second semester introductory course.  Understanding how students make sense of and apply integration to different physical situations could help guide future instructional development.  Individual interviews were conducted where students talked about their solution approaches for different electric field and electric potential difference problems involving the use of integrals.  A classification scheme developed to understand how students are talking about these problems will be presented.  Evidence from these interviews suggests that students approach integration in these two contexts differently.  The implications that this observation might have on instructional design will be discussed.,Jeffrey M. Polak,http://www.per-central.org/perc/2011/detail.cfm?ID=4111,North Carolina State University,Ruth Chabay - North Carolina State University,2011
4143,Contributed Poster,Using similarity ratings surveys to assess deep-structure feature emphasis during problem comparison,"Effective problem solvers are often capable of distinguishing deep-structure similarities and differences between problems (Chi et. al., 1981; Jonassen, 2000).  A pilot study conducted in the spring of 2010 provided further evidence that compare and contrast activities implemented in weekly homework assignments over a semester-long, introductory algebra-based physics course facilitated students emphasis on deep-structure details between problems.  This study also revealed a direct correlation between deep-structure emphasis and physical content (e.g., simple harmonic motion, DC circuits). To evaluate the emphasis students placed in deep-structure features, students completed pre- and post- similarity ratings surveys.  A continuation study was completed in the spring of 2011 using a similar in-class treatment, but with different content coverage in the post-treatment surveys.  We will report on the pre- and post-treatment similarity ratings for both studies, and the resultant implications.",Frances Mateycik,http://www.per-central.org/perc/2011/detail.cfm?ID=4143,Penn State Altoona,"Kendra E. Sheaffer
Penn State Altoona
kes5246@psu.edu",2011
4174,Contributed Poster,Using small-focus group interviews to assess instructional innovation,"Student evaluations can be a useful tool in judging the effectiveness of a course.  Instead of relying solely upon traditional survey-type evaluations,  We have conducted focus group interviews of students at the conclusion of various introductory physics courses (talk about which courses, i.e. experimental sections of the 2-semester University Physics sequence and from an experimental section of physical science).  These mini-focus groups of 1-4 students are conducted by an interviewer who has nothing to do with the teaching and/or grading of the class taken by the student participants.  Such interviews, although semi-structured using a protocol, provide a dynamic forum for student feedback where more in-depth probing of comments may occur.  The insights gained from these interviews with both individual and small groups of students will be discussed and the incorporation of those insights into course design will be discussed.",Jeff Saul,http://www.per-central.org/perc/2011/detail.cfm?ID=4174,University of New Mexico Dept. of Physics and Astronomy,A.N. Morgan,2011
4165,Contributed Poster,Using the Fukushima disaster as a teaching tool,"The 9.0 earthquake, tsunami and its consequences will influence global acceptance of nuclear energy. It also provides an opportunity for physics teachers to connect the science to the social reaction. This is also an opportunity to help students understand the distinction between radiation and radioactivity.",Gordon Aubrecht,http://www.per-central.org/perc/2011/detail.cfm?ID=4165,Ohio State University,,2011
4140,Contributed Poster,What Do Students Learn about Work in Physical and Virtual Experiments with Inclined Planes?,"In previous studies, we have reported a difference in how students' understanding of the physics definition of work in the context of simple machines is supported by performing experiments with physical and virtual manipulatives. We have shown that students who used the virtual manipulative (a computer simulation) before performing a physical experiment more frequently provided the correct response to multiple-choice questions about work.  In this paper, we further analyze students responses to a series of questions about work in the context of inclined planes to explore the models students used to answer the questions.  While it is possible that students who performed the physical experiment were getting penalized on the multiple-choice questions for answering in accordance with their observations (i.e. a longer ramp requires more work due to frictional effects), we actually observe students more frequently using an alternate model that a longer ramp requires less work.",Jacquelyn J. Chini,http://www.per-central.org/perc/2011/detail.cfm?ID=4140,University of Central Florida,"Adrian Madsen, Kansas State University
N. Sanjay Rebello, Kansas State University
Sadhana Puntambekar, University of Wisconsin, Madison",2011
4154,Contributed Poster,What are the Effects of Self-Assessment Preparation?,This research was conducted by an urban middle school science teacher who sought to investigate the effects of self-assessment on student performance.  A group of students were asked to give themselves a score on each learning target assessed in class and to provide evidence for their decision.  Student self-assessment scores were compared to scores given by the teacher to see if students who accurately assessed their own learning scored higher on final assessments than students who did not.  Assessment scores between groups of students who completed the self-assessment preparation and students who did not were also analyzed.  Preliminary findings will be discussed in this presentation as well as further implications for this teachers classroom.,Sara Severance,http://www.per-central.org/perc/2011/detail.cfm?ID=4154,University of Colorado Boulder,,2011
4030,Contributed Poster,What do students do when they retake an exam in small groups?,"""Pyramid exams"" (a.k.a. ""two-phase exams"") are tests in which students first take the test once on their own, turn that copy in, and then take the test again in randomly-assigned small groups. Those of us who use pyramid exams are convinced that students learn more from the test-taking experience than they would with a traditional, individual-only exam. But what do students actually DO in these situations? To address this question, we did some data-mining. Using data on students' answers and scores on each question of the exam and comparing their individual responses to the responses they chose while in the group (where group members were not required to agree), we examined the ways that students change their responses (or don't) from the individual to the group phase, and identified patterns of individual and group behavior.",Ian D. Beatty,http://www.per-central.org/perc/2011/detail.cfm?ID=4030,University of North Carolina at Greensboro,,2011
4224,Contributed Poster,What does it take to change reasoning ability?,"Data from several years and several different classes have shown that Lawson test scores do not change much over the course of a single semester, and are strongly correlated with FCI gains. So what does change Lawson scores? We have new data that we think shows that more interaction with materials that demand reasoning (and not just clicker questions and end of chapter Homework problems) improves reasoning ability and subsequently conceptual development.",Brian A Pyper,http://www.per-central.org/perc/2011/detail.cfm?ID=4224,BYU-Idaho,,2011
4211,Gallery Session Poster,"""So you're saying..."": Paraphrase and interpretation in peer physics interviews","Clinical interviews provide a laboratory for practicing components of proximal formative assessment in a one-on-one context.  As part of the Energy Project at Seattle Pacific University, learning assistants (LAs) are required to conduct, video-record, share, and reflect on individual physics interviews with a peer.  The goal of the project is to develop the LAs' real-time attention to others' thinking (proximal assessment).  In this context, LAs are asked to be guests at their interviewee's thinking and to refrain from using the interview as a teaching opportunity.  We contrast two LAs' interview experiences in terms of the ontological commitments, (in)formal use of language, and expectations about interviewing and listening that are evident in their interviewing behavior.",Eleanor C. Sayre,http://www.per-central.org/perc/2011/detail.cfm?ID=4211,Kansas State University,"Rachel E. Scherr, Seattle Pacific University
Hunter G. Close, Texas State University - San Marcos",2011
4193,Gallery Session Poster,Analysis of a Large-scale Assessment Project Using Available Assessment Instruments,"We analyze the results of a large-scale assessment project which used available conceptual inventories and locally written pre- and post-tests in the laboratories in order to assess the effectiveness of our laboratory implementation. We found that the instruments were limited in scope and not sufficient to generate an accurate assessment of all aspects of the laboratory implementation. The conceptual inventories assessed both lecture and lab and did not assess problem solving, modeling, aspects of critical thinking or laboratory skills. The locally written pre- and post-tests were limited in coverage. However, they did give information on students' thinking processes, laboratory and problem solving skills. We discuss the need for a more comprehensive assessment instrument that addresses, not just conceptual understanding, but modeling, problem solving, aspects of critical thinking, laboratory and other skills that can be used across courses and universities to evaluate the effectiveness of our instruction.",Beth Thacker,http://www.per-central.org/perc/2011/detail.cfm?ID=4193,Texas Tech University,"Keith West, Texas Tech University",2011
4194,Gallery Session Poster,Assessing Creativity and Innovation in Physics Students,"Creative thought and the ability to innovate are critical skills in industrial and academic careers alike.  There exist attempts to foster creative skills in the business world, but little such work has been documented in a physics context.  In particular, there are few tools available for those that want to assess the creativity of their physics students, making it difficult to tell whether instruction is having any effect.  In this poster we outline a new course in the Colorado School of Mines physics department designed to develop creativity and innovation in physics majors.  We present our efforts to assess this course formatively using tablet PCs and InkSurvey software, and summatively using the discipline-independent Torrance Tests of Creative Thinking.  We also describe early work towards developing a physics-specific instrument.",Patrick B. Kohl,http://www.per-central.org/perc/2011/detail.cfm?ID=4194,Colorado School of Mines,"H. Vincent Kuo, Colorado School of Mines
Susan Kowalski, Colorado School of Mines
Frank Kowalski, Colorado School of Mines",2011
4202,Gallery Session Poster,Assessing Gender Differences in Students' Understanding of Magnetism,"We investigate gender differences in students' difficulties with concepts related to magnetism.  Our research uses a multiple-choice test whose reliability and validity have been substantiated earlier.  We also conduct individual interviews with a subset of students to get a better understanding of the rationale behind their responses.  We find that females performed significantly worse than males when the test was given both as a pre-test and post-test in traditionally taught calculus-based introductory physics courses. In the algebra-based courses, the performance of females was significantly worse in the pre-test but there was no statistical difference in the post-test performance of males and females. We discuss possible reasons for these differences. Supported by NSF.",Jing Li,http://www.per-central.org/perc/2011/detail.cfm?ID=4202,"Department of Physics and Astronomy, University of Pittsburgh","Chandralekha Singh, University of Pittsburgh",2011
4188,Gallery Session Poster,Assessing Non-content Goals in Upper-Division Physics,"In addition to many content goals in specific physics subdisciplines, we all have many other goals for upper-division students, including robust mathematical, experimental, and computational skills.  Our majors should be able to bring a variety of sensemaking tools to their problem-solving: spatial and geometric reasoning, physical intuition, knowledge of the dimensions and sizes of physical quantities, and the ability to compare their answers to known special examples and limiting cases.  They should have a strong sense of how theory and experiment relate and how applications play out in the real world.  Above all, we want our majors to be self-confident problem-solvers who identify themselves as professionals, capable of learning new content and skills as necessary, and of working effectively in both independent and team environments.  In the Paradigms in Physics program at Oregon State University, we have developed a number of curricular strategies intended to foster these skills and attitudes.  During this poster session, we will attempt to facilitate discussion about research strategies that might allow us to begin assessing these non-curriculum goals.",Corinne Manogue,http://www.per-central.org/perc/2011/detail.cfm?ID=4188,Oregon State University,,2011
4192,Gallery Session Poster,Assessing Student Learning and Teaching Effectiveness in Intermediate Mechanics,"The poster will present several examples of PER-tested assessment techniques incorporated into Intermediate Mechanics Tutorials (IMT), a suite of instructional materials that itself has been modeled after published materials such as Tutorials in Introductory Physics by McDermott, Shaffer, et al., (Prentice-Hall, 2002) and Activity-Based Tutorials by Wittmann, Steinberg, and Redish (Wiley, 2004).  Much like their introductory-level counterparts, the IMT pre- and post-tutorial assessments consist of written ""explain your reasoning"" tasks designed to probe for persistent conceptual and reasoning difficulties.  In addition, the in-class IMT worksheets include instructor checkpoints for formative student feedback.  This poster will provide evidence supporting the appropriateness and effectiveness of such assessment techniques in intermediate mechanics.  Also to be discussed are selected adaptations of these methods that have been developed by pilot-testers of IMT materials as well as the author of this poster.",Bradley S. Ambrose,http://www.per-central.org/perc/2011/detail.cfm?ID=4192,"Department of Physics, Grand Valley State University",,2011
4190,Gallery Session Poster,Assessment to Complement Research-based Instruction in Upper-division Courses,"Traditional upper-division physics courses tend to focus on summative assessment through quantitative and symbolic problem-solving examination questions.  Reforming instruction suggests the need for  assessment that matches the instructional strategies.  In this poster, we describe assessment strategies implemented in two physics core courses, primarily in a thermal physics course but also in a course in mathematical methods.  Strategies include frequent formative assessment in the form of written ungraded quizzes as well as the inclusion of qualitative written problems on graded quizzes and exams.  Examples of assessment items and student responses will be shown.  In particular, we will show evidence that students at this level respond more positively to 'pretests' than one might expect, suggesting more expert-like epistemological expectations than is often the case in the introductory course.

Supported in part by NSF grant DUE-0817335.",Michael Loverude,http://www.per-central.org/perc/2011/detail.cfm?ID=4190,"Department of Physics, California State University Fullerton",,2011
4197,Gallery Session Poster,Assessments that Analyze Students' Reasoning on Written Exam Questions,"As part of a study on the science preparation of elementary school teachers, we investigated students' reasoning skills in courses with inquiry-oriented teaching strategies and their counterparts in traditional courses. Inspired by a revision of Bloom's taxonomy [1] and Neiswandt and Bellomo's [2] conceptual structure classification method, we developed assessments that would classify different levels and qualities of indications of students' reasoning ability. The assessment tools are methods of analyzing extended written questions which based on a protocol that can define the question's level of abstraction, knowledge types and cognitive processes. Along with the protocol, we developed a rubric that allowed us analytically examine students' responses through several different lenses. This approach is being test with a large amount of data that were collected nationwide from 20 different universities.  Our initial findings indicate varying results about students' reasoning abilities.",Mojgan Matloob Haghanikar,http://www.per-central.org/perc/2011/detail.cfm?ID=4197,Kansas State University,"Sytil Murphy, Kansas State University
Dean Zollman, Kansas State University",2011
4198,Gallery Session Poster,Comparing Students' Performance on Research-based Conceptual Assessments and Traditional Classroom Assessments,"The use of concept inventories to investigate students' learning gains is common in physics education research.  However, comparatively little research has compared students' learning gains on concept inventories with other more traditional assessments in the classroom.  We present a study comparing second semester calculus-based physics students' performance on traditional classroom assessments including exams and homework with learning gains on SEMCO (Survey of Electricity, Magnetism, Circuits and Optics), which was previously created by combining questions on other conceptual surveys such as CSEM and DIRECT.  We report on students' performance on specific items on SEMCO and corresponding traditional classroom assessments that are based on the same topic.  Our results can raise some potentially interesting questions on the validity and usefulness of traditional classroom assessments and conceptual assessments that are often used to measure student learning in introductory physics.",N. Sanjay Rebello,http://www.per-central.org/perc/2011/detail.cfm?ID=4198,"Physics Department, Kansas State University",,2011
4215,Gallery Session Poster,Computer Modeling Homework in Introductory Mechanics,"Introductory physics courses typically fail to provide students with significant opportunities to use a computer to solve science and engineering problems. We present an overview of recent work to develop laboratory and homework exercises on numerical modeling, simulation, and visualization for students in introductory mechanics in both high school and large enrollment university courses.",Michael F. Schatz,http://www.per-central.org/perc/2011/detail.cfm?ID=4215,Georgia Institute of Technology,"Marcos D Caballero, Georgia Institute of Technology
John B. Burk, Westminster Schools
Matthew A. Kohlmyer, North Carolina State University",2011
4200,Gallery Session Poster,Correlation Between Students' Performance on Free-response and Multiple-choice Questions,"While a multiple-choice test provides an efficient tool for assessment, instructors are often concerned that a free-response format facilitates a more accurate understanding of students' thought processes.  Moreover, free-response questions allow students to get partial credit for displaying different extent of understanding of the subject tested.  Here, we discuss a study in which two carefully designed research-based multiple-choice questions were transformed into free-response format and implemented on an exam in a calculus-based introductory physics course. Students' performance on the free-response questions was graded twice, first by using a rubric, and secondly by converting the answers back to one of the choices in the original multiple-choice format. There was an excellent match between the different free-response answers and the original choices in the multiple-choice questions. The strong correlation between the two scores graded using different methods suggests that carefully designed multiple-choice assessments can mirror the relative performance on the free-response questions.",Shih-Yin Lin,http://www.per-central.org/perc/2011/detail.cfm?ID=4200,University of Pittsburgh,"Chandralekha Singh, University of Pittsburgh",2011
4189,Gallery Session Poster,Developing and Evaluating Formative and Summative Evaluation Tools for Quantum Mechanics,"Quantum mechanics is challenging even for advanced undergraduate and graduate students. In this poster, we discuss the development and evaluation of formative and summative assessment tools for quantum mechanics. The formative assessment tools discussed include research-based concept tests as peer instruction tools, reflective homework problems and pre-tests and post-tests for various Quantum Interactive Learning Tutorials (QuILTs).  The principal summative assessment tool is the Quantum Mechanics Survey (QMS), which covers concepts in quantum mechanics in one spatial dimension in the undergraduate courses. QMS can be useful for measuring the effectiveness of various curricula and pedagogies.
This work is supported by the National Science Foundation.",Chandralekha Singh,http://www.per-central.org/perc/2011/detail.cfm?ID=4189,University of Pittsburgh,"Guangtian Zhu, University of Pittsburgh",2011
